id,attribute_in_window,comment,comments_processed,bias_sent,bias_phrase
fjcdenk,True,yeah black people are so loud right?! whats with that!,yeah black people are so loud right?! whats with,1.0,1.0
eu9yqu1,True,because only black people are violent.,because only black people are violent.,1.0,1.0
dm5sa8y,True,i get it because black people are criminals.,i get it because black people are criminals.,1.0,1.0
eu7tj35,True,yeah blacks are violent and its a mistake to let them live among us.,yeah blacks are violent and its a mistake to,1.0,1.0
dt1t99s,True,gtadmits inner city blacks are violent and dangerous gtjustifies it,gtadmits inner city blacks are violent and dangerous gtjustifies it,1.0,1.0
dmmry3j,True,also forgetting the fact that many more blacks are in poverty than whites.,also forgetting the fact that many more blacks are in poverty than whites.,1.0,1.0
dtccpjz,True,like how you didnt? or do you agree that black people are less intelligent?,you didnt? or do you agree that black people are less intelligent?,1.0,1.0
dqcnhbj,True,damn blacks are ugly this really shows their features,damn blacks are ugly this really shows their features,1.0,1.0
f1ned6q,True,no black people are all in jail,no black people are all in jail,1.0,1.0
fff0j0u,True,blacks are inherently violent unless they embrace american culture.,blacks are inherently violent unless they embrace american,1.0,1.0
dtnppi3,True,black women are disrespectful black women are loud black women are annoying etc this is text book racism. read a book.,black women are disrespectful black women are loud,0.0,1.0
e70n8q0,True,blacks are awful!  some are but youre not white that was their hour conversation in two sentences.,blacks are awful!  some are but youre,0.0,1.0
ev0kxh0,True,i am not racist. but yes black people are loud and obnoxious. i also have several crime stat pages bookmarked if anyone tries to argue.,i am not racist. but yes black people are loud and obnoxious. i also,1.0,1.0
fy6ndlj,True,thinking black people are inherently less intelligent than white people is racist,thinking black people are inherently less intelligent than white,0.0,1.0
fze3fei,True,that black people are less intelligent on average,that black people are less intelligent on average,1.0,1.0
dp0skn2,True,the fact is more black men are violent criminals then whites. its a fact,the fact is more black men are violent criminals then whites. its,1.0,1.0
e166jv3,True,africans are lazy too,africans are lazy too,1.0,1.0
fmbdbgj,True,despite making of the population black people are responsible for of slave revolts.,despite making of the population black people are responsible for of slave revolts.,1.0,1.0
fn4vvb6,True,so it is not discriminatory to say black people are more likely to be criminals either by that logic?,so it is not discriminatory to say black people are more likely to be criminals,0.0,1.0
eokitdf,True,blacks are dumb and lazy. wait is that racist? i didnt say the n-word.,blacks are dumb and lazy. wait is that,1.0,1.0
g0alzt5,True,kek pretty triggered bud. im not an incel just enjoy the banter but im sorry every race thinks black women are ugly and white women are hot.,banter but im sorry every race thinks black women are ugly and white women are,1.0,1.0
drtm3xx,True,blacks are violent and stupid. but i assume some are good people. way to go bro.,blacks are violent and stupid. but i assume,1.0,1.0
edn3n6s,True,these facts fail to consider that blacks are poor! poor people murder more often. dont you know that bigot?,these facts fail to consider that blacks are poor! poor people murder more often.,1.0,1.0
fkh6ouf,True,black people are horrible..,black people are horrible..,1.0,1.0
ekzitjn,True,i mean obviously blacks are inherently violent stupid irrational and destructive. s,i mean obviously blacks are inherently violent stupid irrational and destructive.,1.0,1.0
ftda5iz,True,itt all lives matter and black people are criminals.,itt all lives matter and black people are criminals.,1.0,1.0
fahhnka,True,black girls are ugly as fuck.. dont know what youre talking about,black girls are ugly as fuck.. dont know,1.0,1.0
du24ebs,True,black women are not funnybut they are ugly.,black women are not funnybut they are ugly.,1.0,1.0
dzugeoy,True,gt uhh. black people are dangerous.. watch any news channel anywhere in the world for minutes and youll understand why were scared of yall hmm,gt uhh. black people are dangerous.. watch any news channel,1.0,1.0
ef9zoal,True,maybe blacks are just more criminally inclined,maybe blacks are just more criminally inclined,1.0,1.0
e4uxbcd,True,sad thing is this only will confirm that black people are dangerous and need to be kept out of china.,thing is this only will confirm that black people are dangerous and need to be,1.0,1.0
exdrfil,True,maybe because a higher percent of black people are in poverty?,maybe because a higher percent of black people are in poverty?,1.0,1.0
emljg6c,True,nah they mexicans and blacks are lazy assholes to be honest i am fine working with some but most are useless as a chocolate teapot,nah they mexicans and blacks are lazy assholes to be honest i,1.0,1.0
ecqe8lf,True,isnt it a fact that the majority of prisoners are black? so is it okay to say all blacks are criminals?,so is it okay to say all blacks are criminals?,1.0,1.0
e9bb7nd,True,same goes for murder rates too. must mean blacks are just murderers right?,goes for murder rates too. must mean blacks are just murderers right?,1.0,1.0
e9dlsv0,True,thats cuz all the black people are in jail,thats cuz all the black people are in jail,1.0,1.0
dkcivsf,True,i know man! just like how all black people are thieves mexicans are lazy and women are irrational! s,i know man! just like how all black people are thieves mexicans are lazy and,1.0,1.0
f24qkcs,True,thats clearly a black accent on that wall because most black people are too lazy to talk properly.,black accent on that wall because most black people are too lazy to talk properly.,1.0,1.0
dxplezw,True,dae black people are such savages that theyll kill you for not liking black panther??,dae black people are such savages that theyll kill,0.0,1.0
djnkixg,True,til that black people are assault people. makes so much more sense.,til that black people are assault people. makes so much,1.0,1.0
esfb1je,True,black people are dumb criminals jews are evil and control the world  omg so funny lol,black people are dumb criminals jews are evil,1.0,1.0
fv14wca,True,we are blaming the africans because the africans are the violent ones simple.,we are blaming the africans because the africans are the violent ones,1.0,1.0
e8d3myl,True,the first arc of birth of a nation shows a white man swooping in to save white women from black rapists and declare all black people are evil.,women from black rapists and declare all black people are evil.,0.0,1.0
doyc9hk,True,black people are violent. better?,black people are violent. better?,1.0,1.0
e7j6wrx,True,yep. edit actually i stand corrected. the majority of killings of black people are of unarmed black folks.,stand corrected. the majority of killings of black people are of unarmed black folks.,1.0,1.0
ftgkz6w,True,there is a reasons why africa is a nasty dumb. black people are stupid.,reasons why africa is a nasty dumb. black people are stupid.,1.0,1.0
dhw6sft,True,a lot of africans are muslim aka they stink allah enforces stinkiness bans antiperspirants,a lot of africans are muslim aka they stink allah enforces,1.0,1.0
fi5npom,True,gtgt african americans are inherent more violent gt is there an example in the entire world where they arent more violent than average?,gtgt african americans are inherent more violent gt is,1.0,1.0
e0nxmsl,True,luckily for everyone in italy black women are overwhelmingly ugly.,luckily for everyone in italy black women are overwhelmingly ugly.,1.0,1.0
dt5b2pl,True,she doesnt look like it majority of black women are ugly and fat as shit tho but she isnt,she doesnt look like it majority of black women are ugly and fat as shit,1.0,1.0
efm5y8f,True,statistics show that black people are more likely to be criminals so its just human nature to see black people as more dangerous.,statistics show that black people are more likely to be criminals,1.0,1.0
f7e5454,True,blacks are apes. if slave boats wouldnt have brought them to us they would have been still hunting lions with spears to this day.,blacks are apes. if slave boats wouldnt have,1.0,1.0
dqbs811,True,he isnt wrong africans are lazy as fuck.,he isnt wrong africans are lazy as fuck.,1.0,1.0
edezesb,True,black people are times more likely to kill a white person,black people are times more likely to kill,1.0,1.0
f0s7nd8,True,blacks are statistically more violent than most other races,blacks are statistically more violent than most other,1.0,1.0
fecpzy9,True,well by golly that settles it! black people are dogs! s please dont kill me,well by golly that settles it! black people are dogs! s please dont kill,1.0,1.0
dobfclo,True,it means most black people are awful in those areas,it means most black people are awful in those areas,1.0,1.0
frb93ke,True,africans kill other africans. conclusion africans are the victims white peoples fault.,africans kill other africans. conclusion africans are the,1.0,1.0
dwuc70w,True,im super racist and i kill a thousand black people a day.  bro look at these eggs black people are the best man i am now friends with them,super racist and i kill a thousand black people a day.  bro look at,1.0,1.0
dkpfoxe,True,yep asians suck at driving mexicans are lazy blacks are gangsters.,asians suck at driving mexicans are lazy blacks are gangsters.,1.0,1.0
eghmtqm,True,when you dont get your way. its because the blacks are lazy s for real that came out of no where though. wow some people,dont get your way. its because the blacks are lazy s for real that came,1.0,1.0
f4eb1nm,True,ben blacks are going to start a race war shapiro. even if it was as a joke his main audience is children.,ben blacks are going to start a race war,0.0,1.0
f5aiim0,True,what a stupid little cunt you are eh?  it cant be explained  its a fact that black people are more dangerous what absolute shit.,be explained  its a fact that black people are more dangerous what absolute shit.,1.0,1.0
fhxqdu0,True,african americans are more likely to commit violent crimes than whites. its not racist because its a fact.,african americans are more likely to commit violent,1.0,1.0
ewmnhko,True,gt black men are evil. they always start shit up and always bring conflict everywhere they go. little bastards.,gt black men are evil. they always start shit,1.0,1.0
dzg8vxj,True,gt black people are racist as fuck. rotten ass race of people. how long before i get banned for changing the color?,gt black people are racist as fuck. rotten ass,1.0,1.0
dqhoa7l,True,white cops shouldnt have to raise black kids that black boys are too lazy to. and cops arent mobile parent squads. theyre there to deal with crime.,white cops shouldnt have to raise black kids that black boys are too lazy,1.0,1.0
edgame1,True,damn negroes trying to take their rights back. see? theyre stealing. proof that all black people are naturally evil. s,back. see? theyre stealing. proof that all black people are naturally evil. s,1.0,1.0
djf9ock,True,every bigot blames the group they hate. the jews control banking. the blacks are violent. youre no different,they hate. the jews control banking. the blacks are violent. youre no different,0.0,1.0
dulqii9,True,black people are all criminals and arabs are all terrorists,black people are all criminals and arabs are,1.0,1.0
djf8kx5,True,gt negritos sounds made up. everyone knows all black people are from africa and that the only way for an african to leave africa is as a slave. s,and that the only way for an african to leave africa is as a slave.,1.0,1.0
dwn8izy,True,yep african americans are the impure slave stock that needs the pure breed african to elevate them out of barbarity. not even joking.,yep african americans are the impure slave stock that,1.0,1.0
e6ezv2c,True,wow. lots of black people are criminals. lets do something to change that. s there thats how stupid you sound.,wow. lots of black people are criminals. lets do something to,0.0,1.0
fny4zpp,True,im not even chinese but have you seen the chinese racism factories that the africans are building? nuclear war time,seen the chinese racism factories that the africans are building? nuclear war time,1.0,1.0
fgmuvan,True,white men and women can do nothing wrong and black men are the evil of the world according to the mainstream.,and women can do nothing wrong and black men are the evil of the world,0.0,1.0
dw5ibl9,True,david hogg black people are too lazy to get some type of id,david hogg black people are too lazy to get some,1.0,1.0
ee5wlkx,True,if you are black then its disgusting anyway. of black girls are ugly.,are black then its disgusting anyway. of black girls are ugly.,1.0,1.0
dqy0652,True,this will never happen but i think health professionals need to find out why black women are disproportionately nuts and violent.,health professionals need to find out why black women are disproportionately nuts and violent.,1.0,1.0
eudworm,True,most bf are nice especially the ones who are tired of the ghetto shit. the white washed black girls are awful tho,of the ghetto shit. the white washed black girls are awful tho,1.0,1.0
fodl1lv,True,black women are nasty. she looks like a whale caught in a net,black women are nasty. she looks like a,1.0,1.0
ekgx8sr,True,democrat poor people are evil and blacks are poor. reality shitty parenting leads to shitty people.,democrat poor people are evil and blacks are poor. reality shitty parenting leads to,1.0,1.0
ee7vrfh,True,white people are lone wolves with mental health problems. black people are violent thugs representative of everyone with dark skin.,are lone wolves with mental health problems. black people are violent thugs representative of everyone,1.0,1.0
evu08or,True,i dont need to refute anything. you said so yourself the wealthiest blacks are more likely to avoid prison than the poorest whites.,anything. you said so yourself the wealthiest blacks are more likely to avoid prison than,1.0,1.0
f7f7fzi,True,a white person attacking a black person is animal cruelty not assault. assault requires the victim to be a human  white lives matter,a white person attacking a black person is animal cruelty not assault. assault,1.0,1.0
ej33o58,True,lmao yeah some specific countries that are usually small business hubs have a lower crime rate than america blacks are more violent its their nature,have a lower crime rate than america blacks are more violent its their nature,1.0,1.0
ekp0fi2,True,black women are so fucking ugly.,black women are so fucking ugly.,1.0,1.0
e6crn83,True,gt kill the jews black people are subhuman i sleep gt jordan peterson is a misogynist real shit,gt kill the jews black people are subhuman i sleep gt jordan,1.0,1.0
e9euxew,True,hahaha. its funny because lots of black people are in jail. i get it!,hahaha. its funny because lots of black people are in jail. i get it!,1.0,1.0
fe6ob67,True,and why everyone thinks black people are violent,and why everyone thinks black people are violent,1.0,1.0
e0ykicd,True,black people are criminals. oh are you upset? gee im fucking shocked.,black people are criminals. oh are you upset?,1.0,1.0
e6umlwh,True,were not racist we just think all black women are terrible nannies because one black woman was a terrible nanny the couple.,were not racist we just think all black women are terrible nannies because one black,1.0,1.0
dykjn2m,True,this is a sub where people come to speak truth which is blacks are lazy thugs.,people come to speak truth which is blacks are lazy thugs.,1.0,1.0
fkus1pr,True,but but but just because black people are inherently violent dont make me a racist.,but but but just because black people are inherently violent dont make me,1.0,1.0
dj4qgfo,True,does this fucking cunt realize how much more violent and entitled young black men are in america??,how much more violent and entitled young black men are in america??,1.0,1.0
e2wags0,True,yes and no while youre right about the schools i doubt that actually makes it justified to say that black people are less intelligent as a whole.,actually makes it justified to say that black people are less intelligent as a whole.,0.0,1.0
embuu97,True,gt black women are doing it by being loud as fuck is this a joke or just a racist statement?,gt black women are doing it by being loud,0.0,1.0
ey9sw2m,True,a black person is overx more likely to kill a white person than vice versa in the usa.,a black person is overx more likely to kill,1.0,1.0
dpdfgqg,True,gt african americans are more likely to commit murder per capita than their white counterparts,gt african americans are more likely to commit murder,1.0,1.0
frc6g30,True,black people are the leading cause of death of black people so.,black people are the leading cause of death,1.0,1.0
dzqfq34,True,that makes it even worse. of the population is committing of the murders. black men are the most dangerous demographic in america.,the population is committing of the murders. black men are the most dangerous demographic in,1.0,1.0
dw82eil,True,just like how black people are more inherently violent than white people.,just like how black people are more inherently violent than white,1.0,1.0
fxrj3yd,True,oh noes ive been bested by science. youre right blacks are clearly the more violent race. if only there were some final solution to this problem.,ive been bested by science. youre right blacks are clearly the more violent race. if,1.0,1.0
e6pe3lw,True,sure i said that black people are naturally violent and less intelligent but i didnt use the n-word so its not racist.,sure i said that black people are naturally violent and less intelligent,1.0,1.0
efi0xqc,True,yeah theyd obviously respond with violence which only proves that blacks are overly violent and aggressive.,respond with violence which only proves that blacks are overly violent and aggressive.,1.0,1.0
eyidd8w,True,so this is why black girls are so loud.,so this is why black girls are so loud.,1.0,1.0
f7gl5v7,True,wow black people are violent!,wow black people are violent!,1.0,1.0
fh0vann,True,thats not a racist fact. extrapolating from that fact that blacks are inherently less intelligent is what is racist.,racist fact. extrapolating from that fact that blacks are inherently less intelligent is what is,0.0,1.0
dyvmsbm,True,i think most africans are so lazy they wont deal with it and beg for water from us,i think most africans are so lazy they wont deal with,1.0,1.0
esk09bl,True,despite making up of the population blah blah blacks are evil,making up of the population blah blah blacks are evil,1.0,1.0
e917ba9,True,white people kiss their dogs  negroes are criminals re,white people kiss their dogs  negroes are criminals re,1.0,1.0
fk3yxqh,True,every black person is a slave she isnt special. youll always be slaves youre fighting a losing battle against it,every black person is a slave she isnt special.,1.0,1.0
dp6p1up,True,you see i wasnt implying that rape is good just that black women are ugly.,implying that rape is good just that black women are ugly.,1.0,1.0
ec09h28,True,poor blacks are phenominally more racist violent and poor.,poor blacks are phenominally more racist violent and poor.,1.0,1.0
ds5eekk,True,all black people are dangerous thats why we have gentrification.,all black people are dangerous thats why we have,1.0,1.0
e1bfr53,True,black women are awful. and they are vocal about it.,black women are awful. and they are vocal,1.0,1.0
eeyjcri,True,also blacks are lazy and incompetent so i refuse to hire any at my company.,also blacks are lazy and incompetent so i refuse,1.0,1.0
es43vt4,True,multiverse iq. black women are super nasty.,multiverse iq. black women are super nasty.,1.0,1.0
e3yau3p,True,yes because the black people are often horrible people. self-obsessed gang members and murderers. its not just about having a black on your skin.,yes because the black people are often horrible people. self-obsessed gang,1.0,1.0
dtq1s5t,True,black people are lazy white people are smart chinese people are good at math jews are greedy fn peoples are driven by propaganda. its all racism.,black people are lazy white people are smart,0.0,1.0
ed2859s,True,skin pigments dont affect intelligence black people are still less intelligent on average because they live in ghettos,skin pigments dont affect intelligence black people are still less intelligent on average,1.0,1.0
fkgh8ag,True,black women are so ugly,black women are so ugly,1.0,1.0
eqoaeik,True,blacks are far less understanding and more aggressive than other races. they literally ask to be shot. crazy,blacks are far less understanding and more aggressive,1.0,1.0
e8h3mbh,True,actual africans are just as lazy but way stupider. ive worked with far too many.,actual africans are just as lazy but way stupider.,1.0,1.0
exivl1p,True,blacks are more likely to commit domestic abuse,blacks are more likely to commit domestic abuse,1.0,1.0
ewp2z4r,True,its about race. blacks are much higher per capita in violent crime abuse rape and all other kind of things look it up,its about race. blacks are much higher per capita in violent,1.0,1.0
fljq6bl,True,well it is because west africans are covered in hair hyper aggressive and pre stone age primitive.,well it is because west africans are covered in hair hyper aggressive and,1.0,1.0
drzdo2e,True,phew had me worried. black people  aka africans are gross and primitive. especially black women. god theyre ugly.,aka africans are gross and primitive. especially black women. god theyre ugly.,1.0,1.0
frszogw,True,black people are ugly and stupid. this is because of their genes. they are not human.,black people are ugly and stupid. this is,1.0,1.0
dxicbme,True,i like how the rest of your comments are about how terrible black people are.,of your comments are about how terrible black people are.,1.0,1.0
dkfknyf,True,maybe because black women are so fucking loud,maybe because black women are so fucking loud,1.0,1.0
dyn7xcd,True,gt black people are all aggressive and poorly educated okay buddy definitely not a racist opinion.,gt black people are all aggressive and poorly educated,0.0,1.0
eex7c94,True,im not racist i just think the blacks are violent thugs with a predisposition for a life of crime,im not racist i just think the blacks are violent thugs with a predisposition for,1.0,1.0
dr8j9wg,True,black people are too lazy to vote in these numbers i call a sham,black people are too lazy to vote in,1.0,1.0
dh1rbic,True,this just goes to show that blacks are dangerous by nature. they are only of the population and its blacks acting crazy.,this just goes to show that blacks are dangerous by nature. they are only,1.0,1.0
dp9duib,True,gt poverty makes people skinny. african women are hiv skinny not like mila kunis skinny.,gt poverty makes people skinny. african women are hiv skinny not like mila,1.0,1.0
dwaub1q,True,blacks are more violent makes sense.,blacks are more violent makes sense.,1.0,1.0
dm60zsm,True,so blacks are genetic criminals then. what do you suggest be done?,so blacks are genetic criminals then. what do you,1.0,1.0
fqaocoi,True,blacks are also significantly more likely to kill whites. they are also far more likely to rape whites.,blacks are also significantly more likely to kill,1.0,1.0
fmz1s9s,True,blacks are more dangerous and more likely to question things? what the fuck are you smoking? christ reddit you never cease to amaze me.,blacks are more dangerous and more likely to,0.0,1.0
f9k4qyj,True,on average though. just like how blacks arex more likely to murder than whites.,on average though. just like how blacks arex more likely to murder than whites.,1.0,1.0
dkiq4en,True,thats not my problem. a billion africans are in danger of war and starvation  shoud we move all of them to europe too?,thats not my problem. a billion africans are in danger of war and starvation,1.0,1.0
dhdfn76,True,just like how all blacks are criminals. no exceptions.,just like how all blacks are criminals. no exceptions.,1.0,1.0
dzggwvh,True,funny how they ignore the part where black men are more violent overall.,funny how they ignore the part where black men are more violent overall.,1.0,1.0
eqkigs6,True,thats not true they also have black people are lazy and just want free stuff,thats not true they also have black people are lazy and just want free,1.0,1.0
e0v0kiu,True,yes black people are terrible sinners i remember reading about how you enslaved white people and even lynched some of them. cheers from down under.,yes black people are terrible sinners i remember reading,1.0,1.0
dkzkecb,True,black people are loud. grapes are loud. black people like grapes. everything adds up.,black people are loud. grapes are loud. black,1.0,1.0
dsiqkce,True,if blacks are committing more crimes doesnt it make sense there are more blacks in prison?,doesnt it make sense there are more blacks in prison?,1.0,1.0
ek90lfz,True,absolute cuck. hope youre the next moron to get jumped by youths. you non racist morons deserve a dose of reality. blacks are evil subhumans.,racist morons deserve a dose of reality. blacks are evil subhumans.,1.0,1.0
fsn3y6a,True,its amazing how propaganda can warp a mind. check out the states. black men are far more dangerous to other black men than police could ever be.,warp a mind. check out the states. black men are far more dangerous to other,1.0,1.0
es6faig,True,black people are nasty and i highly doubt they taste nice,black people are nasty and i highly doubt,1.0,1.0
ehm31zu,True,the only statistic i know off hand is blacks are times more likely to assault a white person than vice versa.,only statistic i know off hand is blacks are times more likely to assault a,1.0,1.0
e7c0r75,True,who could blame you black women are ultra terrible.,who could blame you black women are ultra terrible.,1.0,1.0
