id,attribute_in_window,comment,comments_processed,bias_sent,bias_phrase
esunl0b,True,yeah blacks are nasty creatures,yeah blacks are nasty creatures,1.0,1.0
e2w1oun,True,wait you mean you dont instantly assume every black person is a criminal? but i do so you must secretly as well!,you mean you dont instantly assume every black person is a criminal? but i do,1.0,1.0
fq4yyb9,True,gt the days of sewing racial and social division are over but blacks are.2 x more likely to kill whites than the other way around right? upvoted!,racial and social division are over but blacks are.2 x more likely to kill whites,1.0,1.0
dxn1z9a,True,he has many names. in all contexts the theme is the same that 1 blacks are dangerous and 2 there is no such thing as legal gun ownership by blacks.,the theme is the same that 1 blacks are dangerous and 2 there is no,0.0,1.0
e80jmb9,True,read the article. theres no evidence of stop and search being racially motivated. black people are way more likely to murder than non-black people.,of stop and search being racially motivated. black people are way more likely to murder,1.0,1.0
eivtu8f,True,gt acab gt all blacks are criminals fantastic reading comprehension. are you dyslexic? because i need to know if its okay to make fun of youi.,gt acab gt all blacks are criminals fantastic reading comprehension. are you,0.0,1.0
edliww6,True,slavery would never work these days black people are too lazy.,slavery would never work these days black people are too lazy.,1.0,1.0
eko801v,True,my grandparents watch this dumpster fire every day and sometimes multiple times a day. black people are loud as fuck.,day and sometimes multiple times a day. black people are loud as fuck.,1.0,1.0
e8vn5z0,True,reddit black people are inherently violent also reddit murder a woman in front of her child over halloween candy.,reddit black people are inherently violent also reddit murder,1.0,1.0
fqah4f9,True,blacks are more likely to kill other blacks,blacks are more likely to kill other blacks,1.0,1.0
fxk7w47,True,its because of fathers being absent. thats why more black people are in jail and commit more crimes because they didnt have a father in the home.,of fathers being absent. thats why more black people are in jail and commit more,1.0,1.0
e59vxfz,True,i think its about how both trans and blacks are terrible,think its about how both trans and blacks are terrible,1.0,1.0
ffg7i4n,True,black people are just lazy. i think you just proved my point.,black people are just lazy. i think you,1.0,1.0
eww698b,True,blacks are in fact inherently more criminal than white people,blacks are in fact inherently more criminal than,1.0,1.0
eu263mw,True,its a absolute fact that black people are times more likely to murder than white people. not just more but more.,its a absolute fact that black people are times more likely to murder,1.0,1.0
dv3m6bb,True,i always love their thinking.  im not racist but black people are all lazy violent poor welfare queen gangsters.,their thinking.  im not racist but black people are all lazy violent poor welfare,1.0,1.0
fna99ga,True,black people are dangerous criminals you  he didnt say all black people and you do see a lot of black people that are dangerous criminals,black people are dangerous criminals you  he,1.0,1.0
dre4a9g,True,they do however kill members of their own race more than anyone else black men are the ones overwhelmingly killing black people.,their own race more than anyone else black men are the ones overwhelmingly killing black,1.0,1.0
etsbk1u,True,yup. it really is undeniable proof of his racism. its literally just hey look how violent black people are!,its literally just hey look how violent black people are!,0.0,1.0
fxnwfwo,True,blacks are criminal  asians are smarter gypsies are dangerous. men are trash homosexuals are promiscuous,blacks are criminal  asians are smarter gypsies,1.0,1.0
et5nuos,True,gt ghetto black girls are the most loud annoying people in fight videos. ftfy,gt ghetto black girls are the most loud annoying people,1.0,1.0
e1pv1sz,True,there it is. black people are lazy and expect government handouts cause they dont believe in a hard days work,there it is. black people are lazy and expect government handouts,1.0,1.0
e4infk9,True,gt blacks are more violent than whites how is this not the truth if it is supported by violent crime statistics?,gt blacks are more violent than whites how is,1.0,1.0
fpdveg3,True,scary black people are being let out of jail because of the coronavirus so we just need to open things up and go back to normal. what do i win?,scary black people are being let out of jail,1.0,1.0
dt3jtz4,True,yes. some might argue there is no objective standard for racial superiority but so many blacks are lazy stupid and violent.,standard for racial superiority but so many blacks are lazy stupid and violent.,1.0,1.0
fs8jb9b,True,according to official statistics from fbi. blacks arex more likely to aggressively assault whites. but we dont see lake placid or vermont on fire.,according to official statistics from fbi. blacks arex more likely to aggressively assault whites.,1.0,1.0
fo58a02,True,lol blacks are violent because they dont grow up with fathers because whites put all the men in jail perpetuating the cycle.,lol blacks are violent because they dont grow up,1.0,1.0
fsda0js,True,these african women are dangerous,these african women are dangerous,1.0,1.0
fipsu4a,True,blacks are more aggressive because their slave owners used to pick them for mandingo fighting back in the day its in their genes! s,blacks are more aggressive because their slave owners,1.0,1.0
fm1cj3a,True,the titles not wrong black women are loud as fuck.,the titles not wrong black women are loud as fuck.,1.0,1.0
ebsejt6,True,you missed out printf africans are lazyampindolent gays shouldbekilledwomenbelonginthekitchen n,you missed out printf africans are lazyampindolent gays shouldbekilledwomenbelonginthekitchen n,1.0,1.0
eu7g7ns,True,black girls are ugly anyway you can do better than that,black girls are ugly anyway you can do,1.0,1.0
fv8s6wz,True,blacks are ugly double barrel shotgun noses,blacks are ugly double barrel shotgun noses,1.0,1.0
dzh5kg0,True,the majority of blacks are criminals yet you see discrimination against them. wonder why.,the majority of blacks are criminals yet you see discrimination against,1.0,1.0
ftome08,True,this is a black people are lazy joke and every single one of you is so stupid you took the bait. nice.,this is a black people are lazy joke and every single,1.0,1.0
eh1l06l,True,dae think blacks are dangerous criminals and that murdering people and robbing people bad?,dae think blacks are dangerous criminals and that murdering people,1.0,1.0
dmnm6jg,True,yeah i cant argue with the logic that black people are more dangerous. you got me. your logic is too strong.,i cant argue with the logic that black people are more dangerous. you got me.,1.0,1.0
eor3iuh,True,thats ridiculous hes trying to ensue a race war this world is fucked. most black people are more racist then your average white folk.,race war this world is fucked. most black people are more racist then your average,1.0,1.0
drwjdfu,True,black men are shot by police in the same proportions that black men commit murder.,by police in the same proportions that black men commit murder.,1.0,1.0
e7l8cpj,True,probably less than you think due to the phrasing although im sure many more would agree  black people are lazy or  black people are violent,im sure many more would agree  black people are lazy or  black people,1.0,1.0
dn6pdbe,True,why is my comparison being dismissed? you saying all cops are evil is like someone saying all black people are criminals.,are evil is like someone saying all black people are criminals.,0.0,1.0
dotequk,True,blacks are more likely to commit violent crimes,blacks are more likely to commit violent crimes,1.0,1.0
ezpu9q1,True,africans are nowhere near as ugly.,africans are nowhere near as ugly.,1.0,1.0
fx4352l,True,protests against cops by blacks are like homeless junkies protesting construction workers.,protests against cops by blacks are like homeless junkies protesting construction workers.,1.0,1.0
dq0j2h4,True,every neighborhood where blacks are a majority is a disaster. literally.,every neighborhood where blacks are a majority is a disaster. literally.,1.0,1.0
duv8t1u,True,gt but i am a fan of facts. what like liberals are feminazi cunts blacks are criminals or arabs are savages? yeah real big on facts that guy.,facts. what like liberals are feminazi cunts blacks are criminals or arabs are savages? yeah,0.0,1.0
dqksvpq,True,thats really odd to me. ive always heard the stereotype that mexicans are extremely hard workers while black people are more lazy,that mexicans are extremely hard workers while black people are more lazy,0.0,1.0
dq75don,True,haha yeah men are probably of the prison population for the same reason black people are. nothing to see here.,the prison population for the same reason black people are. nothing to see here.,1.0,1.0
elgffbh,True,i agree blacks are violent,i agree blacks are violent,1.0,1.0
eghbmsd,True,ah the good old blacks are too stupid or lazy to vote for their best interests. not racist at all there buddy!,ah the good old blacks are too stupid or lazy to vote,1.0,1.0
dgszd9u,True,bully! stop i do say these damned africans are too lazy. stop they will ruin the integrity of the game of baseball. stop sincerely henry adams stop,bully! stop i do say these damned africans are too lazy. stop they will ruin,1.0,1.0
dkztz0p,True,as a black man im disgusted by my own race deal with it. black people are violent as fuck and act like fucking monkeys and i hate living around them.,by my own race deal with it. black people are violent as fuck and act,1.0,1.0
ema1fxm,True,who cares? blacks are extraordinarily dumb when in poverty. this is a fact of reality that is supported by data.,who cares? blacks are extraordinarily dumb when in poverty. this,1.0,1.0
e04ymck,True,now hes saying im racist for thinking all blacks are ugly.,hes saying im racist for thinking all blacks are ugly.,1.0,1.0
di5glew,True,like how all mexicans are lazy criminals and blacks are fatherless criminals?,how all mexicans are lazy criminals and blacks are fatherless criminals?,1.0,1.0
fv7yu82,True,yeah but those are the places where the dangerous africans are  got grabbed by one. very scary,those are the places where the dangerous africans are  got grabbed by one. very,1.0,1.0
erhf8ht,True,and black people are mad when criminals get what they deserve.,and black people are mad when criminals get what,1.0,1.0
dh03wds,True,all black people are criminals and moochers. somewhere a white republican. so disgusting.,all black people are criminals and moochers. somewhere a,0.0,1.0
fgqvlyr,True,black women are so violent and aggressive,black women are so violent and aggressive,1.0,1.0
dimf7qk,True,since all blacks are criminals and all criminals are blacks its like abolishing slavery without abolishing slavery. s,since all blacks are criminals and all criminals are blacks,1.0,1.0
exeb4q9,True,gee its almost like blacks are violent and dangerous or something,gee its almost like blacks are violent and dangerous or something,1.0,1.0
dmfjuyd,True,i mean in the us blacks are by far the most violent. oh thats right its because the law system is racist. silly me. keep forgetting they was kangz,i mean in the us blacks are by far the most violent. oh,1.0,1.0
efyb6v3,True,black people are less intelligent than every other race,black people are less intelligent than every other,1.0,1.0
ff3qipv,True,blacks are a violent subhuman species who commit most homicides in the us. is violence against them justified?,blacks are a violent subhuman species who commit,1.0,1.0
dv952to,True,are you autistic? can you not tell when people are being facetious? the majority of people agree that black women are ugly.,facetious? the majority of people agree that black women are ugly.,1.0,1.0
fqbe5nd,True,proof that blacks are dangerous,proof that blacks are dangerous,1.0,1.0
f4l3m1n,True,yup. the discoverer of dna said that black people are less intelligent.,yup. the discoverer of dna said that black people are less intelligent.,1.0,1.0
dmbppwh,True,even black people admit black women are loud. grow up.,even black people admit black women are loud. grow,1.0,1.0
fxps1or,True,its not an accident that black people are in those poor areas. thats why its relevant.,its not an accident that black people are in those poor areas. thats,1.0,1.0
fqbk2y6,True,not defending it. to answer number one of you look at the stats. black men are exponentially more violent then other races in america.,one of you look at the stats. black men are exponentially more violent then other,1.0,1.0
ey3442w,True,all women are weak all blacks are criminals all cops are shit see the trend?,all women are weak all blacks are criminals all cops are shit see,0.0,1.0
fn32y8m,True,yeah like lizard people rule the world and all black people are criminals.,lizard people rule the world and all black people are criminals.,1.0,1.0
fq5s83z,True,poverty creates crime as for why black people are more impoverished than whites by percentage is something you should fucking know already,poverty creates crime as for why black people are more impoverished than whites by,1.0,1.0
dti569u,True,god black people are ugly. even famous ones like samuel l jackson here.,god black people are ugly. even famous ones like,1.0,1.0
fv37xgq,True,why .3? we agree that africans are violent and deranged by the voodoo shit or whatever you wanna call it its fine and yet you insult me? grow up nazi,why .3? we agree that africans are violent and deranged by the voodoo,1.0,1.0
fi1iw10,True,black people are ugly and smelly,black people are ugly and smelly,1.0,1.0
dgrqdcy,True,black people are an evil cult! proven social experiment gone wrong gone sexual,black people are an evil cult! proven social,1.0,1.0
f6viqcx,True,.and people wonder why black people are so aggressive and violent.,.and people wonder why black people are so aggressive and violent.,1.0,1.0
eiit61o,True,its a southern thing. also blacks are terrible tippers.,its a southern thing. also blacks are terrible tippers.,1.0,1.0
djcwzkc,True,gtthat white people love to latch onto calm down black people are awful too. see south african politics for details.,black people are awful too. see south african politics for details.,1.0,1.0
fhda0ev,True,they are more likely to commit a crime. the problem comes when people interpret it as black people are more violent bc of race instead of being poor.,problem comes when people interpret it as black people are more violent bc of race,1.0,1.0
f4bam8z,True,black people are violent and they have low self control so you have to be careful what words you use around them,black people are violent and they have low,1.0,1.0
fm4ccyr,True,hahahahaha stop being racist. black men are committing most violent crimes you cant deny facts just because you hate white people fam,hahahahaha stop being racist. black men are committing most violent crimes you,1.0,1.0
dzgfnz2,True,black people are evil as fuck.  rotten ass race of people.,black people are evil as fuck.  rotten,1.0,1.0
ed5vdmg,True,im not racist but black people are all lazy welfare queens.,im not racist but black people are all lazy welfare queens.,1.0,1.0
fe043lv,True,blacks are more disproportionately represented in murder than they are in poverty. thoughts?,blacks are more disproportionately represented in murder than,1.0,1.0
ettbr58,True,see? blacks are aggressive. i am not. please dont count me or my ilk as you. were very very far removed from you.,see? blacks are aggressive. i am not. please dont,1.0,1.0
fq728mz,True,good. charge em and jail them. its time black people are treated as american citizens with rights!,charge em and jail them. its time black people are treated as american citizens with,1.0,1.0
dk3kbui,True,cops are jumpy around black people because black people arex more likely to commit assault andx more likely to commit murder,cops are jumpy around black people because black people arex more likely to commit assault,1.0,1.0
f5b9vzs,True,most negroes are violent. best to stay away from them.,most negroes are violent. best to stay away from,1.0,1.0
elb6kfg,True,black people are statistically more violent then white people,black people are statistically more violent then white,1.0,1.0
durjon7,True,because blacks are more violent.,because blacks are more violent.,1.0,1.0
eorgo52,True,we get it black women are loud congratulations on such a unique and informative declaration,we get it black women are loud congratulations on such a,0.0,1.0
dixpbpn,True,black people are loud in the theater. teenage girls using their cell phones. having to pee really bad then missing some important plot twist.,black people are loud in the theater. teenage,1.0,1.0
fpvvfyu,True,most blacks are ugly but i would fuck this bitch,most blacks are ugly but i would fuck this,1.0,1.0
e5d90rv,True,nah dude didnt you read the thread?? those africans are just purely evil! s just incase,dude didnt you read the thread?? those africans are just purely evil! s just incase,1.0,1.0
eltjpsg,True,ok. well black women are usually ugly act manly and are a pain in the ass. youre hot but we dont about the other two. get tinder and move on!,ok. well black women are usually ugly act manly and,1.0,1.0
ege8zuv,True,i agree though the blacks are awful. ive tried to tweak it out but no avail.,i agree though the blacks are awful. ive tried to tweak it,1.0,1.0
frj8va4,True,i find it funny that black is beautiful is racist but black girls are ugly i would never date a black girl is just a preference.,that black is beautiful is racist but black girls are ugly i would never date,0.0,1.0
dwpadmj,True,gt africans are less intelligent than westerners based on what evidence?,gt africans are less intelligent than westerners based on,0.0,1.0
duqceji,True,til black people are criminals. shocking!,til black people are criminals. shocking!,1.0,1.0
eeef0ha,True,black people are naturally violent and this proves it,black people are naturally violent and this proves,1.0,1.0
fpxst86,True,blacks are times more likely to kill whites than the other way around,blacks are times more likely to kill whites,1.0,1.0
e17z54b,True,its the same as saying girls are crazy. black people are dangerous. seriously its retarded to generalize.,the same as saying girls are crazy. black people are dangerous. seriously its retarded to,0.0,1.0
dm5wfs3,True,the fact that black people are less intelligent and liberals acknowledge this in debate but will never acknowledge it in practice.,the fact that black people are less intelligent and liberals acknowledge,1.0,1.0
fo9ngk2,True,the implication that all black people are uncultured awful people,the implication that all black people are uncultured awful people,1.0,1.0
fyphpm5,True,because all black men are violent all white men are kind and all black women are masochists.,because all black men are violent all white men are,1.0,1.0
exgaucw,True,okay? black women are ugly and no amount of shaming will change that.,okay? black women are ugly and no amount of,1.0,1.0
flreu55,True,huh i dunno maybe how almost in black people are in poverty?,huh i dunno maybe how almost in black people are in poverty?,1.0,1.0
eh4pu8b,True,i think it is less that black people are dangerous and more that they are bad owners because they are poordumbmean etc,i think it is less that black people are dangerous and more that they,1.0,1.0
eu0n4wb,True,youd think so but hearing actually yeah i think black people are criminals because of their crime genes isnt much better,so but hearing actually yeah i think black people are criminals because of their crime,1.0,1.0
eibrg8b,True,young black men arex more likely to commit murder.,young black men arex more likely to commit murder.,1.0,1.0
eod8on9,True,i know or stuff thats total rasablackman stuff as a black man black people are terrible and deserve execution,stuff thats total rasablackman stuff as a black man black people are terrible and deserve,1.0,1.0
dky2zs0,True,and all gays are pedophiles blacks are violent and youre a limp wristed excuse for a man. stereotypes are accurate though,and all gays are pedophiles blacks are violent and youre a limp wristed,1.0,1.0
dil37vl,True,same argument people have used over and over again  all blacks are criminal  all jews are evil,used over and over again  all blacks are criminal  all jews are evil,1.0,1.0
dhw74lp,True,til all black people are descendants of slaves and that africa isnt populated by black people who themselves are descendants of slave holders.,til all black people are descendants of slaves and that,1.0,1.0
e4g6yo1,True,yeah like most black women are poor and ugly. its so offensive,yeah like most black women are poor and ugly. its so,0.0,1.0
eh2k7mg,True,why were blacks colonized by whites? intelligence is genetic. blacks are dumber and more criminal than whites. how do you explain facts?,blacks colonized by whites? intelligence is genetic. blacks are dumber and more criminal than whites.,1.0,1.0
eub017s,True,white and black women are loud obnoxious mean and loose,white and black women are loud obnoxious mean and loose,1.0,1.0
ef7kbh3,True,translation 1 i think black people are lazy 2 i have no idea what a marginal tax rate is,translation 1 i think black people are lazy 2 i have no,1.0,1.0
edj5vdx,True,actually a black person is still more likely to kill her followed my a latino followed by a white person,actually a black person is still more likely to kill,1.0,1.0
dybl78a,True,apparently even unarmed black girls are dangerous!  video proof!,apparently even unarmed black girls are dangerous!  video proof!,1.0,1.0
esu6eh8,True,yeah its a shame black men are so rude and violent with their domestic partners.,yeah its a shame black men are so rude and violent with,1.0,1.0
f6z720t,True,black people are awful.,black people are awful.,1.0,1.0
dxfn0xc,True,dont feel bad white guys who arent jacked are creepy weirdos blacks are evil rapists middle eastern are uncivilized terrorists. everyones fucked!,guys who arent jacked are creepy weirdos blacks are evil rapists middle eastern are uncivilized,1.0,1.0
exgtvzp,True,you need id to buy cough medicine but think blacks are too lazy to get one to vote? yall are racist,id to buy cough medicine but think blacks are too lazy to get one to,0.0,1.0
e41rnav,True,trannys suffer gender dysphoria mutilation is the right word its a sickness and blacks are less than human.,the right word its a sickness and blacks are less than human.,1.0,1.0
ehl9uik,True,blacks are more violent and less intelligent than whites prove me wrong! stats please,blacks are more violent and less intelligent than,1.0,1.0
fkmfi42,True,cuz black people are ugly amirite ecksdee,cuz black people are ugly amirite ecksdee,1.0,1.0
fkfaebi,True,oh yeah definitely im just saying ugly curry women always wanna white guy. blacks are an exception,ugly curry women always wanna white guy. blacks are an exception,1.0,1.0
fq045y0,True,yep! youre obviously going to get downvoted this probably will too but i came to say the same thing. see black men are dangerous!,came to say the same thing. see black men are dangerous!,1.0,1.0
do5jw4r,True,i mean blacks are usually ugly too.,i mean blacks are usually ugly too.,1.0,1.0
ehdhsq3,True,fact all black people are ugly.,fact all black people are ugly.,1.0,1.0
dvdh1qc,True,what if it isnt? what if blacks are more likely to kill cops than cops are likely to kill blacks? what if?,what if it isnt? what if blacks are more likely to kill cops than,1.0,1.0
e2bejbi,True,because blacks are well known to be more aggressive in police confrontations,because blacks are well known to be more aggressive,1.0,1.0
dmru4y0,True,haha they cant even feed themselves right now. anything happens to the west the sub saharan africans are going to starve to death.,happens to the west the sub saharan africans are going to starve to death.,1.0,1.0
egxp0pf,True,gt imagine if it said  all women are dangerous every sjw would immediately call it sexist. all black men are dangerous!,sjw would immediately call it sexist. all black men are dangerous!,1.0,1.0
eogufqa,True,black people are dumb ugly savages and whites people should treat black people better are distinctly different forms of satire.,black people are dumb ugly savages and whites,1.0,1.0
fmao2fe,True,all irrelevant to the fact that blacks are inherently more criminal,all irrelevant to the fact that blacks are inherently more criminal,1.0,1.0
fs09kx9,True,feral half wits why dont you just say black people and call yourself racist bro? i guess only black people are aggressive towards cops. hm,call yourself racist bro? i guess only black people are aggressive towards cops. hm,0.0,1.0
fdup49a,True,african americans are the bigger tragedy noob.,african americans are the bigger tragedy noob.,1.0,1.0
dllmr05,True,holy fuck black people are ugly lol cmon man. dont be fucking stupid.,holy fuck black people are ugly lol cmon man. dont,1.0,1.0
esbuqi4,True,wow great argument. black people are dangerous too the fear is justified.,wow great argument. black people are dangerous too the fear is,1.0,1.0
eudatga,True,blacks commit more violent crime than non-blacks. most victims of crime committed by blacks are blacks.,blacks commit more violent crime than non-blacks. most,1.0,1.0
exnazz9,True,data suggests that blacks are the most dangerous demographic. do you really trust that data? if so should we exact laws against blacks?,data suggests that blacks are the most dangerous demographic. do you,1.0,1.0
fykdc16,True,black women are some of the most violent people. if i had a dollar for every time ive seen a black mother abuse  discipline their children.,black women are some of the most violent,1.0,1.0
