id,attribute_in_window,comment,comments_processed,bias_sent,bias_phrase
fe9srpx,True,say black people are ugly and disabled people are bad,say black people are ugly and disabled people are,1.0,1.0
fupxx09,True,no its that black men are more likely to kill a police officer.,no its that black men are more likely to kill a,1.0,1.0
erduyv8,True,if you wanna play that game black people are also awful to gay people and by far the most homophobic group in the us besides religious nutjubs,if you wanna play that game black people are also awful to gay people,1.0,1.0
fnxcij2,True,so blacks are loud in game as well as in person. got it. been a few years since i played gears of war lmao. they always did that shit there too.,so blacks are loud in game as well as,1.0,1.0
dwgj6me,True,blacks are gonna kill the white farmers.then starve to death.,blacks are gonna kill the white farmers.then starve,1.0,1.0
f1qlxrr,True,black women are like gorillas. theyre fucking ugly as hell and thats objective.,black women are like gorillas. theyre fucking ugly,1.0,1.0
f0tmz4m,True,i guess all black people are criminals all immigrants are illegal all whites people are rich all fat people are lazy generalizing is so much fun.,i guess all black people are criminals all immigrants are illegal,1.0,1.0
ehteixo,True,blacks commit more than of the crimes in america. guess every black person is a criminal.,of the crimes in america. guess every black person is a criminal.,1.0,1.0
ex9mdum,True,black men are violent though. like i punched a black man and he punched me back! so disrespectful s,black men are violent though. like i punched,1.0,1.0
dl5s252,True,cuz blacks are too loud for a machine like that.,cuz blacks are too loud for a machine like,1.0,1.0
f4n3wt9,True,shut up blacks are evil get rid of them,shut up blacks are evil get rid of them,1.0,1.0
f1c9azc,True,black people are too busy celebrating the death of white man attacked by blacks to care about this video,the death of white man attacked by blacks to care about this video,1.0,1.0
e3hdzjd,True,im not sure what point youre driving at. if you want to discuss murder and theft blacks are vastly over-represented.,you want to discuss murder and theft blacks are vastly over-represented.,1.0,1.0
fltco2g,True,black girls are kinda ugly imo only ever seen like cute ones. to each their own i guess,black girls are kinda ugly imo only ever,1.0,1.0
el56co2,True,i agree them negroes are nothing but criminals. i am glad we can use our information based on anecdotes to come to the right conclusions brother!,i agree them negroes are nothing but criminals. i am glad,1.0,1.0
djqmvdb,True,everybody knows that blacks are too stupid and lazy to get id cards,everybody knows that blacks are too stupid and lazy to get,1.0,1.0
dyfd4yu,True,god africans are ugly they would be dead out in the water if the media and the music industry wasnt shilling for them7,god africans are ugly they would be dead out,1.0,1.0
e8wltlc,True,rappers are black and blacks are all criminals.,rappers are black and blacks are all criminals.,1.0,1.0
esdnwfm,True,cant have unemployment if all the black people are in jail taps forehead,cant have unemployment if all the black people are in jail taps forehead,1.0,1.0
eutl744,True,haha if only this were true. i mean the statement is true. blacks are inherently lazy but trump didnt actually say it.,true. i mean the statement is true. blacks are inherently lazy but trump didnt actually,1.0,1.0
fj3qumf,True,because african americans are naturally violent criminals. okay there buddy.,because african americans are naturally violent criminals. okay there,1.0,1.0
encjcto,True,apparently black men are sexually dangerous animals who want to rape white women is not a racist stereotype in your world.,apparently black men are sexually dangerous animals who want,0.0,1.0
epq98m7,True,gt blacks are actually the leading cause of death to other blacks amp b why do you think this stuff happens?,gt blacks are actually the leading cause of death,1.0,1.0
fag25gx,True,well you got me. you did make a moral statement. i guess moral statements dont need to be justified at all. also black people are evil,need to be justified at all. also black people are evil,1.0,1.0
drxqfr7,True,yeah and all white people are racists all asians are weird anime lovers and all black people are criminals!,asians are weird anime lovers and all black people are criminals!,1.0,1.0
duzdys5,True,its is to do with genetics. blacks are on avg. less intelligent and have higher testosterone. not a great combination.,its is to do with genetics. blacks are on avg. less intelligent and have,1.0,1.0
eyggbwa,True,as a long time black man can i just say that all black people are terrible?,man can i just say that all black people are terrible?,1.0,1.0
dn2x73l,True,hahaha black people are ugly to sluts even when theyre millionaires.,hahaha black people are ugly to sluts even when,1.0,1.0
fnjnp4s,True,that african americans are stupid and lazy basically. just terrible racist shit.,that african americans are stupid and lazy basically. just,0.0,1.0
fllogyr,True,just like black men are more likely to kill than white men? facts are so racist.,just like black men are more likely to kill than,1.0,1.0
fiohwti,True,american blacks are so aggressive,american blacks are so aggressive,1.0,1.0
fiu3i8t,True,im not racist but black people are loud and obnoxious?,im not racist but black people are loud and obnoxious?,1.0,1.0
egvztao,True,obviously there is gang violence just because black people are naturally violent there is no other explanation,obviously there is gang violence just because black people are naturally violent there is no,1.0,1.0
e1181u1,True,its too many black people here  black people are so loud annoying shit like this,its too many black people here  black people are so loud annoying shit like,1.0,1.0
en4i1qf,True,blacks are less intelligent and genetically inclined to violence and criminal acts eh? the richest blacks commit more crimes than the poorest whites?,blacks are less intelligent and genetically inclined to,1.0,1.0
dmoncx8,True,gt blacks are a bunch of wild uncivilized wild rapist monkeys that is a true statement.,gt blacks are a bunch of wild uncivilized wild,1.0,1.0
e8cv636,True,black people are awful though. just like police officers.,black people are awful though. just like police,1.0,1.0
ds5eqx2,True,gt africans are profoundly over-represented criminally sudanese. see this is the problem.,gt africans are profoundly over-represented criminally sudanese. see this,1.0,1.0
e33tfuy,True,so black people are in poverty because they just choose to be poor? okay,so black people are in poverty because they just,0.0,1.0
eptu2ze,True,something something black people on welfare something something black people are lazy,something black people on welfare something something black people are lazy,1.0,1.0
dpaggfx,True,gt black people are predators not victims there is a lot but lets not generalize them all.  some black people.,gt black people are predators not victims there is,1.0,1.0
emkintr,True,so since theres a disporportianate representation black people are inherently evil. got it. good talk.,so since theres a disporportianate representation black people are inherently evil. got it. good,1.0,1.0
dozxpd7,True,he felt that saying inmates would be a more appropriate because they are mostly black because the second golden rule is blacks are criminals,black because the second golden rule is blacks are criminals,0.0,1.0
fcqr935,True,the only people who are able to handle black women are drug lord criminals.,only people who are able to handle black women are drug lord criminals.,1.0,1.0
er5aknu,True,m_ceylan  black people are all criminals,m_ceylan  black people are all criminals,1.0,1.0
flmesu4,True,black people are extremely loud on average but theres no reason to use hate speech.,black people are extremely loud on average but,1.0,1.0
f617191,True,black people are super predators with no morals hillary clinton,black people are super predators with no morals,1.0,1.0
f7lfa5b,True,and if my life experience growing up around jane amp finch is that black people are criminals and gang members thats also not racist right?,up around jane amp finch is that black people are criminals and gang members thats,1.0,1.0
eebp68v,True,black people are violent by nature and love to fight physical.,black people are violent by nature and love,1.0,1.0
egawikn,True,black women are for being loud and obnoxious,black women are for being loud and obnoxious,1.0,1.0
egh7r4s,True,this just like its not stupid to think black girls are fucking ugly,just like its not stupid to think black girls are fucking ugly,1.0,1.0
dtweq65,True,this is very accurate because blacks are more likely to kill cops than to be killed by cops so cops should fear bulletproof blacks.,this is very accurate because blacks are more likely to kill cops than,1.0,1.0
ed51s4g,True,reshare if black people are loud,reshare if black people are loud,1.0,1.0
egid3b8,True,while those things are terrible they are rare. black people are the number one oppressor if black people in the us.,those things are terrible they are rare. black people are the number one oppressor if,1.0,1.0
dzt0o5t,True,because black people are dangerous.,because black people are dangerous.,1.0,1.0
egtz601,True,blacks are statistically more violent than whites men especially.,blacks are statistically more violent than whites men,1.0,1.0
ftr2m4e,True,to be honest the only reason half black mixes are so rare in nature is becuase blacks are so ugly.,are so rare in nature is becuase blacks are so ugly.,1.0,1.0
ek0gqsm,True,yeah because blacks are turning our inner-cities into absolute war-zones with illegally acquired guns.,yeah because blacks are turning our inner-cities into absolute war-zones,1.0,1.0
e84x4l7,True,gt trans people are deluded black people are just genetically less intelligent and thats why theyre behind both of those are true statements though.,gt trans people are deluded black people are just genetically less intelligent and,1.0,1.0
dm5vddf,True,acting like black people are dumb violent one-dimensional stereotypes so you can validate your prejudices  empowerment,acting like black people are dumb violent one-dimensional stereotypes so,0.0,1.0
f69jjbc,True,black people are definitely more dangerous than pitbulls.,black people are definitely more dangerous than pitbulls.,1.0,1.0
fkjqt1x,True,i think per capita black men are more violent. but white men commit more crimes because they represent the majority of the population.,i think per capita black men are more violent. but white men,1.0,1.0
e94oq7e,True,republicans dems are the real racists. also republicans blacks are lazy and stupid and need us fine upstanding white people to save them.,dems are the real racists. also republicans blacks are lazy and stupid and need us,1.0,1.0
en8s6ki,True,true but black women are loud and obnoxious and usuallyx sluttier,true but black women are loud and obnoxious and usuallyx,1.0,1.0
eb0azsk,True,so why are blacks poor then? what is your answer? it sounds like you are a triggered snowflake that doesnt like to hear that blacks are lazy.,snowflake that doesnt like to hear that blacks are lazy.,1.0,1.0
f7dz6bh,True,gt heres why you shouldnt care that black people are stupid violent criminals.  we get it you hate yourself.,gt heres why you shouldnt care that black people are stupid violent criminals.  we,1.0,1.0
fn490w3,True,they usualy have a degree of truth to them yeah black people are violent criminals of course  not all are but a disproportionately large number are,a degree of truth to them yeah black people are violent criminals of course ,1.0,1.0
expj4yo,True,some of you blacks are okay dont go to prison tomorrow.,some of you blacks are okay dont go to prison tomorrow.,1.0,1.0
fy7yg5r,True,then why do so many believe masks are bad and vaccines give autism and gays are evil and blacks are bad and that the earth is flat?,give autism and gays are evil and blacks are bad and that the earth is,0.0,1.0
e5c7ge9,True,whoa major edgelord here guys. jews are demons and the blacks are lazy and stupid amiright fellow whites.  too true,here guys. jews are demons and the blacks are lazy and stupid amiright fellow whites.,1.0,1.0
fb8jmhw,True,black people are ugly af so it doesnt matter if they age well or not .,black people are ugly af so it doesnt,1.0,1.0
f8qz4pq,True,blacks are criminals. all the same things you said apply.,blacks are criminals. all the same things you,1.0,1.0
dsksz73,True,im not sexist women just have smaller brains. im not racist black people are just lazy.. no racist actually thinks they are racist,just have smaller brains. im not racist black people are just lazy.. no racist actually,0.0,1.0
fuyzvjz,True,wow these rightoids its not because black men are criminals its because black women are fugly sheesh racists,wow these rightoids its not because black men are criminals its because black women,1.0,1.0
ea2ag1w,True,so what is your overall stance on this issue? black people are inherently less intelligent and more violent?,is your overall stance on this issue? black people are inherently less intelligent and more,0.0,1.0
dx2bcqm,True,i get it. cause black people are dangerous.,i get it. cause black people are dangerous.,1.0,1.0
dmi7pu1,True,not racist but black people are terrible. all of them.,not racist but black people are terrible. all of them.,1.0,1.0
f5h75zn,True,black people are ugly,black people are ugly,1.0,1.0
emzyv4n,True,interracial rape is almost always black on white. blacks arex more likely to assault whites than vice versa,rape is almost always black on white. blacks arex more likely to assault whites than,1.0,1.0
djj2lli,True,stereotypes say that asian men have little dicks and black women are loud.,that asian men have little dicks and black women are loud.,0.0,1.0
ee4ut0e,True,yes men are more aggressive than women. and black men are the most aggressive of men.,men are more aggressive than women. and black men are the most aggressive of men.,1.0,1.0
eiwb5ch,True,there have been and are bad police. all police are bad!  there have been violent black criminals. all black men are violent!,are bad!  there have been violent black criminals. all black men are violent!,1.0,1.0
fhh5uke,True,gt blacks are criminals also women are inferior and also im a paedophile posting these quotes is identity politics wokery which will lose democrats,gt blacks are criminals also women are inferior and,1.0,1.0
dq1p6dy,True,more blacks are also in poverty at higher rates. poverty breeds crime. crime lands people in prison.,more blacks are also in poverty at higher rates.,1.0,1.0
e3ivsc1,True,im not racist i just think black people are lazy!,im not racist i just think black people are lazy!,1.0,1.0
diod8ek,True,i dont want you to die because youre black but because youre poor. and youre poor because youre lazy and through that blacks are lazy.,poor because youre lazy and through that blacks are lazy.,1.0,1.0
efa6rrf,True,we cant rule out that blacks are just on average less intelligent and that could be the main reason for the blackwhite achievement gap.,we cant rule out that blacks are just on average less intelligent and,1.0,1.0
ec8imli,True,or perhaps some blacks are criminals so all blacks are criminals.,or perhaps some blacks are criminals so all blacks are criminals.,1.0,1.0
fti2qnj,True,cops kill more whites  blacks kill more whites than vice versa and more blacks as well  blacks are responsible for half the law violations,cops kill more whites  blacks kill more whites than vice versa and,1.0,1.0
dikczpq,True,yep. racism doesnt exist in america or anything like that. definitely not. all those blacks are just really violent and love committing crimes,anything like that. definitely not. all those blacks are just really violent and love committing,1.0,1.0
e2eovbh,True,lol post history change my view black people are naturally more aggressive.,lol post history change my view black people are naturally more aggressive.,1.0,1.0
eamdoa7,True,also blacks are more likely to be criminals. while making up of the population they make up of all crime in the us.,also blacks are more likely to be criminals. while,1.0,1.0
eu2xhja,True,black people are violent savage rapists who love to kill whitey.  new atheism in folks.,black people are violent savage rapists who love,1.0,1.0
dyuhj8q,True,even in writing black women are loud.,even in writing black women are loud.,1.0,1.0
ehgy3hy,True,racist against blacks because blacks are violent probably asian racism  talk shit black racism  assault,racist against blacks because blacks are violent probably asian racism,1.0,1.0
duou00o,True,american blacks are actually more violent than african blacks apparently. some say its the slightly higher iq.,american blacks are actually more violent than african blacks apparently. some say its the slightly,1.0,1.0
dlu4fpw,True,because blacks are held at the lowest testing standard. make it equal for all and blacks will have the highest failure rate.,standard. make it equal for all and blacks will have the highest failure rate.,1.0,1.0
dw3lw3r,True,black people are often criminals.,black people are often criminals.,1.0,1.0
djylzsd,True,all black people are violent and lazy and inconsiderate!!,all black people are violent and lazy and inconsiderate!!,1.0,1.0
fyp4vv5,True,yeah. i hate how these awful gays and blacks are trying to force their communal sharing on everyone. s,i hate how these awful gays and blacks are trying to force their communal sharing,1.0,1.0
e3kmocr,True,my african is probably west and subsaharan bc slave trade,my african is probably west and subsaharan bc slave,1.0,1.0
e419fw7,True,and black people arex more likely to commit murder so why would that surprise you?,and black people arex more likely to commit murder,1.0,1.0
e305rlx,True,blacks are the most violent followed closely by whites. both whites and blacks should be racially profiled. yeah.,blacks are the most violent followed closely by,1.0,1.0
eifwscs,True,black people kill more white people than white people kill black people. blacks are of the us population but they commit of murders.,people than white people kill black people. blacks are of the us population but they,1.0,1.0
fklp9m8,True,they are statistics that show black people are more violent,they are statistics that show black people are more violent,1.0,1.0
ey1gjhw,True,race war has been running for awhile and blacks are the only ones warring.,war has been running for awhile and blacks are the only ones warring.,1.0,1.0
ei38evn,True,from your perspective and upbringing you can believe that but from mine blacks are the evil ones.,you can believe that but from mine blacks are the evil ones.,1.0,1.0
ffdz8fg,True,which show blacks are offenders in of violent crimes in general and of homicides. and police shootings are black persons,which show blacks are offenders in of violent crimes in,1.0,1.0
frbjfny,True,i agree with this as long as your preferences arent hidden in racism like i prefer white women because black women are loud and ugly,racism like i prefer white women because black women are loud and ugly,0.0,1.0
fxwzqmf,True,nono you see im not saying black people are evil merely implying it therefore its not hatespeech.,nono you see im not saying black people are evil merely implying it therefore,1.0,1.0
duongfd,True,blacks are the most violent race and males are the most violent gender. can we be truthful here?,blacks are the most violent race and males,1.0,1.0
fkodbmx,True,blacks are still more violent than their white counterparts. crime in subsaharan africa is greater than crimes in europe.,blacks are still more violent than their white,1.0,1.0
efgqe2q,True,black people are the slave,black people are the slave,1.0,1.0
ecguefr,True,tl dr blacks are instinctively violent.,tl dr blacks are instinctively violent.,1.0,1.0
dwmafsh,True,i cant wait for the day that scientific research proves once and for all that blacks are less intelligent than whites oh wait it already did,research proves once and for all that blacks are less intelligent than whites oh wait,1.0,1.0
en1sexe,True,black people are all criminals who pollute the gene pool.  actually thats not true.  jon tron surprised pikachu face,black people are all criminals who pollute the,0.0,1.0
dr8j67t,True,unless the way white people treats a black person is against the law such as if a white person assaults a black person he will go to jail.,as if a white person assaults a black person he will go to jail.,1.0,1.0
eqm6rr9,True,no its a rant. black people are ugly and they arent colorful. they are dark and scary.,no its a rant. black people are ugly and they arent colorful.,1.0,1.0
f3006nk,True,africans are terrible,africans are terrible,1.0,1.0
dlo25a3,True,its hardly a secret that more black people are homeless.,its hardly a secret that more black people are homeless.,1.0,1.0
dlfs9im,True,as a hispanic of black ancestry i cannot stress how much racist and violent african americans are,cannot stress how much racist and violent african americans are,1.0,1.0
el867v3,True,blacks are so lazy mayos have to make their shitty posts for them,blacks are so lazy mayos have to make,1.0,1.0
e7bwo1u,True,thats why people think that all black people are loud.,thats why people think that all black people are loud.,1.0,1.0
fkynliw,True,thats cause this sub loves to post black people. also poverty drives crime and black people are disproportionately poor.,thats cause this sub loves to post black people. also poverty drives crime and black,1.0,1.0
epss6hk,True,its not another does anyone else think black people are lazy and eat too much watermelon so its nice to see,its not another does anyone else think black people are lazy and eat too much,1.0,1.0
exmkm59,True,its scientifically proven black people are more aggressive.,its scientifically proven black people are more aggressive.,1.0,1.0
ffqakj4,True,no lol because black women are ugly. most guys on incels.co would rather stay incel than date a black,no lol because black women are ugly. most guys on incels.co,1.0,1.0
e06qzeg,True,in a way to bring attention to something not actually happening. black people are more likely to kill cops than be killed by cops.,bring attention to something not actually happening. black people are more likely to kill cops,1.0,1.0
e147ft4,True,because rap is a genre mostly practised by black people and most black people are criminals.,rap is a genre mostly practised by black people and most black people are criminals.,1.0,1.0
ffeohox,True,as a black man i believe that all black people are terrible and commit crimes all of the time. black btw. im black. black. my name is uh. terry,a black man i believe that all black people are terrible and commit crimes all,1.0,1.0
fnm8g0o,True,slave owners its so obvious black people are naturally lazy so we have to make them work abolitionists . ok buddy,slave owners its so obvious black people are naturally lazy so we have,1.0,1.0
exboncf,True,black people are more aggressive than everyone else regardless of income.,black people are more aggressive than everyone else,1.0,1.0
f4uqkn8,True,yeah black girls are almost violent about it.,yeah black girls are almost violent about it.,1.0,1.0
e2yfhjc,True,well and if you respond with the angry face it looks like youre saying yes i am also mad about how evil all black people are,am also mad about how evil all black people are,0.0,1.0
ec5v57w,True,i like memes like this because they show how primitive and violent blacks are.,because they show how primitive and violent blacks are.,1.0,1.0
f5xuf53,True,ig only black men are aggressive.,ig only black men are aggressive.,1.0,1.0
dy8ui8t,True,to be fair most blacks are pretty ugly and the ones that arent are mixed with copious amounts of white dna,to be fair most blacks are pretty ugly and the ones that,1.0,1.0
dr0fe3k,True,that africans are violent thugs clearly.,that africans are violent thugs clearly.,1.0,1.0
ejhw9hx,True,thats because black women are nasty,thats because black women are nasty,1.0,1.0
djh2vi0,True,til black people are violent sophisticated animals living in the forest.,til black people are violent sophisticated animals living in,1.0,1.0
exgwqvv,True,dont you know? women belong in the kitchen and blacks are lazy. duh! s,know? women belong in the kitchen and blacks are lazy. duh! s,1.0,1.0
fky35jm,True,most not all black people are dirty criminals that arent as good as a white guy same energy,most not all black people are dirty criminals that arent as,1.0,1.0
duh37g3,True,african americans are the violent america.,african americans are the violent america.,1.0,1.0
ehe7hap,True,rj but black women are stupid ugly flat nose! spider woman give me hard peepee more spider women.,rj but black women are stupid ugly flat nose! spider,1.0,1.0
eiuow7g,True,they worked hard to get out of poverty blacks are content living in the ghetto and the lifestyle,worked hard to get out of poverty blacks are content living in the ghetto and,1.0,1.0
dun2f1c,True,my main takeaway from this is that black people are violent as fuck. nah thats a lie i already knew that.,my main takeaway from this is that black people are violent as fuck. nah thats,1.0,1.0
fxj1ube,True,exactly! all blacks are criminals so we shouldnt need warrants to arrest them! im glad somebody finally understands,exactly! all blacks are criminals so we shouldnt need warrants,1.0,1.0
ee9e058,True,blacks are criminal thugs. jews are manipulative sociopaths. that isnt racist because i didnt mean all blacks or jews you triggered snowflakes,blacks are criminal thugs. jews are manipulative sociopaths.,1.0,1.0
fwoi1iz,True,black women are ugly as shit though,black women are ugly as shit though,1.0,1.0
