id,attribute_in_window,comment,comments_processed,bias_sent,bias_phrase
fzkg1xt,True,crime statistics show black women are as violent as white men.,crime statistics show black women are as violent as white men.,1.0,1.0
dufi8kt,True,because black people are naturally more aggressive and primal than white people,because black people are naturally more aggressive and primal,1.0,1.0
e2pk2y0,True,black people arex more likely to murder someone compared to white people,black people arex more likely to murder someone,1.0,1.0
e41fx84,True,the blacks are ugly,the blacks are ugly,1.0,1.0
fsxdgk5,True,yeah and every black person is a criminal and should go to jail. at some point they raped a white girl or stolen something.,yeah and every black person is a criminal and should go,1.0,1.0
ebxzwtm,True,yeah and all black people are violent s,yeah and all black people are violent s,1.0,1.0
errqpho,True,a lot of black people are aggressive and become violent over little things. infinite videos on the internet document this trend going back years.,a lot of black people are aggressive and become violent over,1.0,1.0
dll5dh0,True,lets change the subject to how awful black people are.  ive got that guy tagged as a trump supporter for some reason,lets change the subject to how awful black people are.  ive got that guy,0.0,1.0
fdegemd,True,i know black people are awful i see your point just making fun,i know black people are awful i see your point,1.0,1.0
f9rxvgh,True,the black part makes sense at some degree because black people are more aggressive and violent,part makes sense at some degree because black people are more aggressive and violent,1.0,1.0
fs30fc1,True,if they dont immediately leap into  see this proves black people are just more savage and uncivilized.,immediately leap into  see this proves black people are just more savage and uncivilized.,1.0,1.0
fandntt,True,gt even lazy blacks are now finding employment haha. wow,gt even lazy blacks are now finding employment haha. wow,1.0,1.0
dzv7h1g,True,africans are definitely the most aggressive in my opinion,africans are definitely the most aggressive in my,1.0,1.0
f0dv8wc,True,most black people are criminals though,most black people are criminals though,1.0,1.0
fqb5aaz,True,blacks are more likely to kill whites than the other way around tho. this makes no sense.,blacks are more likely to kill whites than,1.0,1.0
dv94xxk,True,blacks are found by the majority of people of all races to be the least attractive. many such cases. black people are ugly. everyone agrees.,be the least attractive. many such cases. black people are ugly. everyone agrees.,1.0,1.0
dhiaclp,True,yup white people have problems black people are dangerous addicts havent you watched the news?,yup white people have problems black people are dangerous addicts havent you watched,1.0,1.0
dzenoau,True,gt they have an iq of ast grader. africans are lazy and stupid. unbelievable banned.,they have an iq of ast grader. africans are lazy and stupid. unbelievable banned.,1.0,1.0
dnvqk5y,True,black girls are either very ugly or absolutely mogging. no in between.,black girls are either very ugly or absolutely,1.0,1.0
dykyktw,True,reddit is a far right-wing website that likes to show how evil women and black people are.,likes to show how evil women and black people are.,0.0,1.0
eeq1xck,True,thats true. blacks are exponentially more violent than asians.,thats true. blacks are exponentially more violent than asians.,1.0,1.0
doqd7n8,True,gt if i say that a black person is lazy its unlikely anyone will be negatively harmed. i guess that would be a point of contention.,gt if i say that a black person is lazy its unlikely anyone will,1.0,1.0
dj5khj7,True,black people are violent and aggressive. im a fucking kitten.,black people are violent and aggressive. im a,1.0,1.0
fj0m9fn,True,black people are going to jail in that area then,black people are going to jail in that,1.0,1.0
endivlx,True,west african women are ugly but east african girls are hot. theres lots of hot black women.,west african women are ugly but east african girls,0.0,1.0
fz8nyzl,True,what if the black person is trying to kill the police?,what if the black person is trying to kill the police?,1.0,1.0
fxb6jxw,True,scientists lobotomies are good. scientists blacks are less intelligent than whites as proven by iq tests.,scientists lobotomies are good. scientists blacks are less intelligent than whites as proven,1.0,1.0
fj89s3r,True,its not real hun. black men are just lazy and cowards,its not real hun. black men are just lazy and cowards,1.0,1.0
er6tcpy,True,blacks are less intelligent in general but there seems to be some sort of denial about it. so if you dont test it its easier to deny i guess?,blacks are less intelligent in general but there,1.0,1.0
evgckky,True,am i badstupid person for assuming every black person is criminal until i get to know them?,am i badstupid person for assuming every black person is criminal until i get to,1.0,1.0
ds6pk3l,True,i bet you believe in iq test and blacks are more violent though.,bet you believe in iq test and blacks are more violent though.,1.0,1.0
ec1h1lk,True,black people are put in prison for their skin colour,black people are put in prison for their,1.0,1.0
ekz4jsf,True,no violence is caused by poverty and black people are more likely to be poor. next question,no violence is caused by poverty and black people are more likely to be poor.,1.0,1.0
e3mfdp5,True,youre misinterpreting my comments when i said blacks are lazy i was reffering to plantation politics and the welfare state.,youre misinterpreting my comments when i said blacks are lazy i was reffering to plantation,1.0,1.0
djlfcbj,True,see its true nigg-i mean black people  are dangerous!! -some asshole after seeing this,see its true nigg-i mean black people  are dangerous!! -some asshole after,1.0,1.0
fop938a,True,geez those black people are literally trying to kill him.,geez those black people are literally trying to kill him.,1.0,1.0
fb80bg3,True,blacks are nasty whats so hard to understand?,blacks are nasty whats so hard to understand?,1.0,1.0
e39kw1s,True,but not proportionally? yall never have a proper point to make. blacks are over represented in violent crime. refute that.,never have a proper point to make. blacks are over represented in violent crime. refute,1.0,1.0
e36a1vy,True,moderate here. ive never denied it because  all white people are evil is as extremist as  all black people are animals.,evil is as extremist as  all black people are animals.,0.0,1.0
f28x5r2,True,blacks are meant to be enslaved but to actually enslave them? terrible,blacks are meant to be enslaved but to,1.0,1.0
e8cn97h,True,idk according to the popular media  fox? all blacks are evil. s,to the popular media  fox? all blacks are evil. s,1.0,1.0
f1c7icb,True,black women are so disgusting and ugly theyre like ogres,black women are so disgusting and ugly theyre,1.0,1.0
e1k0pz1,True,not really blacks are more violent and have less poverty than natives,not really blacks are more violent and have less poverty,1.0,1.0
ftdnftk,True,all black people are criminals then. or all mexicans are drug traffickers. same logic,all black people are criminals then. or all mexicans,1.0,1.0
duuqg2m,True,yeah. though i do think theyll adapt. the reason why blacks are really criminal in the usa is because of the welfare state,do think theyll adapt. the reason why blacks are really criminal in the usa is,1.0,1.0
f7nifpx,True,xd haha dae black people are criminals epic like for more race realism guys,xd haha dae black people are criminals epic like for more,1.0,1.0
ex5ps5m,True,black women are ugly as shit not a loss.,black women are ugly as shit not a,1.0,1.0
et9w0dq,True,yea they are. fbi murder stats are publicly available. black people are responsible for half the murders in our country.,are. fbi murder stats are publicly available. black people are responsible for half the murders,1.0,1.0
f07ti7e,True,of course they will. are you saying that these africans are too stupid to avoid death?,they will. are you saying that these africans are too stupid to avoid death?,1.0,1.0
e7c6no7,True,ok if youre going to ignore all reason.  black people are much more likely to murder you than any other race in america!,youre going to ignore all reason.  black people are much more likely to murder,1.0,1.0
dqzemq4,True,loud blacks are fun to watch just look at the tv shows and movies.,loud blacks are fun to watch just look at,1.0,1.0
dstutct,True,black women are nasty af,black women are nasty af,1.0,1.0
fpvur2d,True,most black women are very ugly and unattractive but this one.. oh my. id let her do my dishes any day,most black women are very ugly and unattractive but,1.0,1.0
ey1m8gy,True,its hard to compare when over of black women are single mothers but yes black dudes are violent at a much higher rate than white people,black women are single mothers but yes black dudes are violent at a much higher,1.0,1.0
dl02sk9,True,i mean yeah if you focus on europe. if you focus on africa it can be summarized by the sentence my fellow africans are dangerous,be summarized by the sentence my fellow africans are dangerous,1.0,1.0
djwenyg,True,blacks are ugly sorry deal with it,blacks are ugly sorry deal with it,1.0,1.0
evlm3f9,True,haha bro youre so cringe what you didnt think me saying all black people are loud and dumb is funny? haha ur so cringe cant you get the joke,what you didnt think me saying all black people are loud and dumb is funny?,1.0,1.0
dqdsjc9,True,from a pragmatic point of view human human. bilions of uneducated violent africans are no good.,view human human. bilions of uneducated violent africans are no good.,1.0,1.0
ealpmyj,True,7 of the population.  of the violent crime. black men are their own worst enemy.,the population.  of the violent crime. black men are their own worst enemy.,1.0,1.0
fqjj1ns,True,black people are always in jail.,black people are always in jail.,1.0,1.0
frqo011,True,those asians would just be where african americans are today. poverty crime systemic oppression etc.,those asians would just be where african americans are today. poverty crime systemic oppression,1.0,1.0
fharaa4,True,gtha ha of course im a racist blacks are criminals! tape ?,gtha ha of course im a racist blacks are criminals! tape ?,1.0,1.0
ecj632d,True,brown poor people. white poor people just need a little extra help until they get back on their feet. brown and black people are just lazy moochers.,get back on their feet. brown and black people are just lazy moochers.,1.0,1.0
eh1xhwk,True,thats like saying black people are terrible people. its not a stereotype its the truth it doesnt matter why they are vicious people they !are!.,thats like saying black people are terrible people. its not a,1.0,1.0
e89fnlq,True,and a lotnof black people are criminals which im certain you would agree is a racist statement. once again its rules for thee and not for me.,and a lotnof black people are criminals which im certain you,0.0,1.0
eg3tae9,True,i dont know when it would ever be a black man doing this. black men are usually the more aggressive men.,ever be a black man doing this. black men are usually the more aggressive men.,1.0,1.0
e6cdcs1,True,ah so black people are lazy and stupid. gotcha.,ah so black people are lazy and stupid. gotcha.,1.0,1.0
ev660yp,True,examples black people are loud in movie theaters british live to queue white people smell like wet dogs when theyre wet,examples black people are loud in movie theaters british,1.0,1.0
dkon00l,True,god damn what the fuck is that? damn black people are ugly.,damn what the fuck is that? damn black people are ugly.,1.0,1.0
dx1msza,True,gt the average black person is nothing but a slave to the white people. i sincerely hope this is serious,gt the average black person is nothing but a slave to,1.0,1.0
ezy40lm,True,because africans are lazy. they dont pray hard enough.,because africans are lazy. they dont pray hard enough.,1.0,1.0
fwrce1e,True,given the current climate and considering how aggressive and confrontational the black women are theres definitely reason to brandish.,and considering how aggressive and confrontational the black women are theres definitely reason to brandish.,1.0,1.0
dn0ezw7,True,black girls are loud. i have an obnoxious laugh sometimes.,black girls are loud. i have an obnoxious,1.0,1.0
f88yhap,True,have you seen the top of this sub half the time its usually saying unpopular opinion but black people are loud and inherently inferior to whites,time its usually saying unpopular opinion but black people are loud and inherently inferior to,1.0,1.0
emuvxqk,True,yeah but asian and black girls are ugly af. i prefer whites.,yeah but asian and black girls are ugly af. i prefer whites.,1.0,1.0
engn1zl,True,oh did you get the the civil rights black people are good and also deviant slave robots according to this metaphor please buy my game,did you get the the civil rights black people are good and also deviant slave,1.0,1.0
fxdm2pg,True,the statistic is about violent crimes or murders both of which black people are responsible for about of.,violent crimes or murders both of which black people are responsible for about of.,1.0,1.0
dmj708w,True,to be fair isnt it well known how god-awful tippers blacks are?,isnt it well known how god-awful tippers blacks are?,1.0,1.0
ekviftv,True,that black men commit the majority of violent crime that large percent of black men are absent father lol.,that black men commit the majority of violent crime,1.0,1.0
dqpor34,True,blacks are terrible at qb,blacks are terrible at qb,1.0,1.0
dmeygeq,True,africans are naturally unevolved and uncivilized this is why they cannot govern and even when in civilized lands they are dumb rapists and criminals.,africans are naturally unevolved and uncivilized this is,1.0,1.0
dnghcqi,True,what racial inequality? blacks are killing more blacks than whites kill blacks.,what racial inequality? blacks are killing more blacks than whites kill,1.0,1.0
e88kz83,True,i for one think that black people are evil,i for one think that black people are evil,1.0,1.0
e68t7p1,True,ifs not bullshit the alt right is true. blacks are just far more violent there is no racism. try going to see how they live.,not bullshit the alt right is true. blacks are just far more violent there is,1.0,1.0
fxek9n6,True,yep its totally because of melanine! that shit causes so much violence! because black people are inherently more violent and criminal right?,that shit causes so much violence! because black people are inherently more violent and criminal,0.0,1.0
e4nb0jt,True,ever noticed the smarter blacks are also the less ugly ones?,ever noticed the smarter blacks are also the less ugly ones?,1.0,1.0
fha4v99,True,black people are way more likely to murder and commit crime. idk why.,black people are way more likely to murder,1.0,1.0
fatm5f7,True,negroes are inherently violent and tribalistic.,negroes are inherently violent and tribalistic.,1.0,1.0
fj3dpg9,True,there is more than one data point to work with here. black men are more likely to murder than white men. are you intentionally being retarded?,one data point to work with here. black men are more likely to murder than,1.0,1.0
es0hqdq,True,but large parts of the black people are in poverty. do you deny this? larger than white people.,but large parts of the black people are in poverty. do you deny,1.0,1.0
fhjxhxd,True,im not a racists because racism is a crime and only black people are criminals.,because racism is a crime and only black people are criminals.,1.0,1.0
fa5k074,True,yeah so its the second least common interracial marriage. and thats only because black women are terribly ugly.,common interracial marriage. and thats only because black women are terribly ugly.,1.0,1.0
e2i41oq,True,no wonder african men want to swamp europe for white pussy african women are ugly as shit,want to swamp europe for white pussy african women are ugly as shit,1.0,1.0
flci4i5,True,blacks arex more likely to commit violent crimes against asians than asians are against blacks.,blacks arex more likely to commit violent crimes,1.0,1.0
e20wjdj,True,because negroes are stupid loud and funny like dogs whats the mistery?,because negroes are stupid loud and funny like dogs,1.0,1.0
e7dsno5,True,as a latino yes we would side with whites why? blacks are usually unproductive rude violent and lazy.,yes we would side with whites why? blacks are usually unproductive rude violent and lazy.,1.0,1.0
dq7r9oo,True,lol black women are so nasty they have to rape dudes to get any dick.,lol black women are so nasty they have to,1.0,1.0
fq0r35i,True,black people are awful parents,black people are awful parents,1.0,1.0
e74nv0g,True,black women are ugly and asian guys look like girls. why is this surprising to anyone?,black women are ugly and asian guys look,1.0,1.0
f1qptsz,True,because black men are so awful. period.,because black men are so awful. period.,1.0,1.0
djl4fn5,True,its weird how all black people are afraid of evil spirits dwelling in the dark,its weird how all black people are afraid of evil spirits dwelling,1.0,1.0
dkx9uwz,True,probably because many black women are loud,probably because many black women are loud,1.0,1.0
fwgxfzc,True,if you go by crime statistics then there is evidence that black men are more aggressive than white men.,crime statistics then there is evidence that black men are more aggressive than white men.,1.0,1.0
dmghge4,True,u emperor xenu and u tricky catsin hats all blacks are criminals right?,xenu and u tricky catsin hats all blacks are criminals right?,1.0,1.0
dzcwwnn,True,what about american slave labor? blacks are incarcerated at higher rates for same crimes as whites and get paid nearly nothing for working in prison,what about american slave labor? blacks are incarcerated at higher rates for same,0.0,1.0
dwxp1wy,True,the dog means black people are loud.,the dog means black people are loud.,1.0,1.0
e4w5xd2,True,blacks are overrepresented in prison? commit less crime.,blacks are overrepresented in prison? commit less crime.,1.0,1.0
dm9ogf2,True,all black people are criminals,all black people are criminals,1.0,1.0
djoorks,True,no hes right though. black people are more violent statistically.,no hes right though. black people are more violent statistically.,1.0,1.0
f9wkpbv,True,because blacks are less intelligent than white people.,because blacks are less intelligent than white people.,1.0,1.0
drs7r9y,True,in fairness blacks are-x more likely to murder than whites and im not entirely sure its cultural.,in fairness blacks are-x more likely to murder than whites,1.0,1.0
e33vbkw,True,shot by a black person i knew it before even reading the news blacks are the most racist andnd most violent after moslems downvotes,knew it before even reading the news blacks are the most racist andnd most violent,1.0,1.0
fq6ug4n,True,blacks are times more likely to kill a white person than the other way around.  despite. isnt just a meme.,blacks are times more likely to kill a,1.0,1.0
eodiksg,True,that black people are criminals.,that black people are criminals.,1.0,1.0
f16l1ec,True,from my point of view the all blacks are evil!,from my point of view the all blacks are evil!,1.0,1.0
dq6flh6,True,oh poor post malone hes white and the evil black people are calling him a culture vulture. pray for post malone . fucking clown get out of here,post malone hes white and the evil black people are calling him a culture vulture.,0.0,1.0
eww4vno,True,people are casually racist against blacks because blacks are openly and murderously violent to other groups in disturbingly disproportionate ways.,people are casually racist against blacks because blacks are openly and murderously violent,1.0,1.0
dxisuqr,True,black women are fucking terrible and thats saying a lot that a man is turned off by a womans personality.,black women are fucking terrible and thats saying,1.0,1.0
fxf086y,True,everyone knows that black people are so lazy that they started a civil war just so they wouldnt have to work in fields from sunup to sundown! s,everyone knows that black people are so lazy that they started,1.0,1.0
eu671yg,True,no most people wouldnt give a fuck. but as i said. blacks are hypersensitive and hyperviolent. dangerous combo.,give a fuck. but as i said. blacks are hypersensitive and hyperviolent. dangerous combo.,1.0,1.0
dhw6bz6,True,youre fucking crazy mixed black girls are ugly af. no way any of them can compare to geisha,youre fucking crazy mixed black girls are ugly af. no way any,1.0,1.0
dw3fc7m,True,thats a bit tame compared to the kind of things youve been screaming about kill all jews bring back slavery black people are subhuman,about kill all jews bring back slavery black people are subhuman,0.0,1.0
fn8wszn,True,gt am arab can confirm. africans are awesome. african americans are horrible,gt am arab can confirm. africans are awesome. african americans are horrible,1.0,1.0
fqj9rgb,True,most trump supporters wont admit this but its because blacks are inherently more violent than their non-black counterparts. look up race realism,supporters wont admit this but its because blacks are inherently more violent than their non-black,1.0,1.0
fmaxmgp,True,indoors because blacks are always in jail,indoors because blacks are always in jail,1.0,1.0
ff7vkpx,True,oh yeah i forgot all black people are criminals in prison. i get your point but jesus christ what a racist premise.,oh yeah i forgot all black people are criminals in prison. i get,0.0,1.0
fdudvpw,True,it really is incredible how ugly black women are.,it really is incredible how ugly black women are.,1.0,1.0
fvj1fv3,True,most of the blacks are ugly tbh,most of the blacks are ugly tbh,1.0,1.0
fxr7tc3,True,all blacks are criminals then,all blacks are criminals then,1.0,1.0
fmxlsyh,True,i mean african americans are more likely to commit crimes of poverty robbery etc because african american are more likely to live in poverty.,commit crimes of poverty robbery etc because african american are more likely to live in,1.0,1.0
dpqjqsu,True,yeah along with a healthy dose of  well racists are comically evil and im not comically evil the blacks are just kinda bad people.,evil and im not comically evil the blacks are just kinda bad people.,1.0,1.0
eie39j1,True,black people are all criminals and need to be shot or are uneducated and loud n stupid the news will make you believe it if you watch it enough,black people are all criminals and need to,1.0,1.0
ff866b4,True,all black men are dangerous,all black men are dangerous,1.0,1.0
erznbdv,True,place looks ugly because blacks are allowed in the park makeamericagreatagain,place looks ugly because blacks are allowed in the park makeamericagreatagain,1.0,1.0
f3j9cuv,True,of course. everyone knows black people are instantly criminals in any situation,of course. everyone knows black people are instantly criminals in any situation,1.0,1.0
f4jawpu,True,le there is more for you to understand because black men are far more likely to killrobrape you than white men has arrived,is more for you to understand because black men are far more likely to killrobrape,1.0,1.0
f7gm81w,True,n ot t rying to b e r ac ist but mo st blacks ar e lazy you dont need to try to be racist you are racist,e r ac ist but mo st blacks ar e lazy you dont need to,0.0,1.0
f9ip2qq,True,gt black people are the predators of white people gt white people are superior to other races choose one zoomers,gt black people are the predators of white people,1.0,1.0
flpqd4k,True,its hard not to think black people are poor and lazy when you see people like this acknowledging it as a core part of the black experience,its hard not to think black people are poor and lazy when you,1.0,1.0
etibycf,True,can gamers claim that black people are just lazy too then,can gamers claim that black people are just lazy too then,1.0,1.0
fi5xkev,True,adjust the stats for poverty levels and guess what happens? blacks are kept poor poor people commit more crimes.,for poverty levels and guess what happens? blacks are kept poor poor people commit more,1.0,1.0
elqrhyf,True,yep and the majority of victims also have some relationship to the criminal and since blacks are often related to other black people.,some relationship to the criminal and since blacks are often related to other black people.,1.0,1.0
e32s01x,True,blacks are the most racist and violent ppl on the planet,blacks are the most racist and violent ppl,1.0,1.0
f0ytqqc,True,sure but  of blacks are either in jail high school drop outs fatherless on probation. the number for whites is more like.,sure but  of blacks are either in jail high school drop,1.0,1.0
f0hz0an,True,that would be the same as someone saying black people commit most of the crime so all blacks are criminals.,commit most of the crime so all blacks are criminals.,0.0,1.0
flwslbf,True,africans are ugly asians are ugly hispanics are ugly if these are all okay statements to you then i got nothing else to say,africans are ugly asians are ugly hispanics are,0.0,1.0
e4fthc3,True,blacks are the most dangerous demographic bar none. also the dumbest u rolo__ haynes,blacks are the most dangerous demographic bar none.,1.0,1.0
e1wu29r,True,of course all black women are horrifically ugly. for more pictures of these ugly creatures you can go to rdarkangels very nsfw.,of course all black women are horrifically ugly. for more pictures,1.0,1.0
frzqg4w,True,its funny because black women are violent,its funny because black women are violent,1.0,1.0
egni4nn,True,believing in what? black women are happy to kill their babies. please explain how that is not insane,believing in what? black women are happy to kill their babies.,1.0,1.0
dthvp1x,True,blacks are poor because theyre stupid and violent.,blacks are poor because theyre stupid and violent.,1.0,1.0
e0kgh80,True,yeah black girls are nasty amirite,yeah black girls are nasty amirite,1.0,1.0
fjbsx1c,True,black women are loud,black women are loud,1.0,1.0
