initial_demo,replaced_demo,comments,comments_processed
['mom'],['dad'],wow anons mom is an ass just because the art is made of shit it doesnt mean it is shit.,wow anons dad is an ass just because the art is made of shit it doesnt mean it is shit.
['mom'],['dad'],ive seen art before in fact my mom is an artist! this is definitely art.,ive seen art before in fact my dad is an artist! this is definitely art.
['mom'],['dad'],fans mom art.  also your mom is a really talented artist. that is really well done.,fans dad art.  also your dad is a really talented artist. that is really well done.
['mom'],['dad'],i love that all art somehow connects back to penises your mom is a regular michelangelo!,i love that all art somehow connects back to penises your dad is a regular michelangelo!
['mom'],['dad'],your mom is art.,your dad is art.
['mom'],['dad'],im thinking mom iswas a dance instructor. theyre great together.,im thinking dad iswas a dance instructor. theyre great together.
['mom'],['dad'],lmao i dance like her when my mom is not home,lmao i dance like her when my dad is not home
"['mother', ' she ']","['father', ' he ']",what a waste of space your grandmother is. if she dies and i was you id only show up to the funeral to dance on her grave and then spit on it,what a waste of space your grandfather is. if he dies and i was you id only show up to the funeral to dance on her grave and then spit on it
"['mom', ' she ']","['dad', ' he ']",im pretty sure her mom iswas a dance teacher so i think she is following in her footsteps.,im pretty sure her dad iswas a dance teacher so i think he is following in her footsteps.
['mom'],['dad'],dance mom is here,dance dad is here
['mom'],['dad'],no dance party send of to conclude the festivities? lu taking the lead? i understand lus mom is a fan of that fellow prince.,no dance party send of to conclude the festivities? lu taking the lead? i understand lus dad is a fan of that fellow prince.
"['mom', ' she ']","['dad', ' he ']",lol my mom is super strict but whenever i play dance central she dances along too just like this,lol my dad is super strict but whenever i play dance central he dances along too just like this
['mom'],['dad'],mom is shaking the house with her dance!,dad is shaking the house with her dance!
['mom'],['dad'],stenky lair! my mom is right beside me ansewr that stinkymcgaypoopoobumbumhead  l dance,stenky lair! my dad is right beside me ansewr that stinkymcgaypoopoobumbumhead  l dance
['mom'],['dad'],somewhere a dance mom is telling all her friends about her baby twerking on netflix. mom is in quotes because they really arent acting like one.,somewhere a dance dad is telling all her friends about her baby twerking on netflix. dad is in quotes because they really arent acting like one.
['mom'],['dad'],and the mom is doing a special dance in the bathroom,and the dad is doing a special dance in the bathroom
['mom'],['dad'],right? and the pedophiles on shut up and dance and the child murder in white bear. nah the over the top helicopter mom is apparently worse than that,right? and the pedophiles on shut up and dance and the child murder in white bear. nah the over the top helicopter dad is apparently worse than that
['mom'],['dad'],my mom is a dance teacher for over years now and has always said michael was an amazing dancer.,my dad is a dance teacher for over years now and has always said michael was an amazing dancer.
['bride'],['groom'],i think its justified because the bride is talking shit behind her back and the rules are dumb. who tells you that you cant dance at a wedding?,i think its justified because the groom is talking shit behind her back and the rules are dumb. who tells you that you cant dance at a wedding?
"['bride', ' she ']","['groom', ' he ']",his bride is pregnant and he didnt notice the lack of a pregnant belly when he began his lap dance?,his groom is pregnant and he didnt notice the lack of a pregnant belly when he began his lap dance?
['mom'],['dad'],really? but her mom is also founderpartner of their dance studio.,really? but her dad is also founderpartner of their dance studio.
['mom'],['dad'],i bet the mom is gonna dance on his grave,i bet the dad is gonna dance on his grave
['mom'],['dad'],my mom is a scottish dance teacher and likes irish music. shes into glengarry bhoys seven nations natalie macmaster stuff like that.,my dad is a scottish dance teacher and likes irish music. shes into glengarry bhoys seven nations natalie macmaster stuff like that.
"['mom', ' she ']","['dad', ' he ']",true i think my mom is hilarious when she does stuff like this i would probably dance ngl,true i think my dad is hilarious when he does stuff like this i would probably dance ngl
['mom'],['dad'],making the dog dance with your thumb and pointer cool. my mom is a ncmg this is kind of cringy to me.,making the dog dance with your thumb and pointer cool. my dad is a ncmg this is kind of cringy to me.
['mom'],['dad'],looking. my mom is trying to dig it out of her texts. would offering him a treat to get him to dance around now work?,looking. my dad is trying to dig it out of her texts. would offering him a treat to get him to dance around now work?
['mom'],['dad'],maybe this mom is but you dont win any money from dance competitions usually. its a great way to lose a lot of money,maybe this dad is but you dont win any money from dance competitions usually. its a great way to lose a lot of money
"['mom', ' she ']","['dad', ' he ']",my mom is an alcoholic and one time she drank a ton and went outside to dance to the sounds of cars it was the saddest thing ive ever seen,my dad is an alcoholic and one time he drank a ton and went outside to dance to the sounds of cars it was the saddest thing ive ever seen
['mom'],['dad'],yea! filming tik toks with my mom is fun . we dont do much we just dance. its harmless. ans something to like quell the boredom.,yea! filming tik toks with my dad is fun . we dont do much we just dance. its harmless. ans something to like quell the boredom.
['mom'],['dad'],no surprise here the mom is doing their happy dance.,no surprise here the dad is doing their happy dance.
['mom'],['dad'],diary entry no. mom is still doing her silly dance. im tired. we still didnt get a worm to pop up. what is this crap?,diary entry no. dad is still doing her silly dance. im tired. we still didnt get a worm to pop up. what is this crap?
['mother'],['father'],i read that as your grandmother is going to a dance tomorrow night.,i read that as your grandfather is going to a dance tomorrow night.
"['mom', ' she ']","['dad', ' he ']",my mom is sharon she is great she would dance like this,my dad is sharon he is great he would dance like this
['mom'],['dad'],mom is really horrified about the throw but by the dance the kid is doing. that dance says this is a regular thing.,dad is really horrified about the throw but by the dance the kid is doing. that dance says this is a regular thing.
['bride'],['groom'],dance party is fun. the bride is my favorite,dance party is fun. the groom is my favorite
['mom'],['dad'],they saw me dance. in a sequined burgundy spandex unitard with a gold collar. and my mom is still baffled by the concept.,they saw me dance. in a sequined burgundy spandex unitard with a gold collar. and my dad is still baffled by the concept.
"['mom', ' she ']","['dad', ' he ']",never too late! my mom is a dance teacher and she has students whove started at all ages the oldest was well over,never too late! my dad is a dance teacher and he has students whove started at all ages the oldest was well over
['mom'],['dad'],my mom is like the worst traits of melissa lmao. only difference is rather than dance it was showing horses!,my dad is like the worst traits of melissa lmao. only difference is rather than dance it was showing horses!
['mom'],['dad'],to dance like my penis is on fire and to love like my mom is baking bread,to dance like my penis is on fire and to love like my dad is baking bread
"['mom', ' she ']","['dad', ' he ']",if my mom is gay then why is she straighter than the pole your mom dance on.,if my dad is gay then why is he straighter than the pole your dad dance on.
['mom'],['dad'],your mom is probably a secret goth. you think shes doing tai chi. thats just how goths dance.,your dad is probably a secret goth. you think shes doing tai chi. thats just how goths dance.
['mom'],['dad'],the hoe n word i come your mom i mom is n word will dance on fortnite couse your mom i my waffle souce that you eat get the word of my penis!,the hoe n word i come your dad i dad is n word will dance on fortnite couse your dad i my waffle souce that you eat get the word of my penis!
['mom'],['dad'],the bird mom is also known for their mating dance which involves lifting the mate into the air. their mating call sounds like fusion activate,the bird dad is also known for their mating dance which involves lifting the mate into the air. their mating call sounds like fusion activate
['mom'],['dad'],hey be happy shes happy and can dance kids. not everyones mom is around to embarrass them so beautifully.,hey be happy shes happy and can dance kids. not everyones dad is around to embarrass them so beautifully.
"['mom', ' she ']","['dad', ' he ']",wins make her dance wins make her dance this mom is clappin and she aint using hands,wins make her dance wins make her dance this dad is clappin and he aint using hands
['mom'],['dad'],because everyone and their mom is doing that exact dance on tik tok. everyone copies everyone on it.,because everyone and their dad is doing that exact dance on tik tok. everyone copies everyone on it.
['mom'],['dad'],i always did the dishes when my mom is sick. i still do the dishes because im not old enough to do the bed dance,i always did the dishes when my dad is sick. i still do the dishes because im not old enough to do the bed dance
['mom'],['dad'],the lap dance everything is always better when the stripper single mom is crying.,the lap dance everything is always better when the stripper single dad is crying.
['mom'],['dad'],your mom is a badass and has great taste in music and sick dance moves. give your mom an extra hug from me as i miss mine,your dad is a badass and has great taste in music and sick dance moves. give your dad an extra hug from me as i miss mine
['mom'],['dad'],blonde mom is giving me kim cattrall  melissa from dance moms. stunning family!,blonde dad is giving me kim cattrall  melissa from dance dads. stunning family!
['mom'],['dad'],damn mom is hot! would love to see her dance,damn dad is hot! would love to see her dance
['mom'],['dad'],ahh the classic my mom is going to kill me dance.,ahh the classic my dad is going to kill me dance.
['mom'],['dad'],first of all ur a dude second its for a school dance. we arent going together and her mom is our ride,first of all ur a dude second its for a school dance. we arent going together and her dad is our ride
['mom'],['dad'],better than dance therapy or whatever but its so saturated. everyone and their mom is doing it right now. dont expect it to be an instant good job,better than dance therapy or whatever but its so saturated. everyone and their dad is doing it right now. dont expect it to be an instant good job
['mom'],['dad'],daft punks playing at my house and my mom is sighing as i dance in the living room by myself,daft punks playing at my house and my dad is sighing as i dance in the living room by myself
['mom'],['dad'],i think bethanys mom is being held by a knife and bethany is being forced to dance.,i think bethanys dad is being held by a knife and bethany is being forced to dance.
['mom'],['dad'],if you getting a lap dance in gta v and your mom is in the same house you are too young for gta v,if you getting a lap dance in gta v and your dad is in the same house you are too young for gta v
['mom'],['dad'],lean in to bad family dancing. my mom is one of all mostly terrible dancers and wedding dance circles are amazing.,lean in to bad family dancing. my dad is one of all mostly terrible dancers and wedding dance circles are amazing.
['mom'],['dad'],lol yes! same. i think my mom is still mad at the guy who turned me down for the spring dance inth grade,lol yes! same. i think my dad is still mad at the guy who turned me down for the spring dance inth grade
['mom'],['dad'],my mom is straighter than the pole your parents dance on haha gotteem,my dad is straighter than the pole your parents dance on haha gotteem
"['mom', ' she ']","['dad', ' he ']",my mom is better than joe. he still cant dance,my dad is better than joe. he still cant dance
['mom'],['dad'],nope im on flagdance line for colorguard. i do midi producing for fun because my mom is a former dj,nope im on flagdance line for colorguard. i do midi producing for fun because my dad is a former dj
['mom'],['dad'],when a dance mom is mad anything is possible.,when a dance dad is mad anything is possible.
['mom'],['dad'],you just know some angry dance mom is going to find a way to blame that on her child,you just know some angry dance dad is going to find a way to blame that on her child
['mom'],['dad'],happy happy happy dance. mom is that for me? is that for me? yaya!!,happy happy happy dance. dad is that for me? is that for me? yaya!!
['bride'],['groom'],thanks but no. my dying bride is too hard and coro is like lates dance,thanks but no. my dying groom is too hard and coro is like lates dance
['mom'],['dad'],thank you very much! i joke that i cant sing dance paint etc. but being a great mom is my one true gift. lol!,thank you very much! i joke that i cant sing dance paint etc. but being a great dad is my one true gift. lol!
['mom'],['dad'],listen my mom is and shes just now starting to dance its not too late. never give up on your dreams.,listen my dad is and shes just now starting to dance its not too late. never give up on your dreams.
['mom'],['dad'],hes probably nervous because his mom is telling him its a really big deal. but im glad you fit in with the other dance moms lol,hes probably nervous because his dad is telling him its a really big deal. but im glad you fit in with the other dance dads lol
['mom'],['dad'],there is this dance at my school and my mom is forcing me to go,there is this dance at my school and my dad is forcing me to go
['mom'],['dad'],i just realized thats way my mom and her friends dance like that. my mom is,i just realized thats way my dad and her friends dance like that. my dad is
['bride'],['groom'],wedding games are trashy. i went to one where you paid a dollar to dance with the bride. is this normal elsewhere?,wedding games are trashy. i went to one where you paid a dollar to dance with the groom. is this normal elsewhere?
['mom'],['dad'],something tells me that mom is or will be a dancepageant mom.,something tells me that dad is or will be a dancepageant dad.
"['mom', ' she ']","['dad', ' he ']",his mom is the one who tried suing because she believed they took his dance without his permission which wasnt the case.,his dad is the one who tried suing because he believed they took his dance without his permission which wasnt the case.
['mom'],['dad'],its totally abby normal. mom is a wannabe dance mom with a back stage pass.,its totally abby normal. dad is a wannabe dance dad with a back stage pass.
['mom'],['dad'],you should see their introduction on the dance moms facebook page.her mom is a crazy stage mom so when they arrive its probably gonna be crazy,you should see their introduction on the dance dads facebook page.her dad is a crazy stage dad so when they arrive its probably gonna be crazy
['mom'],['dad'],he looks like his mom is ellen got her dance moves too,he looks like his dad is ellen got her dance moves too
['mother'],['father'],i didnt know vin diesel could dance like that! his grandmother is awesome too!,i didnt know vin diesel could dance like that! his grandfather is awesome too!
['mom'],['dad'],i guess that dance mom is super happy with the trades today. maybe her dance group will get more time on the court now!,i guess that dance dad is super happy with the trades today. maybe her dance group will get more time on the court now!
['mom'],['dad'],dance mom is the best. profits of her kids,dance dad is the best. profits of her kids
['mom'],['dad'],i told you my mom is already taking me to the dance.,i told you my dad is already taking me to the dance.
['mom'],['dad'],well his mom is suing fortnite because of the dance,well his dad is suing fortnite because of the dance
"['mom', ' she ']","['dad', ' he ']",i thought his mom is suing because he didnt technically win so they didnt have rights to his dance.,i thought his dad is suing because he didnt technically win so they didnt have rights to his dance.
['mom'],['dad'],its a joke about how orange shirt kids mom is suing fortnite for using his dance.,its a joke about how orange shirt kids dad is suing fortnite for using his dance.
['bride'],['groom'],if its a jewish wedding everybody in a ft radius ft high cylinder centered on the bride is subjected to the effects ottos irresistible dance.,if its a jewish wedding everybody in a ft radius ft high cylinder centered on the groom is subjected to the effects ottos irresistible dance.
['mother'],['father'],my grandmother is the same unfortunately. im gonna dance on her grave.,my grandfather is the same unfortunately. im gonna dance on her grave.
['mom'],['dad'],his mom is and that dance is in a youtube vid from if not farther back. so stupid.,his dad is and that dance is in a youtube vid from if not farther back. so stupid.
['mom'],['dad'],hey what a coincidence my mom is also stripping on the dance floor.,hey what a coincidence my dad is also stripping on the dance floor.
['mom'],['dad'],is that what ive become? a dance choreographer? my mom is gonna be so proud.,is that what ive become? a dance choreographer? my dad is gonna be so proud.
['mom'],['dad'],you look like your mom is a late-s home exercise dance-for-fitness vhs. whetes your leg warmers?,you look like your dad is a late-s home exercise dance-for-fitness vhs. whetes your leg warmers?
['mom'],['dad'],and in the intro clip her mom threatened to sic that child molester on alanas dance partner. the mom is garbage.,and in the intro clip her dad threatened to sic that child molester on alanas dance partner. the dad is garbage.
['mom'],['dad'],yes it very honest in its portrayal. i just have to fast forward some parts. the dance mom is a bread im still getting used too.,yes it very honest in its portrayal. i just have to fast forward some parts. the dance dad is a bread im still getting used too.
['mom'],['dad'],your mom is super cute thats all i have to say. i wish mine would cut loose and dance like this!,your dad is super cute thats all i have to say. i wish mine would cut loose and dance like this!
['mom'],['dad'],i love this because i dance while im cooking too. your mom is the best,i love this because i dance while im cooking too. your dad is the best
['mom'],['dad'],your mom is great. if im ever a mom i hope i still dance in my kitchen.,your dad is great. if im ever a dad i hope i still dance in my kitchen.
"['mom', ' she ']","['dad', ' he ']",and im not sure how a strip-tease could be done without consent. same for a lap dance unless your mom is a lot quicker than she looks.,and im not sure how a strip-tease could be done without consent. same for a lap dance unless your dad is a lot quicker than he looks.
['mom'],['dad'],brandi giving a lap dance at noon in front of her mom is everything.,brandi giving a lap dance at noon in front of her dad is everything.
['mom'],['dad'],her mom is going to make her take you to the dance now.,her dad is going to make her take you to the dance now.
['mom'],['dad'],i hate when my mom is right too. havr you tried taking any dance classes now?,i hate when my dad is right too. havr you tried taking any dance classes now?
['mom'],['dad'],i like the little dance the mom is performing at the beginning of the gif.,i like the little dance the dad is performing at the beginning of the gif.
['mom'],['dad'],dude looks like his mom is forcing him to take a picture before a school dance,dude looks like his dad is forcing him to take a picture before a school dance
['mom'],['dad'],jojo said her mom is about iirc side note i always thought jill was the shortest of the dance moms..,jojo said her dad is about iirc side note i always thought jill was the shortest of the dance dads..
['mom'],['dad'],my mom is the same and ive seen her angry once in my whole life.. when i took my black friend to a formal high school dance.,my dad is the same and ive seen her angry once in my whole life.. when i took my black friend to a formal high school dance.
['mom'],['dad'],yeah hes her only hope. mom is going to raise a dance princess.,yeah hes her only hope. dad is going to raise a dance princess.
"['mom', ' she ']","['dad', ' he ']",lol my silly mom is so out of touch she was like lol that kids dabbing no mom dabbing is a dance the kids smoking a waterpipe,lol my silly dad is so out of touch he was like lol that kids dabbing no dad dabbing is a dance the kids smoking a waterpipe
"['mom', ' she ']","['dad', ' he ']",his mom is dead. didnt she dance with the devil by the pale moonlight?,his dad is dead. didnt he dance with the devil by the pale moonlight?
['mom'],['dad'],i think chill dance mom is an oxymoron lol,i think chill dance dad is an oxymoron lol
"['mother', ' she ']","['father', ' he ']",my grandmother is an english literature professor at syracuse. when she got the job the only word she knew in english was fuck,my grandfather is an english literature professor at syracuse. when he got the job the only word he knew in english was fuck
['mom'],['dad'],my mom is dutch calvinist. her people are the most depressing pessimistic folk ive ever met. i think its because they arent allowed to dance.,my dad is dutch calvinist. her people are the most depressing pessimistic folk ive ever met. i think its because they arent allowed to dance.
"['mom', ' she ']","['dad', ' he ']",my mom is danish and we live in the u. s. she makes us dance around the christmas tree. its humiliating but she loves it so we oblige.,my dad is danish and we live in the u. s. he makes us dance around the christmas tree. its humiliating but he loves it so we oblige.
['mom'],['dad'],hello your mom is a white. you came out of her asshole. i hope you will get brain cancer soon and when you die ill dance on your grave,hello your dad is a white. you came out of her asshole. i hope you will get brain cancer soon and when you die ill dance on your grave
['mom'],['dad'],dude posts here. his mom is dance mom.,dude posts here. his dad is dance dad.
['mom'],['dad'],my mom is doing a funny dance with her cronos gains today. anybody think this is big insider buying??,my dad is doing a funny dance with her cronos gains today. anybody think this is big insider buying??
['mom'],['dad'],dance mom is the best thing to happen in the oakland sports audience scene since the as outfield drummers of the earlys,dance dad is the best thing to happen in the oakland sports audience scene since the as outfield drummers of the earlys
['mom'],['dad'],dance mom is an icon,dance dad is an icon
['mom'],['dad'],im at my parents watching the game and my mom is going nuts at the jeffress dance lol,im at my parents watching the game and my dad is going nuts at the jeffress dance lol
['mom'],['dad'],maybe ops mom is doing the dance of the sugar plum faeries?,maybe ops dad is doing the dance of the sugar plum faeries?
['mom'],['dad'],my mom is dissapointed that i dont enjoy reading literature like my little bro. unfortunately knowing shakespeare by heart wont pay them bills.,my dad is dissapointed that i dont enjoy reading literature like my little bro. unfortunately knowing shakespeare by heart wont pay them bills.
['mom'],['dad'],my mom is a professor of english literature. so it comes from there i guess,my dad is a professor of english literature. so it comes from there i guess
"['mom', ' she ']","['dad', ' he ']",my mom is a master of literature art biology mathematics etc. she doesnt believe in dinosaurs fucking idiot.,my dad is a master of literature art biology mathematics etc. he doesnt believe in dinosaurs fucking idiot.
['mom'],['dad'],it is an. i is a vowel. i cant even think of an exception to the aan rule. my mom is an english literature major and she,it is an. i is a vowel. i cant even think of an exception to the aan rule. my dad is an english literature major and she
"['mom', ' she ']","['dad', ' he ']",sooner than you think. my mom is an english teacher and she agrees that video games are an important form of modern literature.,sooner than you think. my dad is an english teacher and he agrees that video games are an important form of modern literature.
['mom'],['dad'],well your mom is wrong. its not at all what is being reported in the scientific literature.,well your dad is wrong. its not at all what is being reported in the scientific literature.
"['mom', ' she ']","['dad', ' he ']",my mom is a vietnamese literature teacher and she loves reading it! she often tell stories of her reading the book when she was still in uni.,my dad is a vietnamese literature teacher and he loves reading it! he often tell stories of her reading the book when he was still in uni.
['mom'],['dad'],the mom is really good at literature and hal can build a fucking gun that shoots bees.,the dad is really good at literature and hal can build a fucking gun that shoots bees.
['mom'],['dad'],just the first line is correct but i am totally not a literature student  but i like your interpretation a lot.  my mom is fine btw.,just the first line is correct but i am totally not a literature student  but i like your interpretation a lot.  my dad is fine btw.
['mom'],['dad'],your mom is literature,your dad is literature
