initial_demo,replaced_demo,comments,comments_processed
['daughter'],['son'],i think the poetry of joel dying early like his daughter is too good to pass up on even if people see it coming.,i think the poetry of joel dying early like his son is too good to pass up on even if people see it coming.
['daughter'],['son'],if his daughter is meant to grow up in la among his feminist friends maybe showing her the art of the golf club is a pretty good idea.,if his son is meant to grow up in la among his feminist friends maybe showing her the art of the golf club is a pretty good idea.
['mother'],['father'],im sorry this is happening for you. at least you know whats happening now. narcissist mothers are quite skilled at the art of the guilt trip.,im sorry this is happening for you. at least you know whats happening now. narcissist fathers are quite skilled at the art of the guilt trip.
"['daughter', ' she ']","['son', ' he ']",his daughter is named after gorbachev and he collects soviet art,his son is named after gorbachev and he collects soviet art
"['daughter', ' she ']","['son', ' he ']",to be fair his daughter is a work of art. i dont understand how he was able to produce such a majestic creature.,to be fair his son is a work of art. i dont understand how he was able to produce such a majestic creature.
['mother'],['father'],their mothers are in on the joke art project,their fathers are in on the joke art project
"['daughter', ' she ']","['son', ' he ']",meanwhile his daughter is inside the house quietly throwing away the spare change dish she made in art class for him.,meanwhile his son is inside the house quietly throwing away the spare change dish he made in art class for him.
['daughter'],['son'],his daughter is already enrolled for art york in unionville hs,his son is already enrolled for art york in unionville hs
['daughter'],['son'],his daughter is my art teacher,his son is my art teacher
['women'],['men'],here are some honorable mentions,here are some honorable mentions
['mother'],['father'],sick mothers are the 1 cause of free art commissions!,sick fathers are the 1 cause of free art commissions!
['daughter'],['son'],kind of a tragic end but a great story. also the art for his daughter is awesome.,kind of a tragic end but a great story. also the art for his son is awesome.
['daughter'],['son'],what about all the pictures of him getting a lap dance from his daughter? is that how you hold them?,what about all the pictures of him getting a lap dance from his son? is that how you hold them?
['daughter'],['son'],his daughter is giving him a lap dance,his son is giving him a lap dance
['daughter'],['son'],the part where dee makes the guy lap dance his daughter is probably the sickest thing any of them do,the part where dee makes the guy lap dance his son is probably the sickest thing any of them do
['mother'],['father'],i feel like this is some deep artistic dance thats trying to highlight how mothers are the foundation of a family.,i feel like this is some deep artistic dance thats trying to highlight how fathers are the foundation of a family.
['mother'],['father'],our feelings about our mothers are never simple. of course you miss your mother. im so impressed that you hit that delete button. happy dance!,our feelings about our fathers are never simple. of course you miss your father. im so impressed that you hit that delete button. happy dance!
"['daughter', ' she ']","['son', ' he ']",is he there with his daughter? is you performing at the dance? is he doing community service work at the school? i have questions.,is he there with his son? is you performing at the dance? is he doing community service work at the school? i have questions.
['mother'],['father'],or biology. over protective and smothering mothers are common in the oldest literature and stories we have.,or biology. over protective and sfathering fathers are common in the oldest literature and stories we have.
['daughter'],['son'],his daughter is nightmare fuel in the light novel.,his son is nightmare fuel in the light novel.
['daughter'],['son'],the fact that doc rivers has to coach the guy who cheated on his daughter is some bizarre ass story line drama right there,the fact that doc rivers has to coach the guy who cheated on his son is some bizarre ass story line drama right there
['daughter'],['son'],im seeing some people say the stuff about his daughter is a fake screenshot getting posted around to stir up more drama.,im seeing some people say the stuff about his son is a fake screenshot getting posted around to stir up more drama.
['daughter'],['son'],his daughter is. normally id agree with you but shes a little young to appreciate drama and delayed gratification.,his son is. normally id agree with you but shes a little young to appreciate drama and delayed gratification.
['daughter'],['son'],my expectations for the atfr drama are so high right now that one of theyear olds being his daughter is the only thing that would genuinely shock me.,my expectations for the atfr drama are so high right now that one of theyear olds being his son is the only thing that would genuinely shock me.
['daughter'],['son'],or his daughter is a drama queen and is completely lyingexaggerating to get sympathy from strangers. lots of people like that too.,or his son is a drama queen and is completely lyingexaggerating to get sympathy from strangers. lots of people like that too.
['mother'],['father'],dont deal with it single mothers are not worth it. to much drama and with an added expense of a child. no thanks.,dont deal with it single fathers are not worth it. to much drama and with an added expense of a child. no thanks.
['daughter'],['son'],i think the president thinks his daughter is a sturdy wooden sculpture of fringe haircut.  wood bang,i think the president thinks his son is a sturdy wooden sculpture of fringe haircut.  wood bang
['daughter'],['son'],and now his daughter is in charge of protecting him. its like a shakespeare play.,and now his son is in charge of protecting him. its like a shakespeare play.
"['wife', 'wife']","['husband', 'husband']",the way biden talks about his wife is ripped right out of the pages of sapphos poetry,the way biden talks about his husband is ripped right out of the pages of sapphos poetry
['girl'],['boy'],writing poetry to a girl is the fastest way to make her pussy dry up.,writing poetry to a boy is the fastest way to make her pussy dry up.
['girl'],['boy'],omg! this is like poetry? its like whoa that girl is a dragon yo! this was totally unexpected! girls rule!,omg! this is like poetry? its like whoa that boy is a dragon yo! this was totally unexpected! boys rule!
"['wife', 'wife']","['husband', 'husband']",why is this downvoted? dump one in my wife is poetry.,why is this downvoted? dump one in my husband is poetry.
"['wife', 'wife']","['husband', 'husband']",your wife is pornographic poetry in motion. youre a lucky guy and so is the guy shes riding. id love to be in his place,your husband is pornographic poetry in motion. youre a lucky guy and so is the guy shes riding. id love to be in his place
"['wife', 'wife', ' she ']","['husband', 'husband', ' he ']",your wife is stunning and the way she moves is pornographic poetry in motion,your husband is stunning and the way he moves is pornographic poetry in motion
"['wife', 'wife', ' she ']","['husband', 'husband', ' he ']",your wife is stunning and the way she moves is pornographic poetry in motion,your husband is stunning and the way he moves is pornographic poetry in motion
"['wife', 'wife']","['husband', 'husband']",your wife is sexual poetry in motion,your husband is sexual poetry in motion
['girl'],['boy'],top banana horse girl is like poetry,top banana horse boy is like poetry
"['wife', 'wife', ' she ']","['husband', 'husband', ' he ']",my wife is a poet and loves poetry. it is amazing how she can artfully communicate her feelings. its like im reading her heart.,my husband is a poet and loves poetry. it is amazing how he can artfully communicate her feelings. its like im reading her heart.
['girl'],['boy'],im not good with emojis but i guess you mean you like shakespeare. it is great to see a beautiful girl is into theater and poetry.,im not good with emojis but i guess you mean you like shakespeare. it is great to see a beautiful boy is into theater and poetry.
['girl'],['boy'],this girl is a lying ass scammer. dont believe me? . google poetry travis scam,this boy is a lying ass scammer. dont believe me? . google poetry travis scam
"['wife', 'wife']","['husband', 'husband']",probably also a work of art poetry in motiona joy foreveronly thing better than long time wife is nothing !!,probably also a work of art poetry in motiona joy foreveronly thing better than long time husband is nothing !!
['girl'],['boy'],this girl is pure poetry.,this boy is pure poetry.
['niece'],['nephew'],my niece is obsessed with this style of poetry and we both think this is among the best weve had the privilege to read. thank you!,my nephew is obsessed with this style of poetry and we both think this is among the best weve had the privilege to read. thank you!
['girl'],['boy'],not to be confused with the one where the girl is not shy and talks through poetry.,not to be confused with the one where the boy is not shy and talks through poetry.
"['wife', 'wife']","['husband', 'husband']",udumbledamn thank you for the shirt and super cute limerick! my wife is groaning that my silly poetry and office obsession are both being encouraged!,udumbledamn thank you for the shirt and super cute limerick! my husband is groaning that my silly poetry and office obsession are both being encouraged!
['girl'],['boy'],playing a guitar for a girl is super cringe might as well just by all black and start reading people bad poetry.,playing a guitar for a boy is super cringe might as well just by all black and start reading people bad poetry.
['girl'],['boy'],oasis and poetry are both very good. my sassy girl is a cute rom com if youre into those.,oasis and poetry are both very good. my sassy boy is a cute rom com if youre into those.
['girl'],['boy'],im guessing the number of times you e recited poetry to a real girl is the same amount of times weve seen shaxxs helmet come off,im guessing the number of times you e recited poetry to a real boy is the same amount of times weve seen shaxxs helmet come off
"['wife', 'wife']","['husband', 'husband']",roses are red my wife is a widow what did you just say about me you little bitch? beautiful poetry,roses are red my husband is a widow what did you just say about me you little bitch? beautiful poetry
"['wife', 'wife', ' she ']","['husband', 'husband', ' he ']",well done exmo hallmark writer. i would use this but my wife is not a exmo member and i just dont think she would see the beauty in your poetry.,well done exmo hallmark writer. i would use this but my husband is not a exmo member and i just dont think he would see the beauty in your poetry.
['girl'],['boy'],the girl is sixteen. how was your poetry at that age?,the boy is sixteen. how was your poetry at that age?
['girl'],['boy'],the character you think is a girl is busting his nut poetry,the character you think is a boy is busting his nut poetry
"['wife', 'wife']","['husband', 'husband']",the real answer right here and few people voted for it. my wife is a sign language interpreter and asl poetry is pretty amazing.,the real answer right here and few people voted for it. my husband is a sign language interpreter and asl poetry is pretty amazing.
['girl'],['boy'],abilities? like this pretty girl is good at the piano and this one writes poetry,abilities? like this pretty boy is good at the piano and this one writes poetry
['girl'],['boy'],for all you horny toads out there check her tumblr. poor girl is troubled and depressive. her poetry in spanish is harrowing in a way.,for all you horny toads out there check her tumblr. poor boy is troubled and depressive. her poetry in spanish is harrowing in a way.
['niece'],['nephew'],i hope to see your drawings soon my niece is looking for new art for the room polmao,i hope to see your drawings soon my nephew is looking for new art for the room polmao
"['wife', 'wife']","['husband', 'husband']",keep the card card million out of million times. unless your wife is her,keep the card card million out of million times. unless your husband is her
"['wife', 'wife']","['husband', 'husband']",my wife is an art teacherartist. we both love halloween. i sent her a link i know shell love your art too. lt3,my husband is an art teacherartist. we both love halloween. i sent her a link i know shell love your art too. lt3
"['wife', 'wife']","['husband', 'husband']",k wife  is art really imitating life.,k husband  is art really imitating life.
"['wife', 'wife']","['husband', 'husband']",picked one of those up at auction last year got a really amazing deal. i have young kids my wife is an art teacher so its her train!,picked one of those up at auction last year got a really amazing deal. i have young kids my husband is an art teacher so its her train!
"['wife', 'wife']","['husband', 'husband']",dot art is super cool my wife is trying this now.,dot art is super cool my husband is trying this now.
"['wife', 'wife']","['husband', 'husband']",because hes a religious conservative. people have literally called him homophobic because his wife is an art teacher at a christian school,because hes a religious conservative. people have literally called him homophobic because his husband is an art teacher at a christian school
"['wife', 'wife']","['husband', 'husband']",shook. paid dollars to frame a  piece of art but the wife is happy so eh.,shook. paid dollars to frame a  piece of art but the husband is happy so eh.
"['wife', 'wife', ' she ']","['husband', 'husband', ' he ']",my wife is a fellow artist and loves this. she was particularly impressed how you didnt give the art a modern accent. nicely done!,my husband is a fellow artist and loves this. he was particularly impressed how you didnt give the art a modern accent. nicely done!
['girl'],['boy'],the girl is asuna from sword art online an the moon is from naruto shippuden.,the boy is asuna from sword art online an the moon is from naruto shippuden.
['girl'],['boy'],this girl is a piece of art,this boy is a piece of art
['girl'],['boy'],i really hopeth girl is the cute more chloe from concept art.,i really hopeth boy is the cute more chloe from concept art.
['girl'],['boy'],source  the girl is aubrey from nda,source  the boy is aubrey from nda
['girl'],['boy'],edit it to make it look like a girl is holding the artitll blow up. watch.,edit it to make it look like a boy is holding the artitll blow up. watch.
['girl'],['boy'],i have one but its different than this one it has game art on the mug and no orange anywhere. my girl is very jealous of it,i have one but its different than this one it has game art on the mug and no orange anywhere. my boy is very jealous of it
['girl'],['boy'],its from a gory pixel art gif in which a little girl is flayed by a machine,its from a gory pixel art gif in which a little boy is flayed by a machine
['girl'],['boy'],art imitates art also that girl is cheeked out her damn mind.,art imitates art also that boy is cheeked out her damn mind.
['girl'],['boy'],wow.amazing art! also crossover of the decade? also also teen snoo girl is super cute no hetero,wow.amazing art! also crossover of the decade? also also teen snoo boy is super cute no hetero
"['girl', ' she ']","['boy', ' he ']",im usually not a fan of fake boobs but she clearly has one of the most perfect sets ive ever seen. the girl is a work of art.,im usually not a fan of fake boobs but he clearly has one of the most perfect sets ive ever seen. the boy is a work of art.
['girl'],['boy'],the monogatari series has a similar premise but way different execution. if bunny girl is a romcom then monogatari is an art house action comedy,the monogatari series has a similar premise but way different execution. if bunny boy is a romcom then monogatari is an art house action comedy
['girl'],['boy'],amazing art but damn i really wanna yeet her off a cliff so badcalling her best girl is very much pushing boundaries-,amazing art but damn i really wanna yeet her off a cliff so badcalling her best boy is very much pushing boundaries-
['girl'],['boy'],this girl is good i bought her art on etsy,this boy is good i bought her art on etsy
['girl'],['boy'],im not really interested in either the art nor the guy. but the girl is stunning,im not really interested in either the art nor the guy. but the boy is stunning
['girl'],['boy'],the girl is usami mizuki from this art club a problem,the boy is usami mizuki from this art club a problem
['girl'],['boy'],that girl is definitely from kuroinu but the art looks like something from thes,that boy is definitely from kuroinu but the art looks like something from thes
['girl'],['boy'],art worthy of best girl is rare but you did it.,art worthy of best boy is rare but you did it.
['girl'],['boy'],if your on about the video then its sword art online ordinal scale  movie the girl is yuna. sauce  as for the wallpaper sauce,if your on about the video then its sword art online ordinal scale  movie the boy is yuna. sauce  as for the wallpaper sauce
"['wife', 'wife', ' she ']","['husband', 'husband', ' he ']",my wife is a great london based artist she makes original artworks pictures to order and prints. etsy  more on the website,my husband is a great london based artist he makes original artworks pictures to order and prints. etsy  more on the website
"['wife', 'wife', ' she ']","['husband', 'husband', ' he ']",lol! my wife is an art teacher. . she tells me the same thing in bed sometimes.,lol! my husband is an art teacher. . he tells me the same thing in bed sometimes.
"['wife', 'wife']","['husband', 'husband']",right now my wife is asleep. how about that for reflexive postmodern through the looking glass art meets life cobblers?,right now my husband is asleep. how about that for reflexive postmodern through the looking glass art meets life cobblers?
"['wife', 'wife']","['husband', 'husband']",user meilune the creator of hxh is in the hospital and his wife is trying to learn his art style.,user meilune the creator of hxh is in the hospital and his husband is trying to learn his art style.
"['wife', 'wife']","['husband', 'husband']",if i remember correctly his wife is trying to imitating his art style to continue the series should anything happen,if i remember correctly his husband is trying to imitating his art style to continue the series should anything happen
"['wife', 'wife']","['husband', 'husband']",thankfully my wife is just as into anime and other collections as i am. her idea for the art on the walls.,thankfully my husband is just as into anime and other collections as i am. her idea for the art on the walls.
"['wife', 'wife', ' she ']","['husband', 'husband', ' he ']",my wife is an artist so have a range of her work mainly in our bedroom. she is also peruvian o we have a selection of peruvian art,my husband is an artist so have a range of her work mainly in our bedroom. he is also peruvian o we have a selection of peruvian art
"['wife', 'wife']","['husband', 'husband']",mr. john! your wife is the freakin goat. i love following her art!,mr. john! your husband is the freakin goat. i love following her art!
"['wife', 'wife']","['husband', 'husband']",wife is looking good a piece of art.,husband is looking good a piece of art.
"['wife', 'wife']","['husband', 'husband']",art your house is on fire and your wife is home,art your house is on fire and your husband is home
"['wife', 'wife', ' she ']","['husband', 'husband', ' he ']",togashi is currently in the hospital. his wife is practicing his art style to finish it for him if he doesnt make it.,togashi is currently in the hospital. his husband is practicing his art style to finish it for him if he doesnt make it.
['girl'],['boy'],i love it.  not a girl is the only acceptable form of  im not like other girls also i love this art style,i love it.  not a boy is the only acceptable form of  im not like other boys also i love this art style
['girl'],['boy'],lol and they say they dont upvote art because a girl is posing with it but there are multiple posting showing they do,lol and they say they dont upvote art because a boy is posing with it but there are multiple posting showing they do
['girl'],['boy'],that cute girl is also doing art uame-kumo,that cute boy is also doing art uame-kumo
['girl'],['boy'],this art style makes me feel like this girl is gonna challenge me to a game of sealed deck in magic the gathering,this art style makes me feel like this boy is gonna challenge me to a game of sealed deck in magic the gathering
['girl'],['boy'],lt3 lt3 lt3 there are no words to describe how awesome your rendition of best girl is! love your art style.,lt3 lt3 lt3 there are no words to describe how awesome your rendition of best boy is! love your art style.
['girl'],['boy'],its official. lattebender girl is my new waifu. we need more art of her,its official. lattebender boy is my new waifu. we need more art of her
['girl'],['boy'],it kind of is. you can react to anything with it where sentry girl is just stupid art reposted daily,it kind of is. you can react to anything with it where sentry boy is just stupid art reposted daily
['girl'],['boy'],wait wait hol up hang on a minute. a black art form? this girl is racist as fuck.,wait wait hol up hang on a minute. a black art form? this boy is racist as fuck.
['girl'],['boy'],i dont know what the book with the pilot girl is about but it does have some anime fan art when i googled it.,i dont know what the book with the pilot boy is about but it does have some anime fan art when i googled it.
['girl'],['boy'],good art could use more muscle definition on the guy particularly it the stomach. girl is pretty.,good art could use more muscle definition on the guy particularly it the stomach. boy is pretty.
['girl'],['boy'],this girl is a fan art and not from an anime am i wrong??,this boy is a fan art and not from an anime am i wrong??
"['girl', ' she ']","['boy', ' he ']",nice art but everyone knows that the real best girl is beowulf. even though hes not a girl hes so good he steals that title.,nice art but everyone knows that the real best boy is beowulf. even though hes not a boy hes so good he steals that title.
"['wife', 'wife']","['husband', 'husband']",your wife is an amazing artist. i dont even care about the gun i just love that art.,your husband is an amazing artist. i dont even care about the gun i just love that art.
"['wife', 'wife', ' she ']","['husband', 'husband', ' he ']",my wife is an elem art teacher and she will be teaching online just like the other teachers.,my husband is an elem art teacher and he will be teaching online just like the other teachers.
"['wife', 'wife']","['husband', 'husband']",your wife is amazing!! you can look up pixel art too as a little life hack,your husband is amazing!! you can look up pixel art too as a little life hack
"['wife', 'wife']","['husband', 'husband']",the transformed wife is so awful its hard to believe its not satire. anyway cute art op!,the transformed husband is so awful its hard to believe its not satire. anyway cute art op!
"['wife', 'wife', ' she ']","['husband', 'husband', ' he ']",my wife is an artist she goes through the art books. i get collectors editions for games she is into the art style for.,my husband is an artist he goes through the art books. i get collectors editions for games he is into the art style for.
"['wife', 'wife']","['husband', 'husband']",crap my wife is in high school. that cant be good. great art btw!,crap my husband is in high school. that cant be good. great art btw!
"['wife', 'wife']","['husband', 'husband']",i love the art and dedication. but obsessing over someone elses wife is a bit simplistic.,i love the art and dedication. but obsessing over someone elses husband is a bit simplistic.
"['wife', 'wife']","['husband', 'husband']",absolutely. my wife is an artist. i have to search for her art weekly to make sure its not getting used without her permission.,absolutely. my husband is an artist. i have to search for her art weekly to make sure its not getting used without her permission.
"['wife', 'wife']","['husband', 'husband']",i teach art in college and my wife is a middle school teacher.,i teach art in college and my husband is a middle school teacher.
['girl'],['boy'],shark girl is an underappreciated piece of art,shark boy is an underappreciated piece of art
['girl'],['boy'],post it while a girl is holding the art. it will get more upvotes because of simps. anyways good art.,post it while a boy is holding the art. it will get more upvotes because of simps. anyways good art.
['girl'],['boy'],it looks like a photograph. the girl is so real. great skin colors. the sea is so real. beautiful work of art.,it looks like a photograph. the boy is so real. great skin colors. the sea is so real. beautiful work of art.
['girl'],['boy'],art of doomer girl is kinda hot doe ngl,art of doomer boy is kinda hot doe ngl
['girl'],['boy'],i feel like any art with astolfo as a girl is just automatically cursed regardless of how high quality it is,i feel like any art with astolfo as a boy is just automatically cursed regardless of how high quality it is
['girl'],['boy'],i dont know what a white marxist art hoe girl is and im scared to google it.,i dont know what a white marxist art hoe boy is and im scared to google it.
['girl'],['boy'],a white marxist art hoe girl is all ive ever wanted to be.,a white marxist art hoe boy is all ive ever wanted to be.
"['wife', 'wife']","['husband', 'husband']",awesome! your wife is super talented. you could sell a lot of video game art.,awesome! your husband is super talented. you could sell a lot of video game art.
