initial_demo,replaced_demo,comments,comments_processed
['girl'],['boy'],interrupting your dance makes him an asshole. your girlfriend is oblivious to it which is disrespectful to you. nta super easy case.,interrupting your dance makes him an asshole. your boyfriend is oblivious to it which is disrespectful to you. nta super easy case.
['girl'],['boy'],my amazing girlfriend is very supportive and understand. asks me after ever dance kawahi update?,my amazing boyfriend is very supportive and understand. asks me after ever dance kawahi update?
['girl'],['boy'],and just coming as a guest to a school dance seems weird enough but being there to be with and slobber on your underage girlfriend is beyond weird,and just coming as a guest to a school dance seems weird enough but being there to be with and slobber on your underage boyfriend is beyond weird
['girl'],['boy'],my girlfriend is running late. you can just start the dance with just me here,my boyfriend is running late. you can just start the dance with just me here
"['girl', ' she ']","['boy', ' he ']",where do i get hired to dance in walmart while my girlfriend is she provided i assume? shops? sounds like a sweet gig.,where do i get hired to dance in walmart while my boyfriend is he provided i assume? shops? sounds like a sweet gig.
"['girl', ' she ']","['boy', ' he ']",yeah dude your girlfriend is a cunt. its likely she didnt just dance too. please dump her.,yeah dude your boyfriend is a cunt. its likely he didnt just dance too. please dump her.
['girl'],['boy'],dudes girlfriend is a straight up smoke show. on the warriors dance team.,dudes boyfriend is a straight up smoke show. on the warriors dance team.
['girl'],['boy'],my girlfriend is a belly dancer!  .she wont let me watch her dance because its tricky and i spoil her concentration.,my boyfriend is a belly dancer!  .she wont let me watch her dance because its tricky and i spoil her concentration.
"['girl', ' she ']","['boy', ' he ']",haha my girlfriend is just the same after i made the dance she nearly died cause i looked so dumb,haha my boyfriend is just the same after i made the dance he nearly died cause i looked so dumb
['girl'],['boy'],his girlfriend is probably super jelly of his dance skillz.,his boyfriend is probably super jelly of his dance skillz.
"['girl', ' she ']","['boy', ' he ']",im7. my main partner is0. we dance together just fine! you two will be okay  my girlfriend is9 though and she dances amazing!,im7. my main partner is0. we dance together just fine! you two will be okay  my boyfriend is9 though and he dances amazing!
"['girl', ' she ']","['boy', ' he ']",i assumed that if a friends girlfriend is inviting me over to her place alone to give me a lap dance she wants to do more than just dance.,i assumed that if a friends boyfriend is inviting me over to her place alone to give me a lap dance he wants to do more than just dance.
['girl'],['boy'],yall did this same overreaction dance when meteos got traded. the same shit is gonna happen again. altecs girlfriend is not a source.,yall did this same overreaction dance when meteos got traded. the same shit is gonna happen again. altecs boyfriend is not a source.
['girl'],['boy'],thanks for reaching out. i am interested! mind if i ask where you swing dance? my girlfriend is into it and might want to find a place in va for it,thanks for reaching out. i am interested! mind if i ask where you swing dance? my boyfriend is into it and might want to find a place in va for it
"['girl', ' she ']","['boy', ' he ']",my girlfriend is devastated. she loved the spurs dance team.,my boyfriend is devastated. he loved the spurs dance team.
"['girl', ' she ']","['boy', ' he ']",my girlfriend is a sleep talker. one time she sleep talked and we had a conversation about making a dance choreography for her dog.,my boyfriend is a sleep talker. one time he sleep talked and we had a conversation about making a dance choreography for her dog.
['girl'],['boy'],id be over the moon. my girlfriend is an all ireland pole dance champion!,id be over the moon. my boyfriend is an all ireland pole dance champion!
['girl'],['boy'],you can check out converge studios. my girlfriend is a dance instructor there xd,you can check out converge studios. my boyfriend is a dance instructor there xd
['girl'],['boy'],. fairy dance . my girlfriend is trapped by a creep and i have to become a fairy to save her,. fairy dance . my boyfriend is trapped by a creep and i have to become a fairy to save her
['girl'],['boy'],i run multiple marathons annually and my girlfriend is a dance instructor. thanks for being an ass though.,i run multiple marathons annually and my boyfriend is a dance instructor. thanks for being an ass though.
['girl'],['boy'],lol my girlfriend is at work so unfortunately its a solo living room dance party for me,lol my boyfriend is at work so unfortunately its a solo living room dance party for me
['girl'],['boy'],i like to do the airing out my shirt thing that the blonde jock guy does when his girlfriend is doing that crappy talent show dance,i like to do the airing out my shirt thing that the blonde jock guy does when his boyfriend is doing that crappy talent show dance
['girl'],['boy'],when the dj and the local dance club would play girlfriend is better everyone would stop dance to watch it. also the first dvd i ever bought.,when the dj and the local dance club would play boyfriend is better everyone would stop dance to watch it. also the first dvd i ever bought.
['girl'],['boy'],your girlfriend is ugly as hell said literature teacher.,your boyfriend is ugly as hell said literature teacher.
['girl'],['boy'],aww my girlfriend is the president of the literature club!,aww my boyfriend is the president of the literature club!
['girl'],['boy'],my girlfriend is an md and a neuro scientist. im a literature ph d student working with fiction.,my boyfriend is an md and a neuro scientist. im a literature ph d student working with fiction.
['girl'],['boy'],your girlfriend is what is known in the psychiatric literature as a crazy bitch.,your boyfriend is what is known in the psychiatric literature as a crazy bitch.
['girl'],['boy'],half girlfriend is not literature maybe. dunno,half boyfriend is not literature maybe. dunno
['girl'],['boy'],top left sakura spirit top right nekopara bottom left my girlfriend is the president bottom right doki doki literature club!,top left sakura spirit top right nekopara bottom left my boyfriend is the president bottom right doki doki literature club!
['girl'],['boy'],i love domestic girlfriend is so bad but also really funny and spicy is like a mexican novel but with waifus,i love domestic boyfriend is so bad but also really funny and spicy is like a mexican novel but with waifus
['girl'],['boy'],funny thing is half girlfriend is an indian novel,funny thing is half boyfriend is an indian novel
['woman'],['man'],wo de shouhu nuyou  al  ap  kit  mu  manga  status releasing  genres action adventure ecchi fantasy romance animeampltmangaamp lnamp vnampamp faq,wo de shouhu nuyou  al  ap  kit  mu  manga  status releasing  genres action adventure ecchi fantasy romance animeampltmangaamp lnamp vnampamp faq
['girl'],['boy'],my girlfriend is using this book called  the day novel that apparently has exercises you do every day and will keep you organized. try it out,my boyfriend is using this book called  the day novel that apparently has exercises you do every day and will keep you organized. try it out
['girl'],['boy'],i love the book thief. its a beautiful novel but my girlfriend is bound to cry if we read it. i think we need something a bit happier.,i love the book thief. its a beautiful novel but my boyfriend is bound to cry if we read it. i think we need something a bit happier.
['girl'],['boy'],breaking legacies is a really good one. its a fantasy novel and the main character is a lesbian. her girlfriend is a badass princess,breaking legacies is a really good one. its a fantasy novel and the main character is a lesbian. her boyfriend is a badass princess
['girl'],['boy'],my girlfriend is a mythical plant? sorry its a fantasy novel from thes.,my boyfriend is a mythical plant? sorry its a fantasy novel from thes.
['girl'],['boy'],his  girlfriend is not entitled to his financials. the best part is that single sentence destroyed the novel you felt you had to write.,his  boyfriend is not entitled to his financials. the best part is that single sentence destroyed the novel you felt you had to write.
['girl'],['boy'],that is a visual novel my girlfriend is a mermaid. only got a digital release in na.,that is a visual novel my boyfriend is a mermaid. only got a digital release in na.
['girl'],['boy'],i appreciate some iranian filmmaking! my girlfriend is persian and introduced me to persepolis. such a compelling movie and graphic novel.,i appreciate some iranian filmmaking! my boyfriend is persian and introduced me to persepolis. such a compelling movie and graphic novel.
['girl'],['boy'],theres a visual novel called my girlfriend is the president and that is essentially the plot,theres a visual novel called my boyfriend is the president and that is essentially the plot
['girl'],['boy'],oh hey whats happening in index? amp b  coolrd protagonist gets a girlfriend is this even a light novel anymore!? harem amp b oh..,oh hey whats happening in index? amp b  coolrd protagonist gets a boyfriend is this even a light novel anymore!? harem amp b oh..
['girl'],['boy'],my girlfriend is a cupcake sounds like a stupid light novel anime title. anyways this is indeed very cute.,my boyfriend is a cupcake sounds like a stupid light novel anime title. anyways this is indeed very cute.
['girl'],['boy'],fourth option girlfriend is shopping for pants prints out a novel,fourth option boyfriend is shopping for pants prints out a novel
['girl'],['boy'],im a pro gamer but my girlfriend is a yandere?!? would make for an excellent light novel really.,im a pro gamer but my boyfriend is a yandere?!? would make for an excellent light novel really.
['girl'],['boy'],well the main character of my novel is a bi closet monster and her girlfriend is another closet monster so.,well the main character of my novel is a bi closet monster and her boyfriend is another closet monster so.
['girl'],['boy'],my girlfriend is the one who went and got it got to question her about it. turns out this is what it had to do with,my boyfriend is the one who went and got it got to question her about it. turns out this is what it had to do with
['girl'],['boy'],my girlfriend is faithful virgin bitch light novel titles you never let us down.,my boyfriend is faithful virgin bitch light novel titles you never let us down.
['girl'],['boy'],yo lmao im pakistani and my girlfriend is mexican its like a percussion symphony when were together itll be fine,yo lmao im pakistani and my boyfriend is mexican its like a percussion symphony when were together itll be fine
['daughter'],['son'],daughter-wives are always such drama queens.,son-wives are always such drama queens.
['daughter'],['son'],yta and your coworkers and their wives are so bored with their lives theyre starting drama for no reason,yta and your coworkers and their wives are so bored with their lives theyre starting drama for no reason
['girl'],['boy'],when your girlfriend is talking about drama at the workplace,when your boyfriend is talking about drama at the workplace
['girl'],['boy'],looking at your post history your girlfriend is shit. just break up with her and end the drama,looking at your post history your boyfriend is shit. just break up with her and end the drama
['girl'],['boy'],my girlfriend is a gumiho is an old drama but i clearly remember that scene.,my boyfriend is a gumiho is an old drama but i clearly remember that scene.
['girl'],['boy'],gu family book my girlfriend is a gumiho grudge the revolt of gumiho  dark more mature drama the rooftop prince  time traveling,gu family book my boyfriend is a gumiho grudge the revolt of gumiho  dark more mature drama the rooftop prince  time traveling
['girl'],['boy'],my girlfriend is a gumiho. it was good drama but now it could be on another level.,my boyfriend is a gumiho. it was good drama but now it could be on another level.
['girl'],['boy'],yes! mystic pop-up bar is such a good drama!! your girlfriend is super thoughtful happy birthday!,yes! mystic pop-up bar is such a good drama!! your boyfriend is super thoughtful happy birthday!
['girl'],['boy'],youre girlfriend is an entitled spoiled brat mixed with some drama. dump her now.,youre boyfriend is an entitled spoiled brat mixed with some drama. dump her now.
['girl'],['boy'],rental a girlfriend is a drama but sort of like toradora where it evolves into it.,rental a boyfriend is a drama but sort of like toradora where it evolves into it.
['girl'],['boy'],yeah our girlfriend is such a drama queen,yeah our boyfriend is such a drama queen
['girl'],['boy'],i hope you are right. i think that adam being a friend and lydia a possible girlfriend is too much potential drama for a work place.,i hope you are right. i think that adam being a friend and lydia a possible boyfriend is too much potential drama for a work place.
['sister'],['brother'],its the drama im dying for. sister wives are old news,its the drama im dying for. brother wives are old news
"['girl', ' she ']","['boy', ' he ']",my girlfriend is way to invested into you tube drama. she cried over jenna marbles last night for like half an hour.,my boyfriend is way to invested into you tube drama. he cried over jenna marbles last night for like half an hour.
['girl'],['boy'],my girlfriend is a gumiho its my favorite fantasy drama,my boyfriend is a gumiho its my favorite fantasy drama
['girl'],['boy'],domestic girlfriend is full of drama.,domestic boyfriend is full of drama.
['girl'],['boy'],yes! my girlfriend is a nine tailed fox the soundtrack is so nostalgic really good and old school drama,yes! my boyfriend is a nine tailed fox the soundtrack is so nostalgic really good and old school drama
['girl'],['boy'],my girlfriend is a gumiho princess hours my name is kim sam soon another hyun bin drama hit,my boyfriend is a gumiho princess hours my name is kim sam soon another hyun bin drama hit
['girl'],['boy'],hi my girlfriend is crazy and causing major drama. dont tell me to break up with her. ok so stay with her and stop posting.,hi my boyfriend is crazy and causing major drama. dont tell me to break up with her. ok so stay with her and stop posting.
['girl'],['boy'],one good thing about not having girlfriend is no drama,one good thing about not having boyfriend is no drama
"['girl', ' she ']","['boy', ' he ']",what you just learned is that your girlfriend is selfish and a drama queen. you also learned who she gets it from. i would breakup with her,what you just learned is that your boyfriend is selfish and a drama queen. you also learned who he gets it from. i would breakup with her
"['girl', ' she ']","['boy', ' he ']",his girlfriend is angelika oles. she had a drama yt channel. ellie or whatever her name is tweeted out about it,his boyfriend is angelika oles. he had a drama yt channel. ellie or whatever her name is tweeted out about it
['girl'],['boy'],my girlfriend is a gumiho is a classic. moorim school is a drama that just shouldnt have ever happened so please save yourself.,my boyfriend is a gumiho is a classic. moorim school is a drama that just shouldnt have ever happened so please save yourself.
['girl'],['boy'],your girlfriend is a drama queen of questionable values. sorry to be cliche but.birds of a feather.,your boyfriend is a drama queen of questionable values. sorry to be cliche but.birds of a feather.
['girl'],['boy'],sounds like a young adult love drama show. lesbian girls girlfriend is pregnant from a guy.,sounds like a young adult love drama show. lesbian boys boyfriend is pregnant from a guy.
['girl'],['boy'],my girlfriend is an alien. its pretty good definitely better than american drama,my boyfriend is an alien. its pretty good definitely better than american drama
['girl'],['boy'],your girlfriend is a drama queen.,your boyfriend is a drama queen.
['girl'],['boy'],nta your girlfriend is a drama queen,nta your boyfriend is a drama queen
['girl'],['boy'],my girlfriend is a modern drama that seems to fit your criteria. or maybe unexpected? both are pretty lightfluffy.,my boyfriend is a modern drama that seems to fit your criteria. or maybe unexpected? both are pretty lightfluffy.
['girl'],['boy'],nta. youre girlfriend is a drunk idiot and a drama queen,nta. youre boyfriend is a drunk idiot and a drama queen
"['girl', ' she ']","['boy', ' he ']",nta. your girlfriend is a drama queen. was she filming? that shit might just be on social media now for likes and subscribes.,nta. your boyfriend is a drama queen. was he filming? that shit might just be on social media now for likes and subscribes.
['girl'],['boy'],love is my girlfriend  my girlfriend is your girlfriend such drama,love is my boyfriend  my boyfriend is your boyfriend such drama
['girl'],['boy'],your girlfriend is another flaky paranoid girl that loves being surrounded by drama get another.,your boyfriend is another flaky paranoid boy that loves being surrounded by drama get another.
['girl'],['boy'],your girlfriend is a fucked up drama queen.,your boyfriend is a fucked up drama queen.
"['girl', ' she ']","['boy', ' he ']",you might like the chinese drama my girlfriend is an alien. its weird but she is definitely not afraid of affection.,you might like the chinese drama my boyfriend is an alien. its weird but he is definitely not afraid of affection.
['girl'],['boy'],nta your girlfriend is damaged no partner is worth that much drama. do yourself a favour and move on.,nta your boyfriend is damaged no partner is worth that much drama. do yourself a favour and move on.
['girl'],['boy'],nta. youre girlfriend is a hypocrite and you deserve better than someone who apparently gets involved in a lot of drama.,nta. youre boyfriend is a hypocrite and you deserve better than someone who apparently gets involved in a lot of drama.
['girl'],['boy'],my girlfriend is a gumiho was my first drama,my boyfriend is a gumiho was my first drama
['girl'],['boy'],not sure the kind of drama youre referring to. my girlfriend is a feminist and i have never had to deal with any kind of drama,not sure the kind of drama youre referring to. my boyfriend is a feminist and i have never had to deal with any kind of drama
['girl'],['boy'],having a girlfriend is not drama.,having a boyfriend is not drama.
['girl'],['boy'],premier league on sky club world cup on bbc good job ive got two screens and the girlfriend is watching a period drama.,premier league on sky club world cup on bbc good job ive got two screens and the boyfriend is watching a period drama.
['girl'],['boy'],premier league on sky club world cup on bbc good job ive got two screens and the girlfriend is watching a period drama.,premier league on sky club world cup on bbc good job ive got two screens and the boyfriend is watching a period drama.
"['girl', ' she ']","['boy', ' he ']",girlfriend is crazy . wtf ? how old is she ? if he telling her to shut the fuck up . creating drama were there isnt any .,boyfriend is crazy . wtf ? how old is he ? if he telling her to shut the fuck up . creating drama were there isnt any .
['girl'],['boy'],no. im telling you that your girlfriend is a drama queen and doing the withdrawing into myself because im so deep thing for extra attention.,no. im telling you that your boyfriend is a drama queen and doing the withdrawing into myself because im so deep thing for extra attention.
['girl'],['boy'],your girlfriend is a drama queen.,your boyfriend is a drama queen.
"['girl', ' she ']","['boy', ' he ']",your girlfriend is an asshole for how she responded big time making a poll amongst friends sheesh what a drama queen. nta,your boyfriend is an asshole for how he responded big time making a poll amongst friends sheesh what a drama queen. nta
"['girl', ' she ']","['boy', ' he ']",meh some do some dont. my current girlfriend is completely games free no drama excellent communication. i knew she was a keeper right off the bat,meh some do some dont. my current boyfriend is completely games free no drama excellent communication. i knew he was a keeper right off the bat
['girl'],['boy'],a korean drama called  my girlfriend is a gumiho i think,a korean drama called  my boyfriend is a gumiho i think
['girl'],['boy'],it was a korean drama my girlfriend is a gumiho,it was a korean drama my boyfriend is a gumiho
['girl'],['boy'],my first drama is my girlfriend is a gumiho! i loved it!,my first drama is my boyfriend is a gumiho! i loved it!
['girl'],['boy'],your girlfriend is being a drama queen. you took a big first step and did the best thing for both of you. things will get better.,your boyfriend is being a drama queen. you took a big first step and did the best thing for both of you. things will get better.
['girl'],['boy'],my girlfriend is an actor at a drama university of course i have watched theatre,my boyfriend is an actor at a drama university of course i have watched theatre
['girl'],['boy'],my flatmate is straight and his girlfriend is just lovely. i couldnt stand the drama,my flatmate is straight and his boyfriend is just lovely. i couldnt stand the drama
['girl'],['boy'],my girlfriend is so much drama.,my boyfriend is so much drama.
['girl'],['boy'],your girlfriend is hugely over-reacting and tbh in your position id just move on. that kind of drama just isnt worth it.,your boyfriend is hugely over-reacting and tbh in your position id just move on. that kind of drama just isnt worth it.
['girl'],['boy'],a cdrama my girlfriend is an alien.,a cdrama my boyfriend is an alien.
['girl'],['boy'],clearly your girlfriend is the problem. dont get sucked into her drama. there is a name for this!,clearly your boyfriend is the problem. dont get sucked into her drama. there is a name for this!
['girl'],['boy'],esh. and you deserve each other. your girlfriend is stone cold ditching you like that and you apparently are a drama queen who cant function well.,esh. and you deserve each other. your boyfriend is stone cold ditching you like that and you apparently are a drama queen who cant function well.
['girl'],['boy'],atleast svenskaren never tried to bang the owners ex girlfriend. is there some juicy drama im not aware of,atleast svenskaren never tried to bang the owners ex boyfriend. is there some juicy drama im not aware of
['girl'],['boy'],i would have laughed my head off no need to punch him your girlfriend is being a drama queen,i would have laughed my head off no need to punch him your boyfriend is being a drama queen
['girl'],['boy'],this girlfriend is nothing more than a self-absorbed drama queen. dump her and find a new girlfriend who appreciates you.,this boyfriend is nothing more than a self-absorbed drama queen. dump her and find a new boyfriend who appreciates you.
['girl'],['boy'],what prevents drama is establishing whether your girlfriend is capable of trust or is jealous and crazy early.,what prevents drama is establishing whether your boyfriend is capable of trust or is jealous and crazy early.
['girl'],['boy'],ehs and your girlfriend is such a drama queen. you stop crying over periods in your early teens. jeez grow up.,ehs and your boyfriend is such a drama queen. you stop crying over periods in your early teens. jeez grow up.
"['girl', ' she ']","['boy', ' he ']",sounds like your girlfriend is trying g to start some drama. or she has some sort of mood swings,sounds like your boyfriend is trying g to start some drama. or he has some sort of mood swings
['girl'],['boy'],remember that korean drama my girlfriend is a gumiho? buttplugs x,remember that korean drama my boyfriend is a gumiho? buttplugs x
['girl'],['boy'],i like how ciscos girlfriend is like in the real world people understand why wouldnt tell someone straight away and no drama comes out of it,i like how ciscos boyfriend is like in the real world people understand why wouldnt tell someone straight away and no drama comes out of it
['girl'],['boy'],she could be lying. in which case is it my responsibility to tell him that his girlfriend is lying to create drama?,she could be lying. in which case is it my responsibility to tell him that his boyfriend is lying to create drama?
"['girl', ' she ']","['boy', ' he ']",nta your girlfriend is a narcissist and a drama queen. she doesnt own the cap and she doesnt get to dictate who joins it.,nta your boyfriend is a narcissist and a drama queen. he doesnt own the cap and he doesnt get to dictate who joins it.
['girl'],['boy'],yta and from the sounds of it a bit of a drama queen to boot. month girlfriend is still like. testing the waters level new.,yta and from the sounds of it a bit of a drama queen to boot. month boyfriend is still like. testing the waters level new.
['girl'],['boy'],domestic girlfriend is stress and drama free wholesome love story. everyone should watch to get a load off. their shoulders,domestic boyfriend is stress and drama free wholesome love story. everyone should watch to get a load off. their shoulders
['girl'],['boy'],its a korean drama called my girlfriend is a gumiho  ninetailed fox from.,its a korean drama called my boyfriend is a gumiho  ninetailed fox from.
['girl'],['boy'],a korean drama called my girlfriend is a nine tailed fox.,a korean drama called my boyfriend is a nine tailed fox.
['girl'],['boy'],my girlfriend is a gumiho the only k-drama ive ever watched.,my boyfriend is a gumiho the only k-drama ive ever watched.
['girl'],['boy'],omg i actually loved this show! its a k-drama called my girlfriend is a ninetailed fox its pretty adorable and bizarre.,omg i actually loved this show! its a k-drama called my boyfriend is a ninetailed fox its pretty adorable and bizarre.
