initial_demo,replaced_demo,comments,comments_processed
"['wife', 'wife']","['husband', 'husband']",my wife is doing her happy dance chanting . . .  go ala go bama. go ala go bama. go ala go bama  between you and me? the cane makes it a little weird,my husband is doing her happy dance chanting . . .  go ala go bama. go ala go bama. go ala go bama  between you and me? the cane makes it a little weird
"['wife', 'wife']","['husband', 'husband']",my wife is planning on playing dancer. i hope i dont disappoint as a dance partner,my husband is planning on playing dancer. i hope i dont disappoint as a dance partner
"['wife', 'wife', ' she ']","['husband', 'husband', ' he ']",my wife is thai and literally does this exact dance whenever she gets really excited about something.,my husband is thai and literally does this exact dance whenever he gets really excited about something.
"['wife', 'wife']","['husband', 'husband']",i can totally understand this. im3 and my wife is6 but shes the one that takes the lead when we dance and it can be a little awkward sometimes p,i can totally understand this. im3 and my husband is6 but shes the one that takes the lead when we dance and it can be a little awkward sometimes p
['girl'],['boy'],tolo is a school dance where the girls ask the guys. so the girl is the one who made the poster.,tolo is a school dance where the boys ask the guys. so the boy is the one who made the poster.
['girl'],['boy'],from what ive read before about this video the girl is a dancer for a living and the african kids basically taught her a local dance,from what ive read before about this video the boy is a dancer for a living and the african kids basically taught her a local dance
['girl'],['boy'],fo schzille de girl is fly! just watch her semi-twerky dance video.,fo schzille de boy is fly! just watch her semi-twerky dance video.
['girl'],['boy'],i dance with two girls that are teachers and one girl is a nurse i say do it.,i dance with two boys that are teachers and one boy is a nurse i say do it.
"['wife', 'wife']","['husband', 'husband']",looks like his wife is in the middle of doing the ymca dance,looks like his husband is in the middle of doing the ymca dance
"['wife', 'wife']","['husband', 'husband']",plot twist your wife is banging the dance instructor next door.,plot twist your husband is banging the dance instructor next door.
"['wife', 'wife', ' she ']","['husband', 'husband', ' he ']",crazy. that thing is just nuts. my wife is doing a happy dance right now since it appears she was right.,crazy. that thing is just nuts. my husband is doing a happy dance right now since it appears he was right.
['girl'],['boy'],that girl is a horrible fucking dancer. my god. no matter how much i wanted to fuck. id walk away if i saw her dance like that.,that boy is a horrible fucking dancer. my god. no matter how much i wanted to fuck. id walk away if i saw her dance like that.
['girl'],['boy'],barbie girl is a nice suggestion. or caramell dance,barbie boy is a nice suggestion. or caramell dance
['girl'],['boy'],guy drive drive stop ok? girl  is this the dance of my people,guy drive drive stop ok? boy  is this the dance of my people
['girl'],['boy'],go dance and interact with the girls there..9 of the time no girl is going to approach you if you just stand awkwardly by the wall,go dance and interact with the boys there..9 of the time no boy is going to approach you if you just stand awkwardly by the wall
['girl'],['boy'],what a fool i bet no girl is gonna wanna dance with him now.,what a fool i bet no boy is gonna wanna dance with him now.
['girl'],['boy'],its a school dance like prom but less formal. traditionally the girl is the one who asks their partner of choice to attend.,its a school dance like prom but less formal. traditionally the boy is the one who asks their partner of choice to attend.
['girl'],['boy'],im hoping my girl is the same. ill be doing a happy dance if all it took was opening a can to get her to eat.,im hoping my boy is the same. ill be doing a happy dance if all it took was opening a can to get her to eat.
"['wife', 'wife']","['husband', 'husband']",my wife is a trained dancer and makes fun of my dance moves. so i either avoid it all together. or i embrace my ridiculous moves and go all out.,my husband is a trained dancer and makes fun of my dance moves. so i either avoid it all together. or i embrace my ridiculous moves and go all out.
['girl'],['boy'],the dance comes from the third ending of  kaguyasama love is war and the girl is called chika fujiwara.,the dance comes from the third ending of  kaguyasama love is war and the boy is called chika fujiwara.
['girl'],['boy'],my top girl is looking beautiful in that dress id ask her to dance for sure.  d,my top boy is looking beautiful in that dress id ask her to dance for sure.  d
"['girl', ' she ']","['boy', ' he ']",i dont know who this girl is or what movie she was in with super intense dance scenes all i know is she has no ass.,i dont know who this boy is or what movie he was in with super intense dance scenes all i know is he has no ass.
['girl'],['boy'],that girl is having the weirdest dance party ever.,that boy is having the weirdest dance party ever.
['girl'],['boy'],in wisconsin. engaged.  taxidermy girl is a contender for our first dance at the wedding.,in wisconsin. engaged.  taxidermy boy is a contender for our first dance at the wedding.
"['wife', 'wife', ' she ']","['husband', 'husband', ' he ']",my wife is atc and most people i tell either think she is the cone guy or in the tower. she didnt spendk in college to dance with the orange cones.,my husband is atc and most people i tell either think he is the cone guy or in the tower. he didnt spendk in college to dance with the orange cones.
"['wife', 'wife']","['husband', 'husband']",wife is latina im white. her family cant understand why i dont dance to whatever music they play.dont like the music and cant dance if i did,husband is latina im white. her family cant understand why i dont dance to whatever music they play.dont like the music and cant dance if i did
"['wife', 'wife']","['husband', 'husband']",what type of dance? my wife is a ballet teacher and knows all the classes ill ask her.,what type of dance? my husband is a ballet teacher and knows all the classes ill ask her.
"['wife', 'wife']","['husband', 'husband']",not mine but my wife is deathly afraid of those chinese dragons people dance around in,not mine but my husband is deathly afraid of those chinese dragons people dance around in
"['wife', 'wife']","['husband', 'husband']",wth.. my wife is close to giving birth and can barely get up from a chair much less dance,wth.. my husband is close to giving birth and can barely get up from a chair much less dance
"['wife', 'wife']","['husband', 'husband']",wife is still doing the duty free dance.,husband is still doing the duty free dance.
['girl'],['boy'],that lil asian girl is who made me want to learn to dance it helps that i live in a very flat very sunny state  you got this bro,that lil asian boy is who made me want to learn to dance it helps that i live in a very flat very sunny state  you got this bro
['girl'],['boy'],that one girl is so pretty. the one in the yellow green. same girl whos first in the dance cover video with the red bow right?,that one boy is so pretty. the one in the yellow green. same boy whos first in the dance cover video with the red bow right?
['girl'],['boy'],not the biggest fan of hannah but this dance girl is so pretty!!,not the biggest fan of hannah but this dance boy is so pretty!!
['girl'],['boy'],kissing a girl is pretty easy just go to a club and dance with a drunk girl. getting laid isx harder,kissing a boy is pretty easy just go to a club and dance with a drunk boy. getting laid isx harder
['girl'],['boy'],lol that girl is way too excited about the sibling dance  d,lol that boy is way too excited about the sibling dance  d
"['wife', 'wife']","['husband', 'husband']",this isnt over reacting to me at least. my wife is a dance teacher and they have strict rules on what they can use and this wouldnt fall under it.,this isnt over reacting to me at least. my husband is a dance teacher and they have strict rules on what they can use and this wouldnt fall under it.
"['wife', 'wife', ' she ']","['husband', 'husband', ' he ']",my wife is a dance teacher and she is pretty graceful. i also suspect she may have been a hired killer after taking her to play paintball once.,my husband is a dance teacher and he is pretty graceful. i also suspect he may have been a hired killer after taking her to play paintball once.
"['wife', 'wife']","['husband', 'husband']",high school dances. these days my wife is embarrassed by how i dance.,high school dances. these days my husband is embarrassed by how i dance.
"['wife', 'wife']","['husband', 'husband']",idk if youre aware but your wife is getting fucked on the dance floor.,idk if youre aware but your husband is getting fucked on the dance floor.
"['wife', 'wife']","['husband', 'husband']",maybe hitting the wife is a new dance?,maybe hitting the husband is a new dance?
['niece'],['nephew'],my niece is that age and loves to dance too. just seeing a kid dancing happily just makes me smile so much.,my nephew is that age and loves to dance too. just seeing a kid dancing happily just makes me smile so much.
['girl'],['boy'],jaune screaming hysterically team rwby  some girl is in trouble! also jaune shows up to the dance in the same dress as yang,jaune screaming hysterically team rwby  some boy is in trouble! also jaune shows up to the dance in the same dress as yang
['girl'],['boy'],it doesnt matter what the guys at the club want it matters if the girl is there to hook up and cheat or just to dance and have fun with her friends,it doesnt matter what the guys at the club want it matters if the boy is there to hook up and cheat or just to dance and have fun with her friends
['girl'],['boy'],slav girl is brad and marzia post fusion dance,slav boy is brad and marzia post fusion dance
['girl'],['boy'],i cant tell if the girl is hiding in terror or waiting for her dragon to finish with his water dance so they can go home.,i cant tell if the boy is hiding in terror or waiting for her dragon to finish with his water dance so they can go home.
"['wife', 'wife']","['husband', 'husband']",im sorry your wife is dumb. dance on were thrilled to have you.,im sorry your husband is dumb. dance on were thrilled to have you.
"['wife', 'wife', ' she ']","['husband', 'husband', ' he ']",thank you! my wife is from new jersey and thats the one she misses the most. she just did a celebratory dance !,thank you! my husband is from new jersey and thats the one he misses the most. he just did a celebratory dance !
"['wife', 'wife']","['husband', 'husband']",how? a dude trying to dance with a guys wife is almost certainly gonna lead to a fight when theres also tons of alcohol involved,how? a dude trying to dance with a guys husband is almost certainly gonna lead to a fight when theres also tons of alcohol involved
"['wife', 'wife']","['husband', 'husband']",were unfamiliar with freyas dance. my wife is partial to the macarena after i come in her but id like her to do the robot.,were unfamiliar with freyas dance. my husband is partial to the macarena after i come in her but id like her to do the robot.
"['wife', 'wife', ' she ']","['husband', 'husband', ' he ']",how is he an asshat for dancing with someone else? its not even a close intimate dance the wife is the one being an asshat here.,how is he an asshat for dancing with someone else? its not even a close intimate dance the husband is the one being an asshat here.
['girl'],['boy'],the green hair girl is struggling to dance and its just soo cute,the green hair boy is struggling to dance and its just soo cute
['girl'],['boy'],the short haired girl is super cute i dont blame the guy for wanting to dance with her! lol,the short haired boy is super cute i dont blame the guy for wanting to dance with her! lol
['girl'],['boy'],the kid who did this dance the girl is doing was like and the original video is fucking hilarious. just google orange shirt kid. dude is a legend.,the kid who did this dance the boy is doing was like and the original video is fucking hilarious. just google orange shirt kid. dude is a legend.
"['wife', 'wife']","['husband', 'husband']",thank you! i noticed your ready for ballet class pic. my wife is a ballerina and i am a tapper and we both taught each other our kind of dance!,thank you! i noticed your ready for ballet class pic. my husband is a ballerina and i am a tapper and we both taught each other our kind of dance!
"['wife', 'wife', ' she ']","['husband', 'husband', ' he ']",my wife is from miami. she grew up taking square dance in pe and still wonders why.,my husband is from miami. he grew up taking square dance in pe and still wonders why.
"['wife', 'wife']","['husband', 'husband']",your kids dance or do you? just curious my wife is still dancing at. keeps her in great shape all the best,your kids dance or do you? just curious my husband is still dancing at. keeps her in great shape all the best
['girl'],['boy'],i too stan athena. that girl is going to go places even if its not in dance.,i too stan athena. that boy is going to go places even if its not in dance.
['girl'],['boy'],the girl is from fortnite or the dance? amp b,the boy is from fortnite or the dance? amp b
['girl'],['boy'],alright yeah this girl is a total chode. amp b but i couldnt help but laugh at that dumb little dance.,alright yeah this boy is a total chode. amp b but i couldnt help but laugh at that dumb little dance.
"['girl', ' she ']","['boy', ' he ']",me too. my girl is like a teenager at a school dance. she stops babbling for a minute with ears up and i know its time to investigate.,me too. my boy is like a teenager at a school dance. he stops babbling for a minute with ears up and i know its time to investigate.
"['wife', 'wife', ' she ']","['husband', 'husband', ' he ']",ha my wife is the opposite she loves house music but hates dubstep  bass music because its too slow and she cant dance to it. me i love it all.,ha my husband is the opposite he loves house music but hates dubstep  bass music because its too slow and he cant dance to it. me i love it all.
"['wife', 'wife']","['husband', 'husband']",dirty dancing duh my wife is a dance teacher!,dirty dancing duh my husband is a dance teacher!
"['wife', 'wife', ' she ']","['husband', 'husband', ' he ']",just dance. my wife is weeks pregnant and cant exercise like she likes to so we have been playing just dance as some simple exercise. its just fun,just dance. my husband is weeks pregnant and cant exercise like he likes to so we have been playing just dance as some simple exercise. its just fun
"['wife', 'wife']","['husband', 'husband']",my wife is a dance teacher and a pre school teacher. can confirm. talks shit about kids all the time. can confirm kids are little assholes.,my husband is a dance teacher and a pre school teacher. can confirm. talks shit about kids all the time. can confirm kids are little assholes.
['girl'],['boy'],makes sense for you. but have you considered those poor pornhub people? fapping to a dance of dressed girl is quite difficult,makes sense for you. but have you considered those poor pornhub people? fapping to a dance of dressed boy is quite difficult
['girl'],['boy'],this girl is from a dance group. theyre not marketed at kids and they dont make music.,this boy is from a dance group. theyre not marketed at kids and they dont make music.
"['girl', ' she ']","['boy', ' he ']",this girl is so beautiful and she can dance!,this boy is so beautiful and he can dance!
"['wife', 'wife']","['husband', 'husband']",wife is going on a day weekend with the kid starting thursday. youre damn right ill be doing that dance in my underwear right in the living room.,husband is going on a day weekend with the kid starting thursday. youre damn right ill be doing that dance in my underwear right in the living room.
"['wife', 'wife']","['husband', 'husband']",my wife is still super mega salty about the dance studio! wont show her this one,my husband is still super mega salty about the dance studio! wont show her this one
"['wife', 'wife']","['husband', 'husband']",months? ive never used it for that i usually dance around in my underwear until my wife is sufficiently aroused.,months? ive never used it for that i usually dance around in my underwear until my husband is sufficiently aroused.
['girl'],['boy'],i watched her video beating nameless king using the dance pad. that girl is a pretty damn amazing player.,i watched her video beating nameless king using the dance pad. that boy is a pretty damn amazing player.
"['girl', ' she ']","['boy', ' he ']",a girl is always in control. when u dance with someone and she not feeling it.all she has to do is turn around and give u her back.,a boy is always in control. when u dance with someone and he not feeling it.all he has to do is turn around and give u her back.
['girl'],['boy'],yep graham makes me think stealth jeff is true lindsay girl is the queen of the south and will dance with all the globalists at the ball,yep graham makes me think stealth jeff is true lindsay boy is the queen of the south and will dance with all the globalists at the ball
"['wife', 'wife']","['husband', 'husband']",bound is a lovely game and not hard. especially if your wife is into dance at all,bound is a lovely game and not hard. especially if your husband is into dance at all
"['wife', 'wife', ' she ']","['husband', 'husband', ' he ']",my wife is gong to give him tresaderm she has dance me left over from the vet. is it like he a broad spectrum med?,my husband is gong to give him tresaderm he has dance me left over from the vet. is it like he a broad spectrum med?
"['wife', 'wife']","['husband', 'husband']",im7 my wife is0. in our first dance i ended up dancing on my knees because we were both stretching too far.,im7 my husband is0. in our first dance i ended up dancing on my knees because we were both stretching too far.
"['wife', 'wife']","['husband', 'husband']",this very dance is how i know my wife is in the mood.,this very dance is how i know my husband is in the mood.
['girl'],['boy'],one girl is picked to do everything while the other queens dance in the background?,one boy is picked to do everything while the other queens dance in the background?
['girl'],['boy'],dance like no one is watching. that girl is awesome.,dance like no one is watching. that boy is awesome.
['girl'],['boy'],this was quite amusing to watch brilliant dance moves. short haired girl is really attractive too.,this was quite amusing to watch brilliant dance moves. short haired boy is really attractive too.
['girl'],['boy'],i want more info on the stupid girl. is this that fucking car thing dance? why do we always have to have a thing every summer?,i want more info on the stupid boy. is this that fucking car thing dance? why do we always have to have a thing every summer?
['girl'],['boy'],mirror  girl is showing her hip during dance  views _  latest change safari. x. x fix.,mirror  boy is showing her hip during dance  views _  latest change safari. x. x fix.
['girl'],['boy'],jane ahin and taeha are my top! jane is top in the group for vocals dance and visual! girl is an all-rounder!,jane ahin and taeha are my top! jane is top in the group for vocals dance and visual! boy is an all-rounder!
['girl'],['boy'],elevator girl or yava! elevator girl is the first choreography where ive ever had the dance stuck in my head lol,elevator boy or yava! elevator boy is the first choreography where ive ever had the dance stuck in my head lol
"['wife', 'wife']","['husband', 'husband']",i live in chicago. go to a russian dance club and meet one. polish ukrainian. my wife is serbian,i live in chicago. go to a russian dance club and meet one. polish ukrainian. my husband is serbian
['girl'],['boy'],even a dude cheating would realize this dumbass game this girl is playing. like ok psycho do your little dance.,even a dude cheating would realize this dumbass game this boy is playing. like ok psycho do your little dance.
['girl'],['boy'],nice dance moves kid and the girl is pretty hot too.,nice dance moves kid and the boy is pretty hot too.
['girl'],['boy'],no moves that the girl is doing are related to that dance lmao,no moves that the boy is doing are related to that dance lmao
['girl'],['boy'],idk why but whatever dance that girl is doing is oddly hypnotizing.,idk why but whatever dance that boy is doing is oddly hypnotizing.
['girl'],['boy'],the dance in that vine where that girl is dancing to the fire alarm,the dance in that vine where that boy is dancing to the fire alarm
['girl'],['boy'],i feel like a big girl is never going to win because they cant do the over the top acrobatic dance moves. bummer really.,i feel like a big boy is never going to win because they cant do the over the top acrobatic dance moves. bummer really.
"['wife', 'wife']","['husband', 'husband']",hey um mr soon can u um pose naked and uhh dance tos music at my wedding? m-m-my wife is a really big fan of your muscles,hey um mr soon can u um pose naked and uhh dance tos music at my wedding? m-m-my husband is a really big fan of your muscles
"['wife', 'wife']","['husband', 'husband']",heh my wife is a professional dance choreographer. dance happens everywhere with her.,heh my husband is a professional dance choreographer. dance happens everywhere with her.
"['wife', 'wife', ' she ']","['husband', 'husband', ' he ']",my wife is a middle school teacher and she absolutely hates this dance. so naturally i have become pretty good at it.,my husband is a middle school teacher and he absolutely hates this dance. so naturally i have become pretty good at it.
"['wife', 'wife', ' she ']","['husband', 'husband', ' he ']",my wife is a middle school teacher. she has seen kids do this dance in anger.,my husband is a middle school teacher. he has seen kids do this dance in anger.
"['wife', 'wife']","['husband', 'husband']",your wife is cute but that dance could not have been less sexy.,your husband is cute but that dance could not have been less sexy.
"['wife', 'wife']","['husband', 'husband']",my wife is creole blackish and im a white dude. i was not prepared for family get togethers that included dance offs and free styling.,my husband is creole blackish and im a white dude. i was not prepared for family get togethers that included dance offs and free styling.
"['wife', 'wife']","['husband', 'husband']",i believe my wife is significantly better looking shes a model after all. im tall can play guitar and sing can dance and im emotionally stable.,i believe my husband is significantly better looking shes a model after all. im tall can play guitar and sing can dance and im emotionally stable.
"['wife', 'wife', ' she ']","['husband', 'husband', ' he ']",my coworker told me his wife is a local dance instructor and he comes to some of the classes in tampa. seems like such a nice dude.,my coworker told me his husband is a local dance instructor and he comes to some of the classes in tampa. seems like such a nice dude.
"['wife', 'wife']","['husband', 'husband']",i know youre joking but its because dance isnt a sport. my wife is a dance teacher dont  me.,i know youre joking but its because dance isnt a sport. my husband is a dance teacher dont  me.
['girl'],['boy'],this is girl is from my high school. everyone was super confused at the actual dance. was.uh.quite interesting to see her wheel it around,this is boy is from my high school. everyone was super confused at the actual dance. was.uh.quite interesting to see her wheel it around
['girl'],['boy'],the dance battle at the end over a girl is.. surreal and bad but good. dunno what fosse would make of it,the dance battle at the end over a boy is.. surreal and bad but good. dunno what fosse would make of it
['girl'],['boy'],right? it sounds like no ones gone to a dance event before but everyone has a ton of opinions about how a girl is to behave at one,right? it sounds like no ones gone to a dance event before but everyone has a ton of opinions about how a boy is to behave at one
"['girl', ' she ']","['boy', ' he ']",1. this girl is about sandwiches short of sexy. 2. she didnt dance.,1. this boy is about sandwiches short of sexy. 2. he didnt dance.
"['wife', 'wife']","['husband', 'husband']",ur wife is definitely getting her ass groped on the dance floor,ur husband is definitely getting her ass groped on the dance floor
"['wife', 'wife']","['husband', 'husband']",well the owners wife is a belly dancer and they also do belly dance classes. it is pretty hipster.,well the owners husband is a belly dancer and they also do belly dance classes. it is pretty hipster.
['girl'],['boy'],reddit? you mean the world is. this girl is famous purely because of her cute dance.,reddit? you mean the world is. this boy is famous purely because of her cute dance.
['girl'],['boy'],that girl is me every time i try to dance  i still enjoy it very much,that boy is me every time i try to dance  i still enjoy it very much
['girl'],['boy'],sex with a shorter girl is a big turn on but dating is different i wouldnt want to slow dance with someone a foot shorter than me,sex with a shorter boy is a big turn on but dating is different i wouldnt want to slow dance with someone a foot shorter than me
['girl'],['boy'],the frontier ones definitely are the best. the first girl is akari from xros wars. shes wearing a costume for a dance routine.,the frontier ones definitely are the best. the first boy is akari from xros wars. shes wearing a costume for a dance routine.
