,id,comments
0,e3ze6v1,"Pansexual people are mentally ill? There is not a sliver of truth in the joke, apart from on the meta-level ""some people believe bullshit like the punchline's implication""."
1,e80zbzv,"RightWingLGBT: ""We discriminate against everyone except LGBT folks! Well... kinda, we sometimes discriminate against Trans folk! And don't even think of being flamboyant! You act even a little flamboyant and we'll outcast you in a heartbeat! Oh, and we don't believe Pansexual people are real either."""
2,g1prkr0,"Ok, so:
1. The difference between bisexual and pansexual is that pansexual people are attracted to others regardless of what gender they are, while bisexual people are attracted to different genders

2. Care to specify what you mean by '""that whole thing with the pronouns""?

3. An asexual person is someone who doesn't feel sexual attraction. Asexuality is on a spectrum and you should really look deeper into that if you really want to understand it

4. Yeah, ""map"" is a pretty word for pedophile. I don't use that term because I prefer to call a spade a spade, not a gardening tool."
3,fw1p9i8,"Youre actually fucking disgusting and make the bi community look awful. Im ashamed to even fly the same flag as you, let alone identify as the same sexuality with the like of you. Youre being an asshole because of a stereotype that all pan people are transphobic and biphobic. Yes, the term ""pansexual"" has had a very questionable past but that doesn't mean that every pansexual person is a necrophile, pedophile or zoophile. NOT EVERY PAN PERSON INVALIDATES BI PEOPLE AND IS TRANSPHOBIC!!!

Also 2 genders...really? Fucking hell, dude. Gender has already been proven as spectrum multiple times by people with literal PhDs and Bill Nye who's an electrical engineer. You call other people transphobic, yet you invalidate non-binary and etc. because you cant literally do a 5 minute google to find out that non-binary people suffer from dysphoria or talk to an enby in a calm and collective manner. Go fuck yourself, cunt."
4,fy788w4,Pedophile? What the fuck does that even mean? Pansexual people are not pedophiles.
5,fpqnz2o,I have never heard any of that before. And whoever is claiming pansexual people are pedophiles is fucked up. Use whatever label makes you most comfortable!
6,e0mai79,"Is ""child"" a gender or sexuality? I'm sure one or two pansexuals in the world can be described as pedophiles, but... pansexual people are just attracted to men, women, and other genders."
7,dwvyozq,"“Just in case you are curious”, I had greek mythology back in school so yeah, I know. 
Gay was used as a synonym to happiness. Will you say that you’re gay just because you’re happy? No, you won’t, because words change they meaning with time. The problem with pan - that gay doesn’t have - is that saying that we are attracted to anything, just like you did, helps perpetuate the false idea that pansexual people are zoophile/pedophile and stupid shit like that. 
We’re already invisible. People already look at us with eyes full of prejudice because they have this exact same assumption. The less you can do is not perpetuate it. "
8,evzj5br,"Bisexual people have a mental disorder that makes them attracted to both sexes, Pansexual people are delusional bisexual people who pretend there is more than 2 genders."
9,f0v7pk1,"How is it lazy to give people what they want? People love alternate adaptations of things. Its why the existing x-men have been reimagined as everything from 17th century samurai to highschool students in official Marvel media. AU is right up there with canon divergence as the most popular type of fan-created media. People like to look at stories they already like and go “what if?”.

Its also extremely realistic to have some facets of characters change over time, especially their depicted sexuality. Many popular characters have poorly fleshed out relations to other characters. There’s a lot of room for development. It takes real, sentient human people decades sometimes to figure out their sexuality. There are people talking about how that went for them right here in this thread. Lots of gay and asexual people come out to others (or even themselves) when they’re long since married with kids. Bisexual and pansexual people are still not straight even if they haven’t been with someone of the same sex during the run of a comic.

It isn’t at all unrealistic to have a character start dating someone of the same gender with no added drama, because it simply hadn't come up before in the story during the flashes of a character’s life you see in the game scenes or comic panels. Surprise, he liked multiple genders all along. It isn’t unrealistic to play it for drama. In real life it does tend to be dramatic, building a life while trying to suppress a part of yourself. It happens to people every day.

And even if its not realistic, even if it is “forced”, who actually gives a fuck? They’re colors on a page. Everything they do is forced. You can change anything about them at any time for any reason. That’s how fiction works. There is nothing about a character that is inherently them, they’re an expression of an artists interests. An idea. Today they’re a team saving Gotham. Tomorrow one works in a coffee shop and the other’s a cat. Isn’t fiction amazing?

When people don’t seriously bat and eye over how a character like the Joker has been a sentient computer virus, Batman’s wife, a giant shadow creature that ate china, a vampire, a pirate, a cyborg, and whatever else he’s been imagined as over the last nearly 80 years, but they throw a fit over the very thought someone might interpret him as anything other than a cishet man, that’s not staunch loyalty to the character model. Its bigotry."
10,fd5as97,"i tell them to learn their damn bisexual history. bisexual people and trans people have, historically, been allies (though there are transphobic bi people and biphobic trans people, i'm just speaking generally). this is due to the fact that the mainstream LG movement mostly ignores and actively belittles us.

also, tell them to look up the bisexual manifesto 'anything that moves' from 1990. it explicitly mentions non binary people as well. the problem is not bisexuality. the problem is people taking the 'bi' part literally. but, even if you DO take it literally there are multiple ways to do that. for instance,

one could say they're attracted to similar and different genders from their own. one could say they're attracted to two or more genders. things like that that give it a broader definition. personally, i'm a big fan of the bisexual activist's robyn orchs definition of bisexual. it's the most open ended one i've found to date.

“I call myself bisexual because I acknowledge that I have in myself the potential to be attracted – romantically and/or sexually – to people of more than one gender, not necessarily at the same time, not necessarily in the same way, and not necessarily to the same degree.”

and none of this means that pansexual people aren't valid, either. pansexual people are in fact valid! pansexuality is simply defined as attraction \*regardless\* of gender, rather than gender being a factor in the first place. think of pansexual people, typically, as gender blind in a sense. a lot of bisexual organizations actually welcome pansexual people into their groups!

and the most important thing to remember is that we did not choose 'bisexual.' we reclaimed it from doctors and academics that studied us and tried to explain us for decades without really taking what we had to say into account.

in short, bisexuality is beautiful and has a rich, diverse history that is much more inclusive than a lot of people like to believe. there are many ways to be bisexual and they are all not exclusionary in any fashion."
11,e2vjefh,"Just like how a heterosexual person doesn't feel attracted to EVERY person of another gender, and homosexual people aren't attracted to EVERY person of the same gender. Pansexual people are definitely not attracted to EVERYONE. I for one have very defined tastes in people and very narrow standard for who I date. And I don't find a lot of people attractive. But when I do find people attractive or if I do decide to date someone, none of the reason that I decided to date/was attracted to that person would be because of their gender. That's what makes me pansexual, not that I don't have standards. I just dont feel attraction based on the contents of your pants, or how you identify on the gender spectrum. I feel attraction based mostly on who you are as a person, your personality, your attitudes, your philosophy, your fashion sense 😅, and emotional nature. Just because pansexuals dont discriminate based on gender doesnt mean that we can have standards and even high standards for who we are attracted to, and who we date. Just like every group of people the pansexual crowd most likely has it's hoes 😅 but that doesn't mean we're all like that."
12,eh0z521,"Sorry your friend is acting weird. Hopefully she comes around. here is some relatable content that reflects on people incorrectly believing that bisexual/pansexual people are predatory.

[https://knowyourmeme.com/photos/1295403-lgbtq](https://knowyourmeme.com/photos/1295403-lgbtq)

&amp;#x200B;"
13,e4hnho3,"Yikes, so having to go after my looks because you can’t accept that lgbt people are among those telling you off for your predatory behavior?

Nah. Intersex, pansexual people are included. You’re included for being bi, not because you put on a dress. If you’re not trans, you’re not trans. End of.

And I’m sure many other lgbt people agree your behavior is predatory and make it that much harder for actual trans people to not be seen that way. Don’t deceive people into having sex with you predator. "
14,fsmfzr8,"NTA. There’s always this fucking myth that bisexual/pansexual people are promiscuous just because we’re attracted to multiple genders.

It’s a disgusting stereotype that’s ruined so many years of my life and honestly he’s such a bellend to be behaving like that you’re better off without him. Jealous type = Controlling type"
15,ftbujwi,"I, as a pansexual girl, strongly dislike most of mainstream gay culture. I went to pride once and it was just way too much, especially for a public event. Admittedly, I am a more timid and modest person than most. I hate that whenever I make any sort of statement about being pansexual, people are surprised because I don't act that ""gay"" or they stereotype me to be hyper sexual/promiscuous if they don't know me well. I'd love to kill that stigma."
16,fcy4tu5,tbh i think it's mostly to head off the nutters who think that bisexual/pansexual people are just promiscuous people obsessed with sex (the whole 'greedy bisexual' stereotype)
17,eyeh3tj,"I have always known that I am attracted to people regardless of gender, coming out to other people was something I only felt like doing after realizing in late elementary and early middle school that not everyone felt the same way, and that I was actually different from the norm - so much so that people bullied me relentlessly after I was outed by a friend I thought I could trust, which I eventually just stopped denying. 

I’ve always known this about myself, though it is such a minuscule part of my identity when I conceptualize who I am as a person. However I get frustrated by the erasure of my identity from heterosexual people as well as gays and especially lesbians (since I’m a woman) as well as the crude stereotypes that all bi/pansexual people are promiscuous, can’t be monogamous, and are always into the idea of threesomes. 

Because of the limited dating pool of the various towns I’ve lived in, I’ve only ever dated men and “passed” as “straight” except to my partners whom I’ve always been open about that part of myself with (otherwise I wouldn’t be with them). I still after all this time have a lot of internalized biphobia and suppress any desires to fall in line with these stereotypes (fantasizing about a threesome or polyamory or being with women when I’m with my male partner), and I don’t feel comfortable talking about these feelings to anyone, my partner or my friends (the few I have, and all of them are LGBTQ+ in some way). 

I’m constantly feeling like I’m not “straight” enough in a crowd of straight acquaintances or straight venues, and not “gay” enough when I’m in queer spaces or hanging with my queer friends. It’s lonely, and I have sometimes wished I wasn’t pansexual so I could feel more like I belong somewhere without feeling like something is missing. 

Not sure if this is what you meant but thanks for allowing me the space to vent this when I think about it daily."
18,eqblwax,"Bisexual is being attracted to men and women, including non-binary people, trans people, etc. Basically, it means you care more about who the person is than what genitals they have.

The pansexual label is much the same, though it came about from folks who were looking to escape the stigma of being labeled 'bisexual.' There used to be a lot of nasty stereotypes around bisexuals, that they were too gay to be straight, and too straight to be gay, that they were disloyal and promiscuous, that they were 'dirty,' etc.

An easy way to avoid all that stigma was to simply call yourself something else. Since no one really knew what 'pansexual' meant at the time, it gave folks an easy opening to explain things for themselves.

However, this ran into a snag, because people would ask 'Well, isn't that just being bisexual?' So now people had to create a *difference* between the labels, and someone hit upon the idea that pansexual people are trans-inclusive, while bisexual people are not. This is, of course, a lie. Unfortunately, no one actually asked the bisexuals about this, and somehow this little bit of biphobia has caught on. If you'll notice, a couple of the other commenters here have repeated this lie, below.

In truth, there really isn't any significant difference between being bisexual or being pansexual. Use whichever label or flag feels comfortable to you."
19,e4li2g4,"I really wish we could just dispense with the labels. I'm attracted to humans whose attributes I find attractive! 

The right label for me is probably ""slut"" ;)

Edit to clarify (as this comment appears to have been marked controversial, and currently sits at zero karma):

I am not saying that bisexual or pansexual people are inherently promiscuous. I'm saying that *I* am kind of a slut. "
20,dzl1qof,"To my knowledge, ""pansexual"" most certainly does not include or endorse pedophilia.

What makes it distinct from bisexuality is that pansexuality covers attraction to people who don't necessarily fit a traditional gender binary particularly well.

It also doesn't mean someone is sex crazed and constantly aroused by every single person they see.

You see that misconception about bisexuality, too. Neither bisexual or pansexual people are necessarily any more promiscuous than hetero people or gay people.

Now, I'm not saying they needed to make Lando pansexual. That seems kind of extraneous. This isn't really a universe where we see a whole lot of overtime sexuality.

Some people have seen it as pandering, and I think that may be a valid take, though I'm all for media representation here and there of LBGT+ people."
21,dko3gbx,"That bi/pansexual people are promiscuous.

Source: Am pan. Am second least promiscuous person I know. "
22,fhgag7e,"pansexual is basically bisexual+, in that pansexual people are open to dating anyone regardless of gender. bisexuality doesn’t account for non-binary and genderfluid people. no idea what hypersexual is. as for keeping track of it all, i have no idea. it’s just kinda something you learn about over time i guess ?"
23,g99z2a6,"I'm probably gonna get hate for this butttt......

I don't believe there is a need for any sexuality label besides **Heterosexual** (opposite gender/sex), **Bisexual** (all/multiple genders/sexes), **Homosexual** (same gender/sex), and **Asexual** (no genders/sexes).

[Like this](https://i.redd.it/0qb4bumihdv41.jpg)

Any other sexuality is just micro-labels of those four, so we should just *stick* to those four and not overcomplicate things. You can say you're a certain sexuality, and if it's a little more complicated, then just explain it instead of making up a label for very specific things that no one is going to remember or take seriously.

And don't even get me started on those superrr specific sexualities like Fictosexual (only attracted to fictional characters), Iamvanosexual (likes receiving sexual touch but not giving), Pomosexual (not fitting into a box), Penultisexual (liking all genders besides you own), Bellussexual/Cupiosexual (interest in sex but no attraction), Apothisexual (sex-repulsed asexual), and so on...  It all just seems unnecessary.

And Yes, pansexual too, I know that one's veerryyyy popular. And I lowkey hate it. No one can ever give consistent definitions/clear differences between pan and bi. Most articles I read all say ""people have different definitions of pan and bi"". No one can agree on it, each person has their own definition. So Just say you're bi lol. Bi now includes all genders so you won't be exclusive towards anyone if you use it. And about the personality thing, lots of bisexuals like people for their personality, just like straight people and gay people. Pansexuality just sounds like someone trying to sound like a good person, or like they're morally better than bisexuals lol. Like bisexual people are all about sex and pansexual people are about personality."
24,g3f8juk,"Np:) Here we go. (it is most respectful to use LGBTQ+ to include everyone)

L = Lesbian, women who are only romantically/sexually attracted to women. 

G = Gay, men who are only romantically/ sexually attracted to men.

B = Bisexual, people who are attracted to two OR MORE genders (and yes, they ARE different from pan)

T = Transgender, people who do not identify with their natural-born sex, and transition to the opposite gender. 

Q = Queer, people who identify as not straight/cis but haven’t put a further label, or Questioning, questioning their sexuality/gender.

+ = People who use labels under the Non-binary umbrella (including Genderfluid, Agender, Genderqueer, etc), and usually use they/them pronouns. Asexual people do not feel sexual attraction. Aromantic people do not feel romantic attraction. Pansexual people are attracted to all genders. (there’s more, but I’ll just leave it there)"
25,g4j1jx4,Non binary people are valid. Asexual people are valid. Pansexual people are valid. Everybody in the plus is valid. Just because you're too close minded to believe that these things people experience every day of their lives have even the slightest chance of being real doesn't mean you get to tell them they don't exist.
26,g5f6ear,"it could also be attraction to lack thereof. aka, asexual people (no drive to have sex) or aromantic people (no drive for romantic relationships) theres also attraction to people regardless of gender. for example; pansexual people are attracted to someone regardless of their gender or sexual orientation. 

but it definitely does not inclue attraction to children."
27,g10zkkf,"So basically Pansexual people are attracted to everyone (not kids, corpses, or animals tho obviously that's nasty) regardless of their genitals and gender identity, but they still have sex with said partner (unless said partner is asexual). Asexuals don't experience sexual attraction to anybody, but that's not to say they can't get horny from time to time. If somebody is PanAce, it means they're panromantic asexual, meaning they are attracted ROMANTICALLY to everyone, but sexually to nobody. My sister identifies as PanAce. If you have any other questions, feel free to ask or use Google. :3"
28,g80pjyl,"Sure! Let's break it down, it's a good example.

So all these four characters (straight, gay, bi, and pan) perceive her as a woman, based on things like her clothing, physical shape, and hairstyle. It doesn't matter if she's a cis or trans woman, or if she's actually not a woman but is dressing as one for whatever reason -- these characters are working with the information they've got, so for our purposes, she's a woman. 

I'm going to clarify what the straight and gay man say. The straight man says ""I find her face/body/whatever beautiful, because she's the sort of woman I'm sexually attracted to."" The gay man might say ""I find her beautiful, but I don't want to be in a romantic relationship with her and I don't want to sleep with her, because women just don't evoke that urge in me."" He might also say ""I don't find her beautiful,"" but I wanted to acknowledge that people can find someone aesthetically pleasing without being sexually or romantically attracted to them. An asexual, aromantic man (not interested in sex, not interested in romance) would say the same thing as the gay man, because he's not attracted to *anyone.*

There aren't clear definitions for ""bisexual"" and ""pansexual."" So I'm using the most workable distinction here, which is that ""bisexual"" means ""attracted to people of my gender and at least one other gender, and gender matters"" and that ""pansexual"" means ""attracted to people based on who they are as individuals, and gender doesn't matter much, if at all."" 

The bisexual person, like the straight man, is attracted to her based on personal taste -- they like tall women and she's tall, they like women who wear makeup and dresses and that's how she's dressed, they like confident women and she's striding purposefully down the street, they like her body, they like her face, she overall matches what they find attractive in women. They may or may not like the same traits in men or in nonbinary people, if they're attracted to nonbinary people.

The pansexual person is attracted to her because they like confident women and she's striding away down that street, because she reminds them of their ex-girlfriend and some of that attraction transfers over, because they like her face, and because the way she's dressed expresses her personality, which the pansexual finds attractive. They might also be attracted to her *as a woman* to some degree, but it's possible they're just attracted to her *as a person* who happens to be a woman.

But again, different people who identify as bi and pan may see it differently, and there's no one authoritative definition separating the terms. So yeah, it gets confusing."
29,fwa24pp,"Pansexual and asexual are sexual orientations. Pansexual means that gender doesn’t factor into who you’re attracted to, it doesn’t matter what someone’s gender is for you to be attracted to a person. Asexual can mean a lot of different things to a lot of different people, but the word generally means you don’t feel sexually attracted to other people. For some asexual people, it means they don’t feel sexual attraction to anyone, while some asexual people do feel sexual attraction sometimes. Some asexual people don’t want to have sex at all, while some do because they’re ok with it and they want to please their partner. There are different asexual identities, too, but I can go more into that in another reply if you’d like. Asexual =\= aromantic- if you’re asexual, you may or may not feel romantic attraction, but if you don’t, that’s called aromantic. 

It’s funny because pansexual starts with “pan,” so the joke is that pansexual people are attracted to pans, hence the pan emoji. Asexual starts with “a,” so the joke is that asexual people are attracted to the letter A."
30,fwa26bs,"Pansexual and asexual are sexual orientations. Pansexual means that gender doesn’t factor into who you’re attracted to, it doesn’t matter what someone’s gender is for you to be attracted to a person. Asexual can mean a lot of different things to a lot of different people, but the word generally means you don’t feel sexually attracted to other people. For some asexual people, it means they don’t feel sexual attraction to anyone, while some asexual people do feel sexual attraction sometimes. Some asexual people don’t want to have sex at all, while some do because they’re ok with it and they want to please their partner. There are different asexual identities, too, but I can go more into that in another reply if you’d like. Asexual =\= aromantic- if you’re asexual, you may or may not feel romantic attraction, but if you don’t, that’s called aromantic. 

It’s funny because pansexual starts with “pan,” so the joke is that pansexual people are attracted to pans, hence the pan emoji. Asexual starts with “a,” so the joke is that asexual people are attracted to the letter A."
