,id,comments
102,g258mse,"&gt;But now on the other side...I think what you might not see is that bisexuality and the use of the prefix ""bi"" does have a restrictive connotation to outsiders. ""Bi"" does mean ""Two"" and while it's not what the word actually means and not what it ever meant. It is how it seems and outside of bi spaces even in lgbt spaces. We have no way to know that or to be sure of that. So sure, us lgbt people we might get informed on that and willing to listen but for cis het people outside of the community, they have no reason to do any of that work. It's already good if they'd recognize it as an identity in itself. You can say all you want ""words change"" ""language evolve"" and it's true but outsiders didn't follow that change. When they see ""bi"" they'll see ""two"". Does that sound so outrageous that some bi people would  reject the prefix bi because of this connotation and feel like pan is a better way to represent what they feel ? Especially when it's newer generation who aren't that aware of the Bi manifesto and Bi history.

I think you might be mistaken as to how ""outsiders"" understand what ""bisexual"" is. If you ask any random person on the street what a ""bisexual"" is, most of them will already be familiar with the term and will likely say some version of ""it's someone who likes (dates, sleeps with, etc) both men and women.""  Now when they say ""both men and women,"" are they implying that non-binary or gender non conforming people are excluded from that? No. They likely don't even know what those are.  People outside of queer spaces use ""men and women"" as shorthand for ""everybody.""

For all of human history, the overwhelming majority of people have used ""men and women"" to mean ""everybody."" Most people aren't as well educated on the gender spectrum as your average queer-identifying person. Until very recently, the idea that there could even be more than two genders or that gender was not a binary was unknown to pretty much anyone who wasn't personally affected by it.  Even the idea that a trans person was anything other than ""a man in a dress"" is fairly new to most people. It's only within the past 10 years really that non-binary identity has even started to be understood outside of the queer community and even inside most parts of it. Most people still don't know what a non-binary person is, and they definitely don't know what a pansexual person is. Pansexual is most definitely not a less confusing term for a cishet person to understand that bisexual.

Bisexuals (for better or worse) have been part of mainstream culture for decades. Everyone knows and recognizes what the general concept of bisexuality is. It's not an obscure or confusing term to anyone who isn't thinking too hard about it. This assumption that most people don't know what bisexuality is and will mistake the ""bi"" to mean ""only people who identify as one of two select genders, namely men and women"" is silly, to say the least.

I grew up in an extremely conservative household.  I was very sheltered, but even with such limited exposure, I knew what a straight person was, what a gay person was, what a lesbian was, and what a bisexual person was, and so did everyone around me.  I may have simplified the definition (as most people do) but not out of a desire to exclude people who don't identify a certain way.  I didn't even know there were people who didn't identify as man or woman back then so how could I, or anyone else, assume a definition that would exclude people who aren't a man or woman?  I didn't learn about non-binary gender identities until after I came out and actively immersed myself in queer culture."
103,fovr5ky,"So, the ""old"" definition is that bisexual people are only attracted to gender binary people whereas pansexual people are attracted to anyone, regardless of gender-identity. Pansexuality is also more explicitly inclusive of binary trans-people, though that is technically included in bisexuality.

Many bisexuals don't like that definition, because most bisexuals are attracted to non-binary people anyways. There is a newer definition that, at least among young queer people I would say is more common:

Bisexuality means you are attracted to different attributes in different genders. Often classic masculinity in men and classic femininity in women. Pansexuality means you are attracted to people, completely regardless of their gender.  

Also, congrats for pulling yourself out of there."
104,frsumd1,"I am absolutely not the kind of person to get all rubbed up about these issues all day but...

No bi activist or bi activist organization has ever defined bisexuality as only liking cisgender men and women, and while there are enough bi people, just like gay and straight people, that may not want to date or screw trans people, they have never been given an extra sexuality that is even ""more queer"". A homosexual man that is attracted to cis men and trans men is gay, just gay, so why is that a difference for bisexuality? Why does bisexuality need an extra ""more queer"" version?

Bisexuality isn't also just defined as ""attraction to men and women/two genders"", bisexuality is just as much used to describe two types of attraction, the attraction to their own gender and the attraction to people of other genders.

It's transphobic and biphobic to say that a pansexual person is different from a bisexual person because they're attracted to ""men, women, and transgender people"", implying that teans people aren't really men and women and bisexuals couldn't even be attracted to them anyway.

Bisexuals have been pushed away from homophobic straight people but also from biphobic other non-straight people again and again for not being queer enough, for ""not being decent enough to pick a side"", and to be accepted they had to be pushed to say that they're lesbian, gay or simply queer, forced to pick a closet from both straight and gay people. Gay and straight people aren't pressured into giving up the language they use to describe their attraction, not like they should be, so why do we have to do so? As usual it's bisexuals being shamed into erasing our identities.

The whole discourse, in the end, is just a huge ""cis vs genderqueer"" debate. There are enough genderqueer bisexuals, like Meg John Barker and Jen Yockney, showing that bisexuality is not non-binary erasure."
105,frsvrhc,"I am absolutely not the kind of person to get all rubbed up about these issues all day but...

No bi activist or bi activist organization has ever defined bisexuality as only liking cisgender men and women, and while there are enough bi people, just like gay and straight people, that may not want to date or screw trans people, they have never been given an extra sexuality that is even ""more queer"". A homosexual man that is attracted to cis men and trans men is gay, just gay, so why is that a difference for bisexuality? Why does bisexuality need an extra ""more queer"" version?

Bisexuality isn't also just defined as ""attraction to men and women/two genders"", bisexuality is just as much used to describe two types of attraction, the attraction to their own gender and the attraction to people of other genders.

It's transphobic and biphobic to say that a pansexual person is different from a bisexual person because they're attracted to ""men, women, and transgender people"", implying that teans people aren't really men and women and bisexuals couldn't even be attracted to them anyway.

Bisexuals have been pushed away from homophobic straight people but also from biphobic other non-straight people again and again for not being queer enough, for ""not being decent enough to pick a side"", and to be accepted they had to be pushed to say that they're lesbian, gay or simply queer, forced to pick a closet from both straight and gay people. Gay and straight people aren't pressured into giving up the language they use to describe their attraction, not like they should be, so why do we have to do so? As usual it's bisexuals being shamed into erasing our identities.

The whole discourse, in the end, is just a huge ""cis vs genderqueer"" debate. There are enough genderqueer bisexuals, like Meg John Barker and Jen Yockney, showing that bisexuality is not non-binary erasure."
106,fepd629,"Ehhh. They're so close sometimes I don't know the real difference. Of course each individual is different but I usually come across cases where a person who is bisexual is attracted to cis people. And pansexual people are attracted to trans individuals as well as nonbinary, and any sorts of queer identity or lack thereof."
107,f5jqm6r,"In theory pansexual people are interested in people with gender identities both in and outside of the gender binary, while bisexual people are interested in anyone that falls within the gender binary. Some people who identify as bisexual are only interested in cis people. 

In reality many bisexual people are actually pansexual, but identify as bisexual for convenience as people are way more familiar with bisexuality. I find those who identify as pansexual have a wide variety of what that means to them, and it ends up a sort of catch all similar to identifying as queer."
108,f4nzimg,"Copying this comment here (not mine, but I think it really nails it):

""This is why it’s really hard for gay women to feel secure in relationships with bi/pan women who have only been in serious relationships with men. I’ve seen countless bi/pan women have affairs and flings with lesbians and then move on to a committed relationship with a man acting as if her previous relationship was not valid. The “label-free queer women” who invades the LGBT community and then moves along back to heteroland with a homophobic/lesbophobic mentality of “oh I did that, it was fun but now I’m in a *real* relationship” is fucking frustrating. And yes yes yes that is not how all if not even most bisexual/pansexual people are but I think people in the LGBT community who see Miley and her comments/actions know exactly the kind of person I’m talking about. You can’t dip your toes into a marginalized community for funsies and some sort of bizarre street cred and then walk away and invalidate the entire community. Also Miley, you’ve been with this guy for a few months you don’t know if he’s a good guy or not."""
109,ewb8zml,So bisexual and pansexual people are the ones who’ve had a history of beating queer folk? Get over yourself.
110,et6azei,"Queer is a term that defines everyone in the LGBT+ community. Also, people who are Bisexual are defined as having an attraction to men and women, while Pansexual people are defined as having an attraction to all genders (male, female, agender, non-binary, etc.)"
111,f1f2736,"I feel that, but where I am people still think Queer is an insult, so we have to use gay for the time being 
Or else we have to explain it all out 

I kind of see it like a genus species thing 

Like a gay man is gay gay
A pansexual person is gay pan
And so on and so forth"
112,epvk867,"&gt;Please tell me how pansexual is different than bisexual?

Bisexual people are attracted to Men and Women, specifically their attraction could be described as towards the primary and secondary sex characteristics of both Men and Women

Pansexual people are capable of feeling sexual attraction to anyone regardless of their sex characteristics, and are often more likely and more comfortable with dating the wide variety of non-binary identities and intersex people

But neither of these are linear definitions as sexuality is fluid : )

&gt;The intersex people I've talked to have said the opposite! The people you talked to obviously identify as trans! Good for them, not all intersex people do.

And not all don't

You are literally arguing that ""some intersex people feel different"" and that argument could be applied the exact other direction to include them and let them choose to identify as queer if they wish instead of full stop excluding them, lmao."
113,erps9zd,"I wanted to give you the benefit of the doubt, so I went through all the hoops to access this article through my university: And it doesn't even mention ""pansexual"" *once*. 

So while a pansexual person could possibly have chosen queer or bisexual as their orientation for purposes of the study, or could be one or some of the trans or two-spirit people in the study, there's nothing in the article to indicate that because pansexuality wasn't even taken into full account. This journal article does absolutely *nothing* to support the notion that ""many"" pansexual people *specifically* refuse to date trans people. This says to me that you didn't actually read the article you're trying to cite here, or at least didn't read it well since it doesn't actually seem talk about pan people. 

However, we can look at the bisexual/queer/trans responses and see that these individuals didn't identify that they'd 100% date trans people either, though they were notably more inclusive than the results of straight and gay participants. The article doesn't specify exact reasons for why, but there are a lot of reasons this is possible. For example:

* Transphobia. Simply put, being attracted to someone *doesn't mean* that you can't also have prejudice against them. Cisgender, straight male misogynists date and marry cisgender women all the time. There are people who say they're attracted to certain groups of people but would never actually date them or get into a serious relationship with them. Anyone can be transphobic: Straight, gay, bi, pan, it's not a problem specific to one orientation. In fact, I'd speculate pansexual people are less likely to be transphobic than some others as many pan people I know specifically choose the label to make *sure* their nonbinary partners know they're validated in the relationship. Additionally, I see the label used about equally between cisgender and transgender individuals, though this is anecdotal. 
* Fear. Even if the individual isn't transphobic, dating a trans person is an experience many cisgender people are not prepared for and don't know how to approach. Many don't know what to do sexually if the individual has genitalia that's not what was anticipated, and many don't know how to handle the hate that can be sent *their* way for dating a transgender individual. 

Are these reasons good ones? If by good you mean ""reflective of a lack of prejudice against trans people"" then no, because society influences our attractions and what we see as desirable more than many of us would like to admit.  More relevant to your question though, is there anything to indicate this type of transphobia in dating is more of a problem among pansexual people than any other orientation, and deserves to be called out in this specific manner? Also no."
114,epfhlyf,"But in 90% percent of cases they are.

Yeah, pansexual people are also attracted to NBs, gender-queer and everything that is between male and female, but these people are a minority.

Most of the time, a pansexual person will end up dating someone who identifies exclusively as a male or a female, becoming practically bisexual."
115,ek1o8rm,Sounds like your friends really weren't your friends. Pansexual people are a valid part of our community and Queer people of every shade should accept and respect that. I'm sorry you've had such shit luck with our community so far. *hug*
116,el2kizy,"Bisexuality functions as a community label as much as a personal identity label. It encompasses everyone who is attracted to people of more than one gender, regardless of how they personally identify. Some people choose to personally identify as ""queer"" or reject all labels entirely. Some people identify as bisexual, and some people identify as pan. But the broader bisexual community is here for *all these people*.

""Pansexual"" functions more as a personal identity label than as a community label. A person who is pansexual is further specifying that they are attracted to be people *regardless* of gender. Gender isn't even a factor for them. Pansexual people are definitely attracted to people of more than one gender, so they fall under the umbrella, but it further specifies that they don't have a gender preference for partners--they're not more attracted to men, women, non-binary folk, etc."
117,ei8q2ss,"I think the distinction between whether someone identifies as bisexual or pansexual comes down to whether that person prioritizes history or etymology.

Personally, I treat bisexual as an umbrella term that includes pansexual-- that's my current understanding on the matter, anyway, and I certainly don't disparage anyone who has reached a different conclusion. As a result, I don't think there needs to be a P in the acronym, but I absolutely think pansexual people are part of the community.

Queer is a word that has a long history as a slur, as do most LGBT+ labels. Gay was used the same way. Because of that history, some people feel uncomfortable about the word, and that's understandable and justified. At the same time, they don't get to tear down anyone who seeks to reclaim that slur for themselves."
118,ejggxxc,"I have in the past, cut and dyed my hair. I have piercings and tattoos and I have worn binders before. Currently I present as female because of my job and I don’t want to strain relationships with my mother or grandmother. 

My thoughts on gender in sports basically boils down to, if people want gender equality it has to be on all fronts. A trans woman is a woman. Period. She is no different than a cis woman that has a hormonal imbalance that makes her produce more testosterone (that is a real thing that happens) and no one would ever deny a woman like that, so why are trans women any different? And if I swing at a cis male, I fully expect to get hit back. 

For my sexuality, I am pansexual. People are people to me. I don’t care what their gender is or what’s between their legs. I am currently dating a person who also falls on the gender queer spectrum. He mostly identifies as male but he has his girl days from time to time. My gender is not really influenced at all by my sexuality. When I am having a guy day I really have a lot of disphoria about the fact I can’t receive oral or penetrate my partner like a cis male could. But that is about the extent of it. 

I am almost 32. "
119,egzsx9u,"When LGBT people use it, queer is something of a catch-all term for anybody on the LGBT spectrum.  It also has a history of being used as a slur, so I would generally recommend against using it to describe someone unless they used it themselves first.  It basically means ""not straight"", but doesn't necessarily mean ""strictly homosexual"".  In my experience bi and pansexual people are the ones most likely to use it.  "
120,ee9q6vu,"Is this something you really need to have a firm opinion on in order to understand? I'm not trying to be rude or say that this isn't something you're allowed to think/talk about. I'm just wondering if it really helps you to try to distinguish between bi and pan people like this. And I do think it's an issue for someone, especially someone who's not bisexual,  to decide on a one-size-fits-all definition of bisexuality that conflicts with how many in the community use it. A lot of bisexual people are attracted to non-binary individuals. 

Both bisexual and pansexual people are capable of feeling attracted to more than one gender. That's it. Any differences are connotative and down to personal preference. Some people use both bi and pan to describe themselves depending on the context. Some people like pan better because it feels broader or more inclusive to them. Some people prefer bi because it's what they grew up with.

It's kind of like identifying as gay vs. queer. Sometimes they mean the same thing, but it comes down to the individual. "
121,eeahh07,"Pansexual. It's incredibly similar to bisexual and in fact there's a lot of overlap. The only difference is that pan means ""all"" while ""bi"" means two. Most people think the difference is that pan people are attracted to non-binary people, and in fact I think pan was coined as a way to sound more inclusive (though I could be wrong). However in my experience, most bi people ARE inclusive of nonbinary people, they simply got attached to the word bisexual before they learned the word pansexual, or they use it to denote that while they are attracted to more than one gender, they still have different preferences in regards to each gender or that attraction to each gender feels different, whereas pansexual people are seen to be attracted to someone literally completely regardless of their gender or sex.

Fact is it's all a bunch of linguistic hooey and I generally just say people are what they say they are. I call myself pan because when I found the word it felt right, but other people have basically the same orientation as me and prefer to use bisexual. Who knows *shrug* we all queer."
