,id,comments
143,e0rcfrl,"I've never heard of this, and I'm not surprised it's fake...

I kind of feel like some people could use some explanations of the terminology. Bisexual, in its most pedantic meaning means a person who is attracted to two genders. A pansexual person is someone who can find people attractive regardless of that persons gender identity, meaning that to someone who is pansexual (Like myself) gender isn't as important. A bisexual person, if we go by the previously stated definition, is only attracted to people who are specifically one of two genders, usually male or female. *However* both humans and language are complicated! How many of you know the exact dictionary definitions of all the groups you belong to? Probably none, because that's not what we go by. Language and sexuality is fluid, it's not a fixed unchanging point.

As I mentioned, I'm pansexual, *by the dictionary defintion of the word*. However, me and many other pansexuals use both pan and bi. At least for me, it's simply to make it easier. A lot of people have never heard of pansexual, but everyone sort of knows what bisexual means. Very few people outside the lgbtq-community would question my attraction to a non-binary person if I had told them I'm bisexual. Within that community, there might be some confusion, but in those situations I also find it easy to say I'm pan but use both pan and bi in both situations, as that's common among pansexuals anyway. I even think it's possible pan might disappear and we'll use bisexual to mean both that and it's current meaning, because bisexual is already so broad that I don't think adding pan to the mix makes it that much more confusing.

And thank you for pointing this out to people. I'm sick and tired of lgbtq-people and feminists being portrayed as wanting to make everything offensive! Yes, *of course* there's people like that! Every community has them, but they're a small fringe group. Most of us are reasonable people who don't think it's offensive to be attracted to only men or women and for whatever reason finding no attraction towards non-binary people. I am *certain* that if the person reading this thinks of one of their own communities, they'll find stereotypes about that group based on a small loud minority, and that's how it is here in the cases when it's a real oppinion. There are going to be embarassing people, weird ideas, errors, people you'd rather never have to associate with... That's how it works when you're part of a large community, especially a political one!"
144,ebd2sj9,"It's not a good thing for them to do, but I do understand why a lot of bisexual/pansexual people are inclined to hide their sexual orientation in the beginning... They're probably afraid of being rejected or treated badly. A lot of lesbians will write off bi/pan people because they're insecure and they think that all bi/pan people will ultimately cheat or leave them for men. Obviously that's not you, but they're not gonna know that on the first date (or even the first several dates -- depends on when/if the topic of bisexuality or pansexuality comes up). Most likely, once they were aware of your accepting attitude, they would have told you the truth. "
145,fyabs6m,"First off, thank you so much for replying to that comment. I know, it's the most ignorant sounding one in my post but that's because it's the one I need to know the answer to from peoples experiences. I know it sounds mean and ignorant to say ""wishy-washy"" but I couldn't come up with a better way to ask, while still putting enough emphasis on it for someone to reply. 

I understand that many bisexual people are attracted to people the exact same way that pansexual people are, so that's fine. The difference is mainly that not ALL of them are. It's just confusing to have a specific label that also remains so vague, since what bisexuality entails is person-specific rather than all-encompassing. 

I'm also NB (genderfluid) and yes I agree with the fact that we generally don't mind being read as whatever sexuality, but there is definitely an issue where we need to ""pick"" a gender expression. Though, while being NB definitely does not erase gay/lesbian people, I personally do feel invalidated as gender-fluid if any binary-sexuality person was to say they had an interest in me. This is obviously not the case with every NB person, but just my personal experience with it, since it feels as though they only see me and are dating me as the x gender that they are attracted to, and not my full identity. (Which has happened as I've dated many cis-straight males, which may be my own fault, but I like who I like.)

Yes I agree with you about the legal rights part, I even mentioned it in the last paragraph. Pan people would definitely not have the rights we do if it weren't for the history of bi/lgbtq2A+ people fighting for them. However, I've noticed that more young people are identifying as pan than bi, and this may be because they did not participate in the major fights from history, because they are uneducated about them, or they are fighting the legal wars NOW with the pan label, which I feel should be just as valid, since rights for bi people are rights for pan people and vice versa. The respect towards bi history should always remain, though. 

""And here's the other area where I'm highly skeptical about pan advocacy. There doesn't seem to be much beyond asking why bi people don't change, and why bi people are so horrible."" I think the reason I've seen so much about this internal war against the labels is because I keep seeing many more panphobic posts lately. I'm not sure if that's because of pan people having been biphobic in the past (seeing as some claim the label as born out of biphobia), but honestly a ""who started it"" isn't really the right way to go, regardless. I don't mind any sexuality, nor if anyone does keep a certain gender out of their sexuality, it's their sexuality so it's their choice. I know everyone has different opinions on this so I'd imagine you've met with a fair share of closed-minded people (which is awful and definitely frustrating.) 

I think that pan is just a more specific form of bi, and that works for some people. Honestly, since pan is the same thing as bi I still don't fully understand why so many bi people are against pan, since they are technically of the same sexuality. Not all bi people are pan, though, which is why I feel like if someone wants to label themselves with the differentiation, it makes sense to. 

Apologies for writing so much, but thank you again for helping me understand."
146,fn0w5rq,"One thing I've noticed a lot of the debates devolve into is an argument about gender. This isn't. There are two sexes, and both bisexual and pansexual people are attracted to them (There are arguments about intersex people, but it's generally considered very discriminatory to call an intersex person an ""other"" third sex, though most who use this argument have never bothered to ask one). Gender is an ongoing, fluid debate/concept that doesn't really apply here.

So at its core, they're the same. The problem is that bisexuals already suffer from erasure and discrimination by both homophobic straight people and biphobic homosexuals, and further diluting our presence isn't helping the matter. This automatically puts the two at odds and why you'll notice particularly more frustration from bisexuals as debates over why a new label is needed erupt. 

Pansexual tend to point toward the fact that they 'feel' attraction differently than bisexuals, without considering sex/gender, but the fact remains that both groups have the ability to be attracted to basically the entire human race, other personal preferences aside.

In all honesty, I'm one of those frustrated bisexuals who dislike the pansexual term. I also accept your decision to identify with that label more, even if I feel it's ultimately detrimental to each of our causes."
147,fc9ie2y,"I understand your frustration, and it sucks that bisexual people are being judged by both homophobes and members of their own community. As a lesbian ally I wanna just say that bisexual/pansexual people are completely 100% valid and anyone who says otherwise is an idiot."
148,fdk409h,"I've had a lot of arguments about this over the years, and I initially thought I shouldn't make a top-level comment, because my general stance is to agree with the OP. Furthermore, there's a bit of a fraught history here, which as a self-identified bisexual makes me feel prickly and defensive. 

Gender is not a factor for me in whether or not I find someone attractive, and that is *why* I call myself bisexual. 

Bisexuals have both historically and presently been frequently shunned and discriminated against by *both* heterosexual and homosexual communities, and the word 'bisexual' has been heavily stigmatised. So, when the word 'pansexual' was coined and started to rise to prominence, it felt to many people like an attack of sorts -- like a way to describe what for many was the bisexual experience, but squirming away from using the stigmatised term 'bisexual', which others of us had fought hard to claim and continue to fight to destigmatise. I've tended to be in that camp, and have been frustrated by the ridiculous claims made by some proponents of the word 'pansexual' that have tried to inform me that using the word 'bisexual' is somehow transphobic, binarist, etc. 

However, two things have prompted *me* to change my views on the issue, and I impart those here to OP. One was u/Thecoldflame's comment here, and the other was revisiting Julia Serano's seminal essay [""Bisexuality does not reinforce the gender binary""](http://www.thescavenger.net/sex-gender-sexual-diversity/glb-diversity/467-bisexuality-does-not-reinforce-the-gender-binary-39675.html). In doing so while primed by this thread, I noticed this passage, which hadn't quite sunk in for me on first reading:  


&gt;The reason why I identify as bisexual is two-fold.  
&gt;  
&gt;First, on a physical level, the attraction that I feel toward  male-bodied people feels very different to me on a visceral level than  the attraction that I feel toward female-bodied people. And having sex  with a female partner feels very different to me than having sex with a  male partner.  
&gt;  
&gt;Such feelings are difficult to put into words, and I am not quite  sure what the source of this difference is, but presumably it is related  to what makes exclusively homosexual or heterosexual people attracted  to one sex or the other, but not both.  
&gt;  
&gt;I know that some people describe themselves as pansexual, which may  work well for them, but I personally am not a big fan of that label with  regards to my own sexuality, as it erases the way in which my  attraction toward women is different from the attraction I experience  toward men (and vice versa).

This is not my bisexual experience. I *do not* experience a visceral difference in my attraction to, or sex with, men, women, or non-binary people. My sexuality *could*, then, I suppose, be captured by the term 'pansexual' in a way that Serano's could not. I *choose* to use the word 'bisexual' only, but 'pansexual' would not be *wrong* for me, which is why it has always felt so frustratingly synonymous. But 'pansexual' *would* be wrong for Serano. So it cannot be a synonym.

**The conclusion, then, is this:** 'bisexual' is an umbrella term which *encompasses* pansexuality. After all, all 'bisexual' means is 'attracted to people of one's own or other genders' -- in contradistinction to 'heterosexual', which means 'only attracted to people of a different gender', and 'homosexual', which means 'only attracted to people of one's own gender'. So all pansexual people are bisexual, but *not* all bisexual people are pansexual; therefore, they are not interchangeable."
149,f3dmn4x,"I think the confusion was due to a lot of posts on this sub were expressing bisexual frustration towards trans/non-binary people, as well as posts like this one, which is mocking people who's definition is more trans/non-binary inclusive. 

The idea of bisexual person mocking a pansexual person is like a person form Constantinople mocking a person from instanbul. It's the same thing 😂"
150,f28vgmw,"Little late, but this post really resonated with me. I feel so much for you. I've been through the same thought processes in varying stages, so I can relate. Sorry for this huge essay omg! 

Ugh there's so much I want to say, but one thing I'd like to remind you of first; not just in the context of sexual orientation, but just about most things, if someone online or in person is telling you to reconsider your personal boundaries--be alert. That is a red flag. It doesn't mean run away from people as soon as you recognize this, it doesn't mean don't hear out what other people have to say, merely take note. Someone wants you to redraw your boundaries. Why? 

What does you having these boundaries in place prevent them from doing? What is it affording you? What do they gain by having you dismantle them? People who egg you on to go against yourself have an intended result in mind, and it's usually self-serving i.e., not considering you and your own autonomy. I don't say this to make you paranoid, but anything anyone says to you (and yeah even what I'm telling you now) should be filtered through the fact that a) this person is human and has their own biases b) people tend to bandwagon and parrot- they'll just say what they've heard others tell them without really delving into the matter and c) you're your own person. You are perfectly capable of coming to your own conclusions, whether you trust yourself or not. Don't let people tell you how and what to think.

Next thing, the whole people thinking bisexual/pansexual people are somehow morally superior? Bullshit. And painstakingly homophobic, to boot. Humans can be awful no matter the age, race, sex, or sexual orientation. There's nothing inherently holy or sinful about who you have sex with it. And what's so wrong about same-sex attraction? Whatever happened to the whole love is love thing? Why are people so hell bent on forcing people to have sex with people they don't want to? It seriously creeps me out. Oppression is oppression, doesn't matter that it's coming from another oppressed group, it doesn't make it any less wrong to mentally manipulate people like that. 

So no, I don't think you're any less of a human being for not being into dicks, and people who try to convince you otherwise have some serious issues if they have no problem spreading rape culture and shame around like that. I've also always found dicks disgusting, there's nothing even remotely appealing to me about 'em (and yea!! I also can't stand realistic dildos!) Do you think I'm some kind of abomination? Do you think I'm a sub-category of human for not wanting people I'm not attracted to in my intimate relationships? Should I spend the rest of my life uncomfortable and in despair, living it the way other people think I should? Well, I won't. Why should you? 

And the thing is that...stuff like that doesn't really change. People have and still certainly try (hello conversion therapy) but thing is, it doesn't work. It's not something you choose. There's nothing wrong with us. 

I'm sure you know this already, but the torturing yourself with watching porn with dicks in it is probably not the best for your mental health.  Ngl, I've looked at it before just to see if my feelings have changed about it, because we all fall prey to the way society makes us see ourselves, but nope. I move on to stuff that makes me happy.

And I think and hope that you can fall back into things that make you happy, too. It's okay to step back from all of this for a while. I'm not saying bottle your feelings up, just take some time for the things that uplift you. Any music, game, books, shows, comics, art, whatever makes you feel happy to be you. Step away from non-supportive spaces and discussions. You deserve to be happy and comfortable with yourself, and you don't have to do anything to earn that right. Thanks for sharing your story, it's really helped me put some stuff in perspective. Hope it could help you a little bit too. Wish you all the best!!"
151,foueowg,"There are other multi-sexual identities if you feel like bi isn't the right one for you.

* Bisexual people are attracted to two or more genders (or to both similar and dissimilar genders).
* Pansexual people are attracted to all genders, although they may or may not consider themselves ""gender blind"".
* Omnisexual people are similar to pansexuals, but they are specifically not ""gender blind"".
* Polysexual people are attracted to multiple genders but not all of them.

Anyone identifying with any of these may have preferences for certain genders over others, and it's okay for people to identify themselves as more than one of these if it feels right to them.

Considering that you aren't attracted to men, and you say that Bisexual doesn't feel right as a label, I'd say Polysexual could be an identity that fits you. You could also just identify as q\*\*\*r (censored because I know some people are sensitive about the term), or not use a label at all. Hope this helps!"
152,fgy7pel,"I've never heard the term trilingual, where I'm from people would only ever say bilingual. This is also just a common analogy in the Bi community that I'm just repeating so there could be some logical flaws. 

There are multiple reasons why we don't see it as attraction to ""men and women"". NB exclusion is a big part, but also because we often feel attraction to different genders in different ways. 

If I was dating a trans woman, I would be attracted to all the things in her that I'm attracted to in any other woman. Genetically she still has a Y chromosome and male genitalia, but I'm not attracted to her like I am to a man. I often take on a more dominant role in relationships with women, and a more submissive role with men. Possibly TMI but I'm just trying to help people understand :) 

Pansexual people are moreso just attracted to certain traits and they don't care about the gender of the person who has them. 

Disclaimer that no one can speak for everyone in a group, I'm just aggregating the most common sentiments I see from being active in the community. Gender and sexuality is a huge spectrum and no one label is going to make everyone happy."
153,fygws3d,"Pansexual and bisexual are pretty similar, although there is one distinct difference.

While bisexual people are attracted to both physical sexes and thus can be attracted to anyone regardless of gender identity, they can still experience a bias towards one sex or gender identity over another.

Pansexual people, while they are still attracted to all gender identities, are mainly attracted to certain personality types and physical and emotional quirks. The latter attraction often supersedes the former and thus they do not necessarily care about the gender identity or biological sex of the person they are attracted to.

TL;DR - Bisexual people often have a preference of sex or gender identity whereas pansexual people are more focused on the personality."
154,fump3yl,"I felt like this too ( when i questioned myself) but eventually i found a label that suits me.

&gt;*""  I feel like if I did that with someone I would have to know them and get to know them ""*

From what you wrote you could be demisexual and panromantic...

"" **Demisexuality** is a sexual orientation where people only experience sexual attraction to folks th*at they have close emotional connections with. In other words,* ***demisexual*** *people only experience sexual attraction after an emotional bond has formed ""*

*""****Definition*** *of* ***pansexual****. 1 : of, relating to, or characterized by sexual or romantic attraction that is not limited to people of a particular gender identity or sexual orientation* ***Pansexual*** *people are attracted to all kinds of people, regardless of their gender, sex or presentation.—""*

I think a lot of people can relate to your thoughts and feelings. Sexuality is fluid so it can change and you don´t have to stick to one label. Hope you find your label/sexuality or  whatever :).

Edit: Grammar"
155,fmym3m7,"**Pansexuality**

Pansexuality, or omnisexuality, is the sexual, romantic or emotional attraction towards people regardless of their sex or gender identity. Pansexual people may refer to themselves as gender-blind, asserting that gender and sex are not determining factors in their romantic or sexual attraction to others.Pansexuality may be considered a sexual orientation in its own right or a branch of bisexuality, to indicate an alternative sexual identity. Because pansexual people are open to relationships with people who do not identify as strictly men or women, and pansexuality therefore rejects the gender binary, it is often considered a more inclusive term than bisexual. The extent to which the term bisexual is inclusive when compared with the term pansexual is debated within the LGBT community, especially the bisexual community.

***

^([ )[^(PM)](https://www.reddit.com/message/compose?to=kittens_from_space)^( | )[^(Exclude me)](https://reddit.com/message/compose?to=WikiTextBot&amp;message=Excludeme&amp;subject=Excludeme)^( | )[^(Exclude from subreddit)](https://np.reddit.com/r/nosafetysmokingfirst/about/banned)^( | )[^(FAQ / Information)](https://np.reddit.com/r/WikiTextBot/wiki/index)^( | )[^(Source)](https://github.com/kittenswolf/WikiTextBot)^( ] Downvote to remove | v0.28)"
156,fksb7jw,"**Pansexuality**

Pansexuality, or omnisexuality, is the sexual, romantic or emotional attraction towards people regardless of their sex or gender identity. Pansexual people may refer to themselves as gender-blind, asserting that gender and sex are not determining factors in their romantic or sexual attraction to others.Pansexuality may be considered a sexual orientation in its own right or a branch of bisexuality, to indicate an alternative sexual identity. Because pansexual people are open to relationships with people who do not identify as strictly men or women, and pansexuality therefore rejects the gender binary, it is often considered a more inclusive term than bisexual. The extent to which the term bisexual is inclusive when compared with the term pansexual is debated within the LGBT community, especially the bisexual community.

***

^([ )[^(PM)](https://www.reddit.com/message/compose?to=kittens_from_space)^( | )[^(Exclude me)](https://reddit.com/message/compose?to=WikiTextBot&amp;message=Excludeme&amp;subject=Excludeme)^( | )[^(Exclude from subreddit)](https://np.reddit.com/r/FortniteLeaks/about/banned)^( | )[^(FAQ / Information)](https://np.reddit.com/r/WikiTextBot/wiki/index)^( | )[^(Source)](https://github.com/kittenswolf/WikiTextBot)^( ] Downvote to remove | v0.28)"
