,id,comments
67,e6qc6ej,"Unfortunately I wrote this entire comment once, my draft disappeared and I had to rewrite it, so there are a number of points missing. Furthermore, you are banned from this subreddit now, so you do not have a chance to respond, which makes my reply somewhat unfair. But I couldn't leave a number of points left unmade. 

&gt;I don't know how you conclude that ""no autogynephilic trans women reported asexuality"", can you expand?

If you include ""a little bit"", then around 2/3 of cis women experience that. Also my comment about absurdity was not about the prevalence of AGP among asexual trans women, but about the mechanism by which AGP is proposed to exist. 

Furthermore, if we look at page 79, then we can see that the average Core Autogynephilia score for asexual participants was *lower* than that of androphilic respondents. If we're going to include asexual people in the ""AGP"" category, then by Veale's results we'd have to include androphilic (HSTSs) people, which then puts literally everyone in the AGP category. 

My comment about the absurdity was far more related to Blanchard's comments on asexual trans women; 

&gt;In some others, the intensity of the autogynephilia–which is attraction to an imagined “inner woman”–is so great that there are no erotic feelings left for other people. This accounts for asexual identification. (Asexual autogynephilic males have plenty of sexual fantasies, but these fantasies tend not to involve other people.)

and

&gt;Analloerotic [meaning asexual] gender dysphorics represent those cases in which the autogynephilic disorder nullifies or overshadows any erotic attraction to women; those cases, in Hirschfeld's metaphor, in which ""the woman within"" completely supplants her fleshly rivals.

That's the part that sounds like he's trying to make shit up in order to justify his typology. 

&gt;I didn't define pansexuality in a way that excluded attraction to dimorphism, I defined it in a way that allowed attraction to androgyny. Regardless, ""pansexual"" is a questionable category in that it's not very crisply defined.

Your underlying assumption is that pansexual people are more attracted to androgyny and that on some level, and that straight/bi/gay people are not. I agree that ""pansexual"" is not clearly defined, but that's not bad or contested. It's common among other sexuality definitions; homo/heterosexuality (homo/heteroflexible), bisexual (homo/heteroflexible)

&gt;I totally question the reports of HSTSs, but only when relevant. Blanchard tested whether HSTSs might be denying their AGP and found no effect. In addition, HSTS's narratives don't contradict their objective past in the same way that AGPTS's narratives often do. A good place to look for HSTS lies would be in their porn preferences, IMO. HSTSs claim to only like straight porn, despite clearly having more physiological arousal to gay male porn.

The problem is that Blanchard does not. Also, Blanchard's claims has not panned out contemporarily given a wealth of data indicating around equal prevalence of MtF and FtM trans individuals. Furthermore, as shown previously, Veale is unable to replicate the effect of social desirability bias on results. 

&gt;What does ""not indicative"" mean?

It means that differential presentations of a condition does not mean that the condition is not present in both populations. Just because lesbian women are supposedly less likely to have AGP (barely statistically significant) does not mean that AGP does not exist in cis women. Autism presents differentially in women and men, autistic women still exist

&gt;I'd go with some Bayesian definition based on probability updates, which means we would have to look at predictions. 

.

&gt;Kay Brown predicted that Moser's items would have no validaty, 

Brown should read [Moser's explanation of his criterion](http://sci-hub.tw/https://www.tandfonline.com/doi/abs/10.1080/00918369.2010.485859?journalCode=wjhm20)

Let me break down Brown's article;

&gt;We can find hundreds of such examples, very often showing that this behavior is most noted in early adolescence, but continues into adulthood. In fact, we have an entire genre of erotic fiction and images (still and motion picture porn) dedicated to the tastes of autogynephilic adult male individuals.  These examples and the males that experience it are common enough that they also form organizations to join together to support each other emotionally and even politically.  So, no, we can’t say that autogynephilia does not exist.  The null hypothesis is easily proven wrong.  Autogynephilia in some males exists.

Just from this passage, we can easily argue that autogynephilic cis women exist. The standards for proving AGP existence in a population for Brown are clearly very low. 

&gt; He carefully rewrote questions from an instrument intended for and validated only for males in a gender clinic setting?

Yes if you define a condition as being exclusive to males, any attempt to extend the condition to non-males is going to lead in contradict. It's a tautological assertion to say ""AGP only exists in males"" because it's (apparently) defined this way

&gt;Well, looking carefully at the rewrite, they don’t seem to have even a passing bearing on what autogynephilia would theoretically look like in women, or even in androphilic transsexuals

Read his paper. 

&gt;One and only one demonstrably invalid study.  We still have no evidence to disprove the null hypothesis.  So, for now, we must accept that females do NOT experience autogynephilia.

She didn't prove it wrong and she's ignoring Veale 

&gt;These studies all clearly indicate a strong correlation with non-exclusively androphilic reporting a high, nearly universal, percentage of individuals acknowleging autogynephilic arousal, either currently, or in early adolescence, and a strong anti-correlation with exclusive androphilia

Nearly universal is way overstating it. 

&gt;To support the null hypothesis, there should have been no correlation with sexual orientation.  The null hypothesis is NOT supported, there is NOT one group, but two.

That's not how group analysis works. To argue that a coherent, distinct grouping exists, you have to perform a number of statistical tests to establish its existence and then verify its usage. It isn't just ""well a correlation exists, so there are groups!"". Relevant research is Daphna Joel and of course Veale. 

&gt;Further, the null hypothesis regarding autogynephilia not being correlated with gynephilic/bisexual/asexual transwomen, and only these transwomen, is not supported.  

&gt;Androphilic transwomen and natal female women do not experience autogynephilia.

I don't understand how she comes to the conclusion that androphilic trans women do not experience AGP when there is ample evidence they do (even if it is at a lower rate than gynephilic trans women). Sounds like she's being either scientifically illiterate (likely) or intentionally disingenuous (less likely but plausible)

&gt;but causation does require correlation

Definitely scientifically illiterate. https://stats.stackexchange.com/questions/26300/does-causation-imply-correlation &amp; https://www.christopherspenn.com/2018/08/can-causation-exist-without-correlation/

Forgot the article wasn't done wew. 

Her analysis of the 9 points ignore all contradicting research, but that's fine. 

&gt;Plausability.  This is almost self-evident.  If one’s sexual ideation is exclusively autogynephilic, if each time such an individual sees herself as obligatorially female during sex, that would be strong drive towards gender dysphoria and an incentive to adopt a female gender identity, over time.

Unsubstantiated assertion. 

&gt;while Julia Serano wrote ""numerous cis femme-identified queer women have told me (in informal conversations) that they regularly experience FEFs"", seemingly predicting that AGP would be more common in lesbians than straight women. If we find the opposite of her prediction, then that means that there is some issue with her model.

She's not making a prediction, she's talking about anecdotes. She isn't saying ""more queer women than straight women"", she's saying ""some queer women have FEFs"". 

&gt;No, as I said I've done surveys about autogynephilia in cis women.

Nobody cares about your surveys.

&gt;Veale's results supports my point, since she showed that her AGP scale gave higher results for straight than lesbian women.

 Dubious. From page 66, the relationship was not statistically significant (which does not suggest there is no correlation, just that we have not rejected the null hypothesis). Interestingly enough, the r coefficient for AGP vs gynephilia was .18. Doesn't sound very strong now, does it Brown

&gt;I have asked AGP trans women about this. Worth qualifying this a bit: I think you'd probably get different results depending on whether you mention the AGP theory or not, as mentioning the AGP theory would allow social desirability bias to more come into play. I'm planning on demonstrating this soon.

See above on your surveys. Also it's pretty funny that you're using this as criterion for AGP since it's so vague, non-specific and irrelevant (ironic given the critique of Moser). I would be considered an autogynephile and an autoandrophile by this criterion, and I'm sure a lot of people would. 

Interesting that *you* found that lesbian cis women have higher rates of your (awful) determiner of AGP, so there's that against your argument in this thread. 

Social desirability bias is an easy way to invalidate any study that disagrees with one opinions. 
"
68,e6so1vu,"We gays are the majority of queer people, so we use it most often, and usually referring to gay people, instead of qualifying people as lesbian or gay. In that way it’s more of a term for gender acknowledgment/equality. 

But queer includes anyone who is on the LGBT spectrum. Most “asexual’ (personal experiences) people don’t want to be  ID’ed as queer, because they don’t have a sexuality. They’re just people. 

The key point that *could* be made here is that bisexual people (or pansexual people) are sexually compatible with more people than anyone else. If someone is interested in their sex they’re bisexual. If they’re interested in gender, or lack thereof, they’re pansexual. Pansexual really means that you’ll fuck anyone who wants to fuck you. Must be fun af. "
69,e06uubb,"Your definition of non-binary is incorrect. Non-binary includes anyone who is not a single binary gender 100% of the time. It's an umbrella term that includes many different types of genders. 

Some people, like myself, have a stable gender (doesn't change) that is neither male nor female. I consider myself gender neutral, which is to say that I have a strong sense of gender, but it is not related to woman or man.

Other non-binary people are agender, and don't have any gender. They see themselves as just people, and gender is something other people have. (Think the gender equivalent to asexual.)

And there are also people who are polygender, meaning they have more than one gender, either at the same time or due to gender fluidity. 

For example, a bigender person who is both male and female at the same time, always. Or a person who is gender fluid, sometimes feeling female and other times feeling gender neutral. There is also gender pivot, where someone has one stable gender that is always there, and one or more fluid genders that come and go. 

Non-binary people are extremely diverse in how we experience and express our genders, it's not just one thing. Just like how not all bisexual or pansexual people are split 50/50 on how much they are attracted to men or women. Many of them like non-binary people too, or they like one gender more sometimes and another gender more at other times. "
70,e047qay,"same sex \- **homosexual**

opposite sex \- **heterosexual**

both sexes \- **bisexual**

anyone \(includes trans people and hermaphrodites\) \- **pansexual**

no one \- **asexual**

""Anyone"" is where your argument breaks down. Because initially the discussion was sexuality, and you state that homosexual is between the same sex, hetero is between two different, and bisexual is with both. But then for *pansexual* you don't actually cover different sexes, you cover genders and mutations, which are not sexes.

You've set the bound for what is a sexuality by making it about attraction between natural sexes, and then you've included a new, special category outside those bounds. Hermaphrodites and artificial genders are not new sexes, they're abnormalities which you claim 'pansexual' people are accepting of. Because they accept anything. Bisexual already accept either sex, the only thing 'pansexual' people do is claim to be more accepting. Of non\-sexes. Which means they shouldn't be included in a list of sexuality. More like they're less picky bisexual people.

The only difference, as far as sexes are concerned, between pansexual and bisexual, is the spelling and the personal preferences of those who identify as it. Which makes it, fundamentally, a useless category for sexes.

But you don't raise a point that op forgot asexual people. But that's another debate entirely. "
71,dw8pap0,"When did I say that non binary trans people can't be part of bisexual communities? I didn't say they can't be bi, I'm just saying that pan is a more accurate description of someone who likes more than one gender. You may be mistaken as to my point because earlier you were talking about how bisexual used to describe people with mixed characteristics. That is irrelevant to the way I'm using the word to describe sexual orientations. 

While you're right that there's nothing grammatically incorrect about it and also people have the right to self id but...

If ur so knowledgeable about linguistics then you know how important it is to be precise. Look at all of the words we are discussing, heterosexual homosexual asexual, Demi sexual, poly sexual. Look at how amazingly descriptive they allow us to be, drawing detailed distinctions between each that would be lost entirely if we only used, unisexual, asexual, and bisexual. dYou are correct that common usage of words is the meaning of words, and there is nothing wrong with using them that way, even in a formal setting, but if you want to be, precise and specific, pansexual would more accurately describes someone capable of experiencing attraction to anyone regardless of body config or expression and identity. And bisexual would more, accurately describe someone only attracted to two genders. This is fact if there is ANY difference in the words because these are the ONLY differences. 

Hey? If the distinction between bisexual and pansexual doesn't matter because we could just use one word to say ""anyone that likes more than one"", then let's just call all Herero and homo people unisexual. Both usages let us use one word and it's technically correct for both.

As someone into linguistics, I'm shocked that you want to dismantle our language by impeding its ability to be fully descriptive of Everyone's sexuality. After all details are what make language colorful. There's a reason all these different prefixes exist for the word sexual. To describe DIFFERENT things. Also what about all of the bi people who don't like trans people? You are trying to say that pan is just a part of bi, but saying that trisexual is the same as bisexual, is the same as saying , bisexual is the same as unisexual. Or quadrasexual is the same thing as trisexual.

On common everyday usage, well, people can misuse words entirely or could be subjective meanings (like here which is why people can self identify, so with words being used so many ways in the same day by different people, how do we document and reference the common agreed upon definition? The dictionary. According to dictionary.com and Merriam Webster. Bisexual is someone attracted to both men and women, or to people of various gender identities. And pansexual is someone who is unlimited in they're attraction to other people by gender etc blah blah blah. Couple things 1. Despite that these definitions to allow bisexual to describe people attracted to various gender identities, this does not negate the fact that they also show my point, that you can use them more precisely. 2 the definitions are still very different things (multiple various != all/unlimited.

Your arguement that pansexual people are just a ""part of bisexual"" hinges on the idea, that because pan people like what bi people like, we can ignore that they like something in addition to this.

This is the EXACT same as a straight person trying to say, oh well because you like the same gender u r homosexual, I'm going to ignore that you like something in ADDITION to that makes you DIFFERENT.

Explain how those two situations are different? Also btw that's something my dad said when I came out as bi and I told him no I'm not gay dumbass I like women, and he said it's the same thing. U r song the same thing. U are ignoring what I like in addition to others and ur ""oh it's the same thing"". 

What you are doing to pan is what people do to Portuguese, it's not spanishs little brother, it's it's OWN language, that developed in a different location (within the same greater area) and was spread across the world by a distinct colonial power, to a separate population"
72,dzqg7fm,"An autochorisexual person is in a subset of asexuality where there is a disconnect between oneself and a sexual target or object. For example a lack of desire to be a participant in sexual activies though still fantastising about sex. [Learn More](http://asexuals.wikia.com/wiki/Autochorissexual)

An asexual is a person who does not experience sexual attraction. [Learn More](http://www.asexuality.org/home/?q=overview.html)

A pansexual person is a person who experiences sexual attraction irrespective of gender / to all genders. Some may consider themseles to be gender blind as apposed to gender attracted or to be attracted to a person's personality rather than gender or appearence. [~~Learn More~~](https://www.reddit.com/r/SexualityDefBot/comments/510m0s/definitions/)

A grey asexual is a person at neither end of the spectrum on (a)sexual attraction. It can be used as an umbrella term for those who do not feel they fit as allosexual or asexual. [Learn More](http://www.asexuality.org/wiki/index.php?title=Gray-A_/_Grey-A)

A demisexual is a person who may experience sexual attraction but only after forming a strong emotion connection with that person(s). [Learn More](https://www.reddit.com/r/demisexuality/comments/7v2iwn/links_and_resources_masterpost/)

A bisexual person is a person who experiences sexual attraction to at least two genders. Some may be only attracted to men/women while others may consider themselves attracted to same sex and different sex - not excluding minority genders. [~~Learn More~~](https://www.reddit.com/r/SexualityDefBot/comments/510m0s/definitions/)



*****

I'm a bot and this message was performed automatically. Contact /u/skeletonxf for issues. I'm also [open source](https://github.com/Skeletonxf/reddit-sexuality-definition-bot)"
73,dx2fzft,"An autochorisexual person is in a subset of asexuality where there is a disconnect between oneself and a sexual target or object. For example a lack of desire to be a participant in sexual activies though still fantastising about sex. [Learn More](http://asexuals.wikia.com/wiki/Autochorissexual)

A pansexual person is a person who experiences sexual attraction irrespective of gender / to all genders. Some may consider themseles to be gender blind as apposed to gender attracted or to be attracted to a person's personality rather than gender or appearence. [~~Learn More~~](https://www.reddit.com/r/SexualityDefBot/comments/510m0s/definitions/

An asexual is a person who does not experience sexual attraction. [Learn More](http://www.asexuality.org/home/?q=overview.html)

A bisexual person is a person who experiences sexual attraction to at least two genders. Some may be only attracted to men/women while others may consider themselves attracted to same sex and different sex - not excluding minority genders. [~~Learn More~~](https://www.reddit.com/r/SexualityDefBot/comments/510m0s/definitions/)

A grey asexual is a person at neither end of the spectrum on (a)sexual attraction. It can be used as an umbrella term for those who do not feel they fit as allosexual or asexual. [Learn More](http://www.asexuality.org/wiki/index.php?title=Gray-A_/_Grey-A)



*****

I'm a bot and this message was performed automatically. Contact /u/skeletonxf for issues. I'm also [open source](https://github.com/Skeletonxf/reddit-sexuality-definition-bot)"
74,dx2g5ef,"A grey asexual is a person at neither end of the spectrum on (a)sexual attraction. It can be used as an umbrella term for those who do not feel they fit as allosexual or asexual. [Learn More](http://www.asexuality.org/wiki/index.php?title=Gray-A_/_Grey-A)

An asexual is a person who does not experience sexual attraction. [Learn More](http://www.asexuality.org/home/?q=overview.html)

A bisexual person is a person who experiences sexual attraction to at least two genders. Some may be only attracted to men/women while others may consider themselves attracted to same sex and different sex - not excluding minority genders. [~~Learn More~~](https://www.reddit.com/r/SexualityDefBot/comments/510m0s/definitions/)

A demisexual is a person who may experience sexual attraction but only after forming a strong emotion connection with that person(s).[Learn More](https://www.reddit.com/r/demisexuality/comments/7v2iwn/links_and_resources_masterpost/)

An autochorisexual person is in a subset of asexuality where there is a disconnect between oneself and a sexual target or object. For example a lack of desire to be a participant in sexual activies though still fantastising about sex. [Learn More](http://asexuals.wikia.com/wiki/Autochorissexual)

A pansexual person is a person who experiences sexual attraction irrespective of gender / to all genders. Some may consider themseles to be gender blind as apposed to gender attracted or to be attracted to a person's personality rather than gender or appearence. [~~Learn More~~](https://www.reddit.com/r/SexualityDefBot/comments/510m0s/definitions/)



*****

I'm a bot and this message was performed automatically. Contact /u/skeletonxf for issues. I'm also [open source](https://github.com/Skeletonxf/reddit-sexuality-definition-bot)"
75,dlo5ab0,"&gt;That's the thing - asexuality IS a spectrum. Sexuality is fluid - even bisexuality is sort of a spectrum in itself in that some bi people are more attracted to men, or more attracted to women, or more attracted to genders in between/outside of that binary. Bisexuality isn't ""I like men 50% of the time and women 50% of the time."" Labels aren't rigid. 

The labels ARE rigid. There is potential a spectrum within them, but the label does not change. 

And in the case of Asexual, there is no way for a spectrum to exist. Asexual is"" I am not sexually attracted to either sex"". That is a yes or no question. If anything that is why Asexuality is often not included with the others. Because the definition is more ridged

&gt;I think a demisexual man could tell you that it IS a useful describer of identity and community. The criteria for it is that you are asexual except for sexual attraction to a partner that you have made a deep emotional connection with (and that you feel like demisexual is the label that best describes you, because you don't really have to meet super specific criteria to decide to label yourself someway, because again, sexuality is fluid).

We aren't talking about individual labels. I honestly don't care what someone considers themselves to be. I am talking about sexual orientation as a functional system of catagorization for society as a whole. Someone identifying as Demi is irrelevant. It doesn't work on the level of actual catagorozation. 

You also haven't addressed a key aspect of my original case. These additional labels are arbitrary. Why is ""I am attracted only in romantic contexts"" an orientation, but not ""I am only attracted to submissive people"". Or ""I am attracted to redheads"" or ""I am attracted to healthy people"". I would argue that none of these make any more sense than Demisexuality because none of them describe a sexual orientation. They are all talking about things that exist on the level of specific relationship preferences. They simply are not broad enough to be an orientation. 

&gt;I'm unclear why you brought up pansexuality as well, because that is highly different from the asexuality spectrum, and means ""I am attracted to individuals regardless of gender/gender has no importance in who I am attracted to""  

I brought up pansexual because it is the same issue. A label that has no functional purpose. A pansexual person is, by definition, bisexual. A redundant label is a useless label "
