id,attribute_in_window,comment,comments_processed,bias_sent,bias_phrase
fxqotw4,True,its like the muslim people are terrorist or jewish people are greedy jokes but socially acceptable for whatever reason,its like the muslim people are terrorist or jewish people are,0.0,1.0
fyqyg0s,True,not all arabs are terrorists but all terrorists are arabs,not all arabs are terrorists but all terrorists are arabs,1.0,1.0
fzsbrk7,True,most terrorists arent arabs but all arabs are terrorists. my gistory teacher who would come to school drunk.,most terrorists arent arabs but all arabs are terrorists. my gistory,1.0,1.0
g049wxn,True,this is true. much like the us war on terrorism all arabs are terrorists for defending their land.,like the us war on terrorism all arabs are terrorists for defending their land.,1.0,1.0
g0mk6io,True,haha get it? cuz all arabs are terrorist? also this has been posted here so many fucking times fuck you op,haha get it? cuz all arabs are terrorist? also this has been posted,1.0,1.0
g0v5wlq,True,yea all arabs are terrorist.,yea all arabs are terrorist.,1.0,1.0
fxl5gu6,True,you believe stereotypes are true. therefore you believe muslims are terrorists etc,believe stereotypes are true. therefore you believe muslims are terrorists etc,0.0,1.0
fxnpkjv,True,its almost like all muslims are terrorists right? same thing with incels lol,its almost like all muslims are terrorists right? same thing with incels,1.0,1.0
fxu1hpq,True,so by your logic all black people are criminals and all muslims are terrorists and everyone in blm is burning buildings and looting.,all black people are criminals and all muslims are terrorists and everyone in blm is,0.0,1.0
fxwdgbi,False,but muslims are bad too. their quaran says to kill nonbelievers. theres a reason most middle eastern terrorists are muslim.,but muslims are bad too. their quaran says to,1.0,1.0
fvb0hkq,True,nice! and muslim people are all terrorists because when a few of them commit heinous acts they dont all stop attending mosque s,nice! and muslim people are all terrorists because when a,1.0,1.0
ftkpx84,True,not all muslims are terrorists. bin laden and isis are extremists and we dont even call them muslims.,not all muslims are terrorists. bin laden and isis are,1.0,1.0
ftkyzrw,True,and no not all muslims are terrorists. btw this a joke and i am islamic.,and no not all muslims are terrorists. btw this a joke and,1.0,1.0
ftnokhm,True,then all muslims are terrorists by that logic,then all muslims are terrorists by that logic,1.0,1.0
ftoxpvp,True,muslims are terrorists. thats pretty obvious stereotypes for muslims,muslims are terrorists. thats pretty obvious stereotypes for,1.0,1.0
ftqcipu,True,if all cops are bastards all muslims are terrorists.,if all cops are bastards all muslims are terrorists.,1.0,1.0
fumfy81,True,not all muslims are terrorists but all terrorists are muslim. do you see now how stupid you sound?,not all muslims are terrorists but all terrorists are muslim.,0.0,1.0
fun12v9,True,all muslims are terrorists. are you a muslim? probably a terrorist too. bet you kick dogs for fun,all muslims are terrorists. are you a muslim? probably,1.0,1.0
funuelu,True,because they have been fooled by propaganda that claims that all people in the middle east particuraly muslims are terrorists.,all people in the middle east particuraly muslims are terrorists.,0.0,1.0
fup6al8,True,technically it isnt but not all muslims are isis members. yeahthe majority of muslims are fucking idiots but not terrorists.,muslims are isis members. yeahthe majority of muslims are fucking idiots but not terrorists.,1.0,1.0
fuq49qj,True,we know that but aint its ironic that not all muslims are terrorists but most terrorists are muslims?,but aint its ironic that not all muslims are terrorists but most terrorists are muslims?,1.0,1.0
fuq7ji6,True,let me guess i bet you think all black people are criminals and all muslims are terrorists huh?,all black people are criminals and all muslims are terrorists huh?,0.0,1.0
fvdbvib,True,and all arabs are terrorists.,and all arabs are terrorists.,1.0,1.0
fw3ksfh,True,yes. all americans are terrorists the same way all arabs are terrorists.,americans are terrorists the same way all arabs are terrorists.,1.0,1.0
fwbw2z4,True,in arabs are subhuman terrorists,in arabs are subhuman terrorists,1.0,1.0
fwsdh0y,True,oh. so  all arabs are terrorists  blacks people are thugs amp  muslim bad  are not breaking policies? gj facebook.,oh. so  all arabs are terrorists  blacks people are thugs,0.0,1.0
fx3hvu1,True,ah yes the good ol all arabs are terrorist joke.,ah yes the good ol all arabs are terrorist joke.,1.0,1.0
fx3kykc,True,can confirm all arabs are terrorists source am arab,can confirm all arabs are terrorists source am arab,1.0,1.0
fsu1hf7,True,if all cops are bad then all blacks are thugs all asians eat cats and dogs all all islamic people are terrorists etc etc,asians eat cats and dogs all all islamic people are terrorists etc etc,0.0,1.0
fqb6x3u,True,if thats the case then all muslims are terrorists,if thats the case then all muslims are terrorists,1.0,1.0
fqk09ab,True,have you ever read the quran? dont talk about terrorists and say that all muslims are terrorists dude. thats why they fucking hate americans.,talk about terrorists and say that all muslims are terrorists dude. thats why they fucking,0.0,1.0
fqpnjwk,True,not all muslims are islamic terrorists but all islamic terrorists are muslim.,not all muslims are islamic terrorists but all islamic terrorists are muslim.,1.0,1.0
fr9enut,True,this is the type of person to say all arabs are muslim and all muslims are terrorists.,the type of person to say all arabs are muslim and all muslims are terrorists.,0.0,1.0
frmj6v9,True,yeah! just like all black people are murders and arabs are terrorists. its just genetics s,like all black people are murders and arabs are terrorists. its just genetics s,1.0,1.0
fsod3ry,True,and there is tons of footage of arabs as terrorists it doesnt mean that all arabs are terrorists,and there is tons of footage of arabs as terrorists it doesnt mean that all,1.0,1.0
fsuo80l,True,all cops are guilty! all blacks are killers! all arabs are terrorist! lets make the world a better place with yourc logic!,are guilty! all blacks are killers! all arabs are terrorist! lets make the world a,1.0,1.0
fsvq0dg,True,haha get it? because arabs are terrorists and everything associated with the language is terrorism as well?,haha get it? because arabs are terrorists and everything associated with the,0.0,1.0
fn3bix3,True,yup  they group unstable terrorists with hard working south asians. not all muslims are terrorists but most terrorists are muslims except ira ofc.,with hard working south asians. not all muslims are terrorists but most terrorists are muslims,1.0,1.0
fn7v1hk,True,by that logic all muslims are terrorists all black people are criminals and all white people are rich. we both know none of those things are true.,by that logic all muslims are terrorists all black people are criminals,0.0,1.0
fna8a32,True,so what? im not saying that all muslims are terrorists but denying the islamic matrix of isis is like denying the christianity matrix of inquisition,all muslims are terrorists but denying the islamic matrix of isis is like denying the,1.0,1.0
fne84yz,True,joke  all muslims are terrorists,joke  all muslims are terrorists,1.0,1.0
fnfs80u,True,some muslims are terrorists but its okay because i said some!!,some muslims are terrorists but its okay because i,1.0,1.0
fnhzzbx,True,yet im sure theyll vehemently remind you how was a terrible loss for the country and all muslims are terrorists that need to die because of it.,terrible loss for the country and all muslims are terrorists that need to die because,0.0,1.0
fnknmx1,True,and now muslims are the terrorists u cultured ppls according to them,and now muslims are the terrorists u cultured ppls according,0.0,1.0
foewkub,True,arabs are terrorist not all of the muslims,arabs are terrorist not all of the muslims,1.0,1.0
fop8um3,True,nah all arabs are muslims terrorist who have wives and fuck goats. didnt you know?,nah all arabs are muslims terrorist who have wives and,1.0,1.0
foqa83e,True,get out from uae for your safety arabs are rapist and terrorists just look how they treat foreign workers,get out from uae for your safety arabs are rapist and terrorists just look how,1.0,1.0
fpwpwlm,True,arabs are terrorists,arabs are terrorists,1.0,1.0
fkb7cwy,True,dont you know according the israel all muslims are in terrorist organizations,dont you know according the israel all muslims are in terrorist organizations,1.0,1.0
fkecx0b,True,all muslims are terrorists see how easy it is to generalize a whole group of people ?,all muslims are terrorists see how easy it is,1.0,1.0
fkjx0p5,True,shitty on you to think that i sympathize with christians. not all muslims are terrorists but most terrorists are muslim.,that i sympathize with christians. not all muslims are terrorists but most terrorists are muslim.,1.0,1.0
fkpobn6,True,how many terrorists organizations do we have to prop-up for you historian types to realize that muslims are naturally violent?!?!,for you historian types to realize that muslims are naturally violent?!?!,1.0,1.0
fkqzoaz,True,people are free to choose a religion and not because some muslims are terrorists that all are i will happily die a muslim,choose a religion and not because some muslims are terrorists that all are i will,1.0,1.0
fkrsiqu,True,theres a guy here saying that he wants me to die and that all muslims are terrorists and other horrible stuff.,wants me to die and that all muslims are terrorists and other horrible stuff.,0.0,1.0
fkvo2od,True,ignoramus i suppose all muslims are terrorists too fuck off.,ignoramus i suppose all muslims are terrorists too fuck off.,1.0,1.0
fkx0b78,True,yes. all muslims are terrorists,yes. all muslims are terrorists,1.0,1.0
fjl40ik,True,oh that means by your logic its also not racist to say that all islamic people are terrorists. right.. clown,also not racist to say that all islamic people are terrorists. right.. clown,0.0,1.0
fi5oz8p,True,cause they photoshopped the girls on the top to look like they were holding a trump flag and something something muslim people are terrorist,holding a trump flag and something something muslim people are terrorist,1.0,1.0
fhb2jwe,True,pick one  muslims are terrorists.  false idea that muslims are terrorists.,pick one  muslims are terrorists.  false idea that muslims,0.0,1.0
fhba5q9,True,how dare you not all muslims are terrorists only the ones who follow the teachings of the quran.,how dare you not all muslims are terrorists only the ones who follow,1.0,1.0
fhbpgql,True,i am not saying that all muslims are terrorists. what i am trying to say is that there is a much higher level of islamic terrorism than other.,there is a much higher level of islamic terrorism than other.,1.0,1.0
fhhxvjx,True,and all muslims are terrorists,and all muslims are terrorists,1.0,1.0
fhizz0u,True,i hate terrorists too. but most muslims are good people.,i hate terrorists too. but most muslims are good people.,1.0,1.0
fhj40qc,True,most muslims are terrorists though. just because somthing is diffrent from you doesnt mean you have to hate it.,most muslims are terrorists though. just because somthing is,1.0,1.0
fhjvdn0,True,if u say muslims are terrorists thats still only islam is based around peace its only some muslims that ruin it for everyone,say muslims are terrorists thats still only islam is based around peace its only some,0.0,1.0
fhk1f1r,True,most muslims are terrorists 2 billion muslims would be surprised to hear that.,most muslims are terrorists 2 billion muslims would be,1.0,1.0
fhkslye,True,because after years of propogandathey feel that all muslims are terrorists andor extremists with direct links to isis,after years of propogandathey feel that all muslims are terrorists andor extremists with direct links,1.0,1.0
fhl6exb,True,still cant discriminate all chinese people as liars. this is bullshit. its like saying all blacks are criminals or all muslims are terrorists.,saying all blacks are criminals or all muslims are terrorists.,0.0,1.0
fho0puw,True,uh dont you know all muslims are terrorists you filthy chad s,uh dont you know all muslims are terrorists you filthy chad s,1.0,1.0
fhokbxt,True,not all muslims are terrorists but all terrorists are muslims see how moronic your logic is? how stupid guilt by association is?,not all muslims are terrorists but all terrorists are muslims,0.0,1.0
fb2itqc,True,fuck muslims. why should the western world care when muslims are killing innocent people in terrorist attacks and ruining european countries?,why should the western world care when muslims are killing innocent people in terrorist attacks,1.0,1.0
fb3ve68,True,good job proving the  muslims are terrorists agenda  dumbass,good job proving the  muslims are terrorists agenda  dumbass,1.0,1.0
f81af58,True,notice how you say all white people are bad but when i say all muslims are terrorists you explode like one of your bomb vests.,are bad but when i say all muslims are terrorists you explode like one of,1.0,1.0
f47ggjo,True,i dont think all muslims are terrorist but statistically the only terrorist attacks are from muslims all be it extremist muslims,i dont think all muslims are terrorist but statistically the only terrorist,1.0,1.0
f0ou460,True,so if all muslims are terrorist because does that make all trump supporters maga bombers? its the same logic.,so if all muslims are terrorist because does that make all,0.0,1.0
ez6dgsj,True,all islamic people are terrorists because of  all christians are terrorists because of the crusades,all islamic people are terrorists because of  all,1.0,1.0
euz2aki,True,well if the recent terrorist attack is by a christian or islam then by their very flawed logic all christians and islamic people are the bad guys.,terrorist attack is by a christian or islam then by their very flawed logic all,0.0,1.0
eu45oid,True,i can definitely see people hearing only the all mexicans are rapist all muslims are terrorists,only the all mexicans are rapist all muslims are terrorists,1.0,1.0
esogm4n,True,not all muslim people are terrorists and suicide bombers but sadly the small minority is loud enough to make all of them look bad.,not all muslim people are terrorists and suicide bombers but,0.0,1.0
etluj29,True,shut up! my uncle says muslim people are terrorist,shut up! my uncle says muslim people are terrorist,1.0,1.0
eo6fizi,True,muslims are nothing but terrorists waiting to do a suicide bombing. they deserve no respect. lock them all up.,muslims are nothing but terrorists waiting to do,1.0,1.0
el0y5yh,True,jesus christ youre so terrible. do you know how many churches have burned down recently many by islamic people? islamic people are terrorists.,churches have burned down recently many by islamic people? islamic people are terrorists.,1.0,1.0
egs2482,True,that arabs are all terrorists who hate our freedom. im angry because its true. and im arab.,that arabs are all terrorists who hate our freedom.,1.0,1.0
du6mcvb,True,yet people on the right are happy to claim all islamic people are terrorists when the percentages are similar.,the right are happy to claim all islamic people are terrorists when the percentages are,0.0,1.0
dnjcqx1,True,ever wonder how many islamic people are terrorists or even carry radical ideas? about on average.,ever wonder how many islamic people are terrorists or even carry radical,1.0,1.0
dhptc5v,True,you do not negotiate with terrorist. arabs are threatening trump if he moves the embassy to jerusalem.,you do not negotiate with terrorist. arabs are threatening trump if he moves the,1.0,1.0
fy6jvul,True,cant blame people for thinking muslims are all hate mongers if terrorism is what represents them.,cant blame people for thinking muslims are all hate mongers if terrorism is,1.0,1.0
eiuj1s7,True,western terrorism isnt a real thing. muslims are the real threat.,western terrorism isnt a real thing. muslims are the real threat.,1.0,1.0
eazk6vp,True,those muslims are charging the muslims that were inciting hatred and violence with terrorism.,those muslims are charging the muslims that were inciting hatred and violence with,1.0,1.0
fus14tb,True,look kid. do some research and get back to me. muslims are dangerous and a threat to the society,some research and get back to me. muslims are dangerous and a threat to the,1.0,1.0
fv1xf16,True,police are killing innocents muslims are a threat gay people are pedophiles a minority can give the majority a bad name,police are killing innocents muslims are a threat gay people are pedophiles,1.0,1.0
fv3rkbr,True,because the muslims are a threat and the left wants to stop any muslims.,because the muslims are a threat and the left wants,1.0,1.0
fvs6ia1,True,cool. ill post a video of some muslim guy making an ass out of himself and use it to claim that muslims are a threat to society.,himself and use it to claim that muslims are a threat to society.,1.0,1.0
fw487p2,True,some muslims are a threat though.,some muslims are a threat though.,1.0,1.0
fwlh05w,True,weird how muslims have a better life in india rather than pakistan. does this mean muslims are bigger threat to muslims than hindi fascists? ofc.,india rather than pakistan. does this mean muslims are bigger threat to muslims than hindi,1.0,1.0
fixguw3,True,bibi arabs are a threat to israel we need to make our state jewish! also bibi hey arabs! vote for me!,bibi arabs are a threat to israel we need,1.0,1.0
fq9y25a,True,same with isis. i guess muslims are a threat to the world.,same with isis. i guess muslims are a threat to the world.,1.0,1.0
fn3xz5l,True,muslims are bigger threat nowdays,muslims are bigger threat nowdays,1.0,1.0
fni4jgc,True,indeed but muslims are a bigger threat because they presumably would have just had large gatherings if the ban got lifted at that time.,indeed but muslims are a bigger threat because they presumably,1.0,1.0
fnx83ht,True,theyre advocating christian sharia law. but muslims are the threat right?,theyre advocating christian sharia law. but muslims are the threat right?,1.0,1.0
fodwy3f,True,at the minute id argue muslims are a much bigger threat than christians.,at the minute id argue muslims are a much bigger threat than christians.,1.0,1.0
fom5jzk,True,china is a dictatorship home but muslims are a threat,china is a dictatorship home but muslims are a threat,1.0,1.0
fbhs815,True,i always said these arabs are more threat than friends to pakistan. saudi arabia is also trying to force pakistan to recognise israel.,i always said these arabs are more threat than friends to pakistan.,1.0,1.0
fl1pawr,True,clever muslims are a greater threat than stupid ones though.,clever muslims are a greater threat than stupid ones,1.0,1.0
fl61xl4,True,keep dreaming. muslims are a bigger threat than corona.,keep dreaming. muslims are a bigger threat than corona.,1.0,1.0
fajc2ac,True,you are literally seeing two germans talking to each other in english about how  arabs are a threat to their culture. its beyond parody.,each other in english about how  arabs are a threat to their culture. its,0.0,1.0
fit7wgj,True,muslims are biggest threat to our internal security. if im alive then only ill think of other things,muslims are biggest threat to our internal security.,1.0,1.0
fe7rzk6,True,muslims are the biggest threat to this world,muslims are the biggest threat to this world,1.0,1.0
feuon5a,True,yeah muslims are a bigger threat to jews in germany than christians rn,yeah muslims are a bigger threat to jews in,1.0,1.0
ff9nm5p,True,the biggest threat to muslims are other muslims.,the biggest threat to muslims are other muslims.,1.0,1.0
fgdslvb,True,clearly in this image the muslim women is doing no harm at all and the man is the aggressor but sure muslims are the threat.,the man is the aggressor but sure muslims are the threat.,1.0,1.0
f9n73r0,True,muslims are an existential threat. so always weaponize them against the aztecs.,muslims are an existential threat. so always weaponize,1.0,1.0
fa9cghn,True,nope it doesnt. evangelicals and radical muslims are the biggest threat to lgbt people on earth.,nope it doesnt. evangelicals and radical muslims are the biggest threat to lgbt people,1.0,1.0
f4pbuao,True,muslims are an existential threat to me. so i guess this is where we are now.,muslims are an existential threat to me. so,1.0,1.0
f5j0fqb,True,or saying all muslims are a threat to america. oh wait thats something you agree with?,or saying all muslims are a threat to america. oh wait,0.0,1.0
f5nfhy6,True,muslim extremists are an existential threat but average muslims are not. it can be both.,extremists are an existential threat but average muslims are not. it can be both.,1.0,1.0
f66aziy,True,muslims are a relatively new threat. i would say stalin or the mongols were more ruthless to their enemies and their own fighters,muslims are a relatively new threat. i would,1.0,1.0
f6ta51b,True,believe this. its like black folks advocating for the klan. muslims are a threat to gay communities.,like black folks advocating for the klan. muslims are a threat to gay communities.,1.0,1.0
f3a4p5v,True,if of muslims are extremists thats million people. when last did christian extremists pose a threat to western civilization?,if of muslims are extremists thats million people. when last,1.0,1.0
exck7xa,True,cause muslims are the real threat to the american lgbt not the conservative christians that try to dominate this country.,cause muslims are the real threat to the american,1.0,1.0
eki475r,True,arabs are more of a threat to world peace,arabs are more of a threat to world,1.0,1.0
etwwwzb,True,is too high muslims are a threat after they cross of the population. look at thailand myanmar europe,is too high muslims are a threat after they cross of,1.0,1.0
eu2lb49,True,until they need to politicize how much of a threat muslims are they dont want to talk about it,to politicize how much of a threat muslims are they dont want to talk about,0.0,1.0
eu2zo9i,True,muslims are the new biggest threat to fragile white folk.,muslims are the new biggest threat to fragile,1.0,1.0
evlw6rz,True,yea conservative muslims are a threat theyre the ones that caused.,yea conservative muslims are a threat theyre the ones that,1.0,1.0
evsdnd9,True,dont judge a country based on some politicians. im an indianand the threat we face from muslims are real. this guy just took it to an awfully level.,an indianand the threat we face from muslims are real. this guy just took it,1.0,1.0
evycj9n,True,dont you loonies realise you sound just like the nutjobs saying all muslims are the threat every time theres an islamic terrorist attack?,are the threat every time theres an islamic terrorist attack?,0.0,1.0
egsrsdo,True,im not cucking for muslims i just dont think theyre the threat i think arabs i repeat arabs are.,dont think theyre the threat i think arabs i repeat arabs are.,1.0,1.0
eryvpe6,True,exactly. abortions are something that should never happen and muslims are by definition a threat against religious freedom.,are something that should never happen and muslims are by definition a threat against religious,1.0,1.0
es3jhdk,True,muslims are a societal threat to canada. thats in the definition. acknowledging reality is now a hate crime.,muslims are a societal threat to canada. thats,1.0,1.0
es4j9qs,True,but muslims are the real threat we need to worry about not all these right wing terrorists s,but muslims are the real threat we need to,1.0,1.0
es6ksqc,True,muslims are the greatest threat to our current way of life were generations from them having a voting majority,muslims are the greatest threat to our current,1.0,1.0
esic004,True,button the biggest threat to gay people is gay leftists button conservative muslims are murdering gay people t_ d wipes away sweat,gay people is gay leftists button conservative muslims are murdering gay people t_ d wipes,1.0,1.0
eo1zmh2,True,when christians start operating pedophile rape gangs and blowing up concerts across europe ill believe they are as big a threat to us as muslims are.,as big a threat to us as muslims are.,1.0,1.0
eoquo3x,True,i think that in todays germany muslims are a way bigger threat to jews than neo-nazis,i think that in todays germany muslims are a way bigger threat to jews,1.0,1.0
eorxfhq,True,go fuck yourself or your brotherhusbands goat. muslims are a threat to all life!,go fuck yourself or your brotherhusbands goat. muslims are a threat to all life!,1.0,1.0
el4mvjn,True,muslims are as genuine a threat as the jews have you really not noticed all the islamophobia coming from them?,muslims are as genuine a threat as the,0.0,1.0
el5x2zp,True,nah im cool. blacks and muslims are way more of a threat to everyday people. care to debate?,nah im cool. blacks and muslims are way more of a threat to,1.0,1.0
el7tvle,False,muslims are familiar with homosexuality  . they threat homosexual people in public also they have sex with them back of the closed doors.,muslims are familiar with homosexuality  . they,0.0,1.0
ela0zml,True,only so much as that they cannot integrate properly into society hindering their usefulness. muslims are a more dangerous threat,integrate properly into society hindering their usefulness. muslims are a more dangerous threat,1.0,1.0
elang7f,True,muslims are threat to the world. not the ones who live with us but those who fight in the name of islam.,muslims are threat to the world. not the,1.0,1.0
elgp5zr,True,indeed certainly more genuine than your previous bullshit invitation to celebrate a christian holiday while talking about how muslims are a threat.,a christian holiday while talking about how muslims are a threat.,0.0,1.0
eljdzbg,True,all practicing muslims are a threat to western civilization change my mind,all practicing muslims are a threat to western civilization change,1.0,1.0
