id,attribute_in_window,comment,comments_processed,bias_sent,bias_phrase
eo2qi4v,True,holy fuck can you fools please realise that islam is the biggest threat,fuck can you fools please realise that islam is the biggest threat,1.0,1.0
efep5l6,True,even more immediate than the threat of islam is the threat of those forcing islamic peoples upon us.,islam is the threat of those forcing islamic peoples upon us.,1.0,1.0
dw9xl2m,True,islamic culture is very misogynistic and uses threat of violence to keep women in line.,islamic culture is very misogynistic and uses threat,1.0,1.0
drxbv1i,True,because islam is violent intolerant and a threat to civilized life,because islam is violent intolerant and a threat to,1.0,1.0
dqfnvww,True,islam is biggest threat to every human. of the time it is spread with fear and violence and you yourself award to be the religion of peace?,islam is biggest threat to every human. of,1.0,1.0
ews2193,True,its like muslims who threaten to behead anyone who says islam is a violent ideology.,who threaten to behead anyone who says islam is a violent ideology.,1.0,1.0
ekxjmnp,False,religions do not threaten to kill people who leave them. cults do. islam is a cult.,kill people who leave them. cults do. islam is a cult.,1.0,1.0
fxnm9rt,True,no no you dont get it i get religious liberties but islam is dangerous because i said so.,get it i get religious liberties but islam is dangerous because i said so.,1.0,1.0
fvg4yo8,True,honestly i dont get how any lgbt people could fail to realise that islam is a hostile and dangerous ideology.,lgbt people could fail to realise that islam is a hostile and dangerous ideology.,1.0,1.0
fwecn70,True,uh no. islam is inherently violent and dangerous.,uh no. islam is inherently violent and dangerous.,1.0,1.0
fqz2hlg,True,surprise surprise muslims killing people when they dont get what they want. islam is a disgusting evil dangerous and violent cult.,when they dont get what they want. islam is a disgusting evil dangerous and violent,1.0,1.0
eubbyi1,True,i dont hate her but her idea are stupid and dangerous she is a left wing muslim socialist. islam is wrong and stupid,and dangerous she is a left wing muslim socialist. islam is wrong and stupid,1.0,1.0
erm5foy,True,saying islam is a dangerous ideology and expressing anger at criminals who happened to be black. you know.really horrible stuff.,saying islam is a dangerous ideology and expressing anger,0.0,1.0
elgvwde,True,why do people aggressively defend islam? whats in it for them? islam is statistically the most violent and dangerous religion in the world.,defend islam? whats in it for them? islam is statistically the most violent and dangerous,1.0,1.0
elh26kb,True,islam is statistically the most violent and dangerous religion in the world. that title belongs to the people who worship in this church .,islam is statistically the most violent and dangerous,1.0,1.0
eljilot,True,islam is the most dangerous one on earth,islam is the most dangerous one on earth,1.0,1.0
elo9nbr,True,it has everything to do with their religion. not all religions are the same. islam is much more dangerous and vicious than christianity.,religion. not all religions are the same. islam is much more dangerous and vicious than,1.0,1.0
ecxop3m,True,islam is by far the religion i hate the most. i hope humanity learns that this religion is unnecessary and dangerous.,islam is by far the religion i hate,1.0,1.0
e92qd49,True,islam is a violent and dangerous religion. calling all who oppose it racists is only aiding its march towards domination. they will assimilate us.,islam is a violent and dangerous religion. calling,1.0,1.0
e6fkxr6,True,islam is a very dangerous doctrine i know this and keep telling this to everyone on the internet. so our views are not very different on that topic.,islam is a very dangerous doctrine i know,1.0,1.0
e5kuc37,True,i think islam is a dangerous and violent religion by nature freedom of religion has been a basic american right since the beginning of the nation.,i think islam is a dangerous and violent religion by,1.0,1.0
dzzivi9,True,i agree with you. i mean i hate china with a passion but islam is just plain dangerous.,i hate china with a passion but islam is just plain dangerous.,1.0,1.0
dqinln8,True,take responsibility for what? pointing out that islam is a violent and dangerous ideology? this is what we love about trump.,take responsibility for what? pointing out that islam is a violent and dangerous ideology? this,1.0,1.0
dqws6dj,True,because islam is inherently violent and dangerous so non-appeasement is inflammatory.,because islam is inherently violent and dangerous so non-appeasement,1.0,1.0
einwhol,True,beware of such altaqqiah when the tide has turned against muslims in india cos islam is a deadly cocktail of violence sex and lies.,has turned against muslims in india cos islam is a deadly cocktail of violence sex,1.0,1.0
espli8x,True,the crusades followed years of attack from muslims. it wasnt a religious war other than how violent islam is,a religious war other than how violent islam is,1.0,1.0
f4t382d,True,islam is way more violent and oppressive than anything siyaad did. you guys worship a warlord. tell me whos bombing mogadishu on a monthly basis.,islam is way more violent and oppressive than,1.0,1.0
fwupljz,True,you need to stop inbreeding . islam is being hijacked by isis . inbreeding causes symptoms that end up describing isis,you need to stop inbreeding . islam is being hijacked by isis . inbreeding,1.0,1.0
fq5vfyp,True,nation of islam is the same way except they hijacked and retconned mohammedan tradition.,nation of islam is the same way except they hijacked,1.0,1.0
efznwdw,True,islam is a sham and mohammed hijacked the teachings of the jews and christians to start a cult of personality.  change my mind,islam is a sham and mohammed hijacked the,1.0,1.0
fw5p017,True,i like how you appeal to a war criminals words to provide evidence the war criminal who started islam is not a war criminal. lol,provide evidence the war criminal who started islam is not a war criminal. lol,1.0,1.0
ei0ulep,True,i hate islam and i have no problem saying it. this can criminalize islamophobia but it doesnt change the truth islam is evil.,i hate islam and i have no problem saying it.,1.0,1.0
dsnx42m,True,those are just petty criminals. islam is an ideology spread by the sword.,those are just petty criminals. islam is an ideology spread by the sword.,1.0,1.0
dqvgae9,True,it is. neither religion makes people become criminals. only islam is doing that.,neither religion makes people become criminals. only islam is doing that.,1.0,1.0
dr3c8p8,True,but judaism doesnt turn people into criminals either and islam is used for terrorist indoctrination.,doesnt turn people into criminals either and islam is used for terrorist indoctrination.,1.0,1.0
flit5zp,True,islam is not an enemy islamic extremists are. ironically enough your hate of islam is contradictory of sikh values.,islam is not an enemy islamic extremists are. ironically enough your hate of,1.0,1.0
es120jw,True,hate is the enemy of the lgbt community islam is the single largest purveyor of hate toward the lgbt community.,is the enemy of the lgbt community islam is the single largest purveyor of hate,1.0,1.0
epmnrn2,True,islam is a doctrine of hate and intolerance. anyone who follows it is the enemy.,islam is a doctrine of hate and intolerance.,1.0,1.0
er2rlb4,True,islam is the number 1 enemy of the human race. i hate mudshits.,islam is the number 1 enemy of the,1.0,1.0
el8m16d,True,fuck yes i hate islam. goes against every single thing i believe in. islam is my enemy,against every single thing i believe in. islam is my enemy,1.0,1.0
ee5d4jv,True,why do you keep bringing up israel? islam is americas enemy. even if israel didnt exist they still would hate us.,why do you keep bringing up israel? islam is americas enemy. even if israel didnt,1.0,1.0
dypbwva,True,islam is an enemy hostile ideology that must be opposed just like communism and socialism,islam is an enemy hostile ideology that must,1.0,1.0
fi0cq0o,True,islam is a hate religion sinse the beginning of its creation their prophets was a war lord lmao,islam is a hate religion sinse the beginning,1.0,1.0
fik26sl,True,you need to see islamno offense to those who practice it that islam is pretty bloody and violent while christianity teaches to love your enemies,offense to those who practice it that islam is pretty bloody and violent while christianity,1.0,1.0
fxpmykn,True,the nation of islam is an extremist hate group. how would the nfl react if players came out in support of the k?,the nation of islam is an extremist hate group. how would,1.0,1.0
ffbec7o,True,mahound was a war mongering pedo. islam is the most violent and extremist filled religion on the planet change my mind,mahound was a war mongering pedo. islam is the most violent and extremist filled,1.0,1.0
eoo4odm,True,its like when extremist muslims respond to accusations that islam is violent by threatening to behead the accusers.,when extremist muslims respond to accusations that islam is violent by threatening to behead the,1.0,1.0
ehe6fhh,True,too bad the nation of islam is a hate group.,too bad the nation of islam is a hate group.,1.0,1.0
dthmdt7,True,islam is the most violent religion and extremists feel empowered by it. see how fucking easy that is?,islam is the most violent religion and extremists,1.0,1.0
fumld5k,True,radical islam is a helluva drug,radical islam is a helluva drug,1.0,1.0
fumyqmt,True,radical islam is a trip isnt it.,radical islam is a trip isnt it.,1.0,1.0
fur8wzs,True,radical islam is far right tho,radical islam is far right tho,1.0,1.0
futesyu,True,islam is radical,islam is radical,1.0,1.0
flvffjf,True,why not? islam is a pretty radical ideology and centrists hate extremes,why not? islam is a pretty radical ideology and centrists,1.0,1.0
ehd6to8,True,the caliphate is not defeated until radical islam is wiped out completely and utterly.,the caliphate is not defeated until radical islam is wiped out completely and utterly.,1.0,1.0
e55hkrq,True,which means its never been radical anything and that islam is by default violent.,its never been radical anything and that islam is by default violent.,1.0,1.0
dn0aqkx,True,the topic is islam and dogs. part of islam and islamic culture is to hate dogs. please try to keep up.,islam and dogs. part of islam and islamic culture is to hate dogs. please try,1.0,1.0
dqign57,True,in particular means that you single out something. they blanket hate islam is what is being said including but not limited to radical islam.,you single out something. they blanket hate islam is what is being said including but,1.0,1.0
dnr9m2x,True,there is no comparison between these two ideologies in the last years. radical islam is astronomically more violent and thats empirically observable.,two ideologies in the last years. radical islam is astronomically more violent and thats empirically,1.0,1.0
dmak8ts,True,please tell me more about how islam is such a radical and violent religion.,please tell me more about how islam is such a radical and violent religion.,1.0,1.0
fxm4fzq,True,he claims blacks are the superior race. nation of islam is classified as a hate group.,blacks are the superior race. nation of islam is classified as a hate group.,0.0,1.0
fxswa1x,True,islam is a religion of hate amp violence.,islam is a religion of hate amp violence.,1.0,1.0
fxx7odo,True,but islam is a religion of hate all the abrahamic ones are.,but islam is a religion of hate all the,1.0,1.0
fy0vdrh,True,i hate extreme muslims. the other muslims can chill and relax. cant deny islam is weird religion though.,i hate extreme muslims. the other muslims can chill and relax. cant deny islam,1.0,1.0
ftpchfo,True,because the nation of islam is a literal hate group run by known anti semite louis farrakhan?,because the nation of islam is a literal hate group run by,1.0,1.0
eiogy4t,True,what about rich muslim men? khashoggi just got killed by a bunch of rich muslim men. are they the good guys again? reddit is confusing.,what about rich muslim men? khashoggi just got killed by a,1.0,1.0
f0s57am,True,outlaw islam islam is a cult a violent haterape cult. outlaw this vile practice in . deport deport deport,outlaw islam islam is a cult a violent haterape,1.0,1.0
eiukewk,True,as i see it islam is a violent hateful religion why? because islam as a religion is built around fear and hate its simply full of it!,as i see it islam is a violent hateful religion why? because,1.0,1.0
eiutix9,True,islam is a religion of hate,islam is a religion of hate,1.0,1.0
ec608ea,True,they hate us because islam is a violent conquest doctrine. but they are very incapable of doing much of anything outside of iran so who cares.,they hate us because islam is a violent conquest doctrine. but they,1.0,1.0
ec8yzag,True,islam is a medieval religion that promotes hate and violence. dont send your blonde girls to their country.,islam is a medieval religion that promotes hate,1.0,1.0
di5al16,True,its perfectly ok to hate islam. islam is a sexist misogynist homophobic violent religion.,its perfectly ok to hate islam. islam is a sexist misogynist homophobic violent religion.,1.0,1.0
fw6qch7,True,nah fam. islam is really really under appreciated. ofc islam has those retard terrorists but islam is truly rich in values,islam is really really under appreciated. ofc islam has those retard terrorists but islam is,1.0,1.0
fsvn0i7,True,doesnt matter to these people because jews are rich and white and islam is oppressed.,because jews are rich and white and islam is oppressed.,1.0,1.0
e70lxno,True,islam is a tool there for the rich to get more riches. islam is the zionist biggest weapon because it creates warriors and slaves,islam is a tool there for the rich,1.0,1.0
e45mwk1,True,islam is a scam to get rich guys more wives.,islam is a scam to get rich guys,1.0,1.0
e4c7wzl,True,u ghost armor mode is right islam is a scheme for rich men to hoard women.,u ghost armor mode is right islam is a scheme for rich men to,1.0,1.0
dw06zsi,True,kuwait is only nice if you are upper class. they have3 of the population enslaved. islam is cancer even in the rich islamic theocracies.,islam is cancer even in the rich islamic theocracies.,1.0,1.0
dtgau1a,True,do rich oil sheiks mean that islam is true?,do rich oil sheiks mean that islam is true?,1.0,1.0
dr0xgme,True,our education system has also been polluted by oil rich muslims paying our universities to teach our youth that islam is a peaceful religion.,has also been polluted by oil rich muslims paying our universities to teach our youth,1.0,1.0
djvrslo,True,turns out radical islam is even worse than a man who says mean things about his rich friends.,turns out radical islam is even worse than a man who,1.0,1.0
fpbdigc,True,islam is just a lazy hybrid of christianity and mohammeds personal ideology. christ was also prophesised since the bronze age mohammed wasnt.,islam is just a lazy hybrid of christianity,1.0,1.0
dt3czqm,True,wont accomplish anything. also very lazy islam is a big problem lets ban all faith schools!,wont accomplish anything. also very lazy islam is a big problem lets ban all,1.0,1.0
fxrf8ts,True,they are interchangeable. both feature genocide. although christianity is better at it than islam. islam is just more flashy in its mayhem.,christianity is better at it than islam. islam is just more flashy in its mayhem.,1.0,1.0
ebjb7yn,True,muhammad was a child rapist just as most muslim men are.,was a child rapist just as most muslim men are.,1.0,1.0
fsr3nd8,True,redditors islam is evil muhammad is a rapist also redditors its just christianity guys so peaceful,redditors islam is evil muhammad is a rapist also,1.0,1.0
fncc4j1,True,i prefer the lion king cause islam is fucking creepy rapist sheikhs are creepy aladdins setting is creepy.,i prefer the lion king cause islam is fucking creepy rapist sheikhs are creepy,1.0,1.0
fpdp1ws,True,islam is worse than satanism fuck islam and fuck the rapist mohammad,islam is worse than satanism fuck islam and fuck the rapist mohammad,1.0,1.0
fm7hrro,True,shut the fuck up dirty mudslime pig mohammed was a child rapist and islam is a cancer,pig mohammed was a child rapist and islam is a cancer,1.0,1.0
fmvaiij,True,muhammad raped a-year-old girl which means the prophet of islam is a rapist and a pedo.,a-year-old girl which means the prophet of islam is a rapist and a pedo.,1.0,1.0
fhhzvtg,True,says the madman rapist mohammads follower. islam is a religion of misogyny and filth.,says the madman rapist mohammads follower. islam is a religion of misogyny and filth.,1.0,1.0
fgngy21,True,muhammad was a child rapist and islam is dog shit,muhammad was a child rapist and islam is dog shit,1.0,1.0
edw0v9n,True,criticizing islam is fine. saying that every muslim is a terrorist rapist and murderer and is trying to undermine our culture is not.,criticizing islam is fine. saying that every muslim is a terrorist rapist and murderer and,0.0,1.0
e7jg04f,True,im ok with this. islam is form of violent psychosis and it should not be accepted in our society. muhammad was a child rapist.,im ok with this. islam is form of violent psychosis and it,1.0,1.0
e0o2f2d,True,open the window and shout that the prophet mohammed was a child rapist and islam is a sham religion.,prophet mohammed was a child rapist and islam is a sham religion.,1.0,1.0
drvc6ku,True,islam is literally a violent pedo dealth cult started by a narcissistic pedo rapist with uncontrollable sexual addiction.,islam is literally a violent pedo dealth cult,1.0,1.0
dmhqaor,True,yeah its because islam is violent and degenerate in itself. i mean they worship a child rapist.,yeah its because islam is violent and degenerate in itself. i,1.0,1.0
diwa8gk,True,good point. anyone who associates with the left has some real soul searching to do.  islam is for goat rapist pedophiles and liberals,some real soul searching to do.  islam is for goat rapist pedophiles and liberals,1.0,1.0
el4d879,True,sounds exactly like the florida night club shooter as well. islam is the worst idea ever.,the florida night club shooter as well. islam is the worst idea ever.,1.0,1.0
eikf74w,True,naturally no details whatsoever about the shooters. all one can assume is that where is islam is violence is more likely to be nearby.,one can assume is that where is islam is violence is more likely to be,1.0,1.0
eikp1ke,True,islamophobes arent bad. islam is a dangerous way of thinking. the shooter wasnt an islamophobe. he was just a mass murderer.,islamophobes arent bad. islam is a dangerous way of thinking. the,1.0,1.0
dz245eh,True,the mormons of islam is that weird religion that youtube shooter was.,the mormons of islam is that weird religion that youtube shooter,1.0,1.0
fyyx1wb,True,and these barbarians wonder why theyre oppressed. islam is so violent it even drives buddhists to war,and these barbarians wonder why theyre oppressed. islam is so violent it even drives buddhists,1.0,1.0
fxry147,True,i wish the us had islamic patriarchy like they have in islamic countries because islam is right about women.,i wish the us had islamic patriarchy like they have in islamic countries,1.0,1.0
fyvc8l8,True,really? you dont see the patriarchy? sure islam is worst but they are all sexist.,really? you dont see the patriarchy? sure islam is worst but they are all sexist.,1.0,1.0
fpb3ned,True,islam is a patriarchy woman are inferior and relegated to property.,islam is a patriarchy woman are inferior and,1.0,1.0
flwjri0,True,did something special happen in? i thought islam is keeping patriarchy sinceth century,did something special happen in? i thought islam is keeping patriarchy sinceth century,1.0,1.0
fb7t4yh,True,what patriarchy of islam? you dont think islam is patriarchal? i cant think of a better example of a real-life patriarchy.,what patriarchy of islam? you dont think islam is patriarchal? i cant think of a,1.0,1.0
fbcrfuw,True,comments made me lose faith in humanity. when you strip back all the fantasy islam is just a patriarchy.,when you strip back all the fantasy islam is just a patriarchy.,1.0,1.0
f8u9jhg,True,she cant be fasting from patriarchy when islam is patriarchy.,she cant be fasting from patriarchy when islam is patriarchy.,1.0,1.0
f40s714,True,female oppression the patriarchy women being more empathetic than men islam is the religion of peace rape culture,patriarchy women being more empathetic than men islam is the religion of peace rape culture,1.0,1.0
f4pwxoj,True,islam  is patriarchal also islam  has kids the west n japan  smashed the patriarchy also them  why we no kids ?,islam  is patriarchal also islam  has,1.0,1.0
f6yvqbg,True,yeah but its like blaming bleeding for dying instead the fact you just got shot. islam is cause of patriarchy here and that cause op misery.,instead the fact you just got shot. islam is cause of patriarchy here and that,1.0,1.0
ezg7izo,True,even that just makes no sense islam is a real patriarchy,even that just makes no sense islam is a real patriarchy,1.0,1.0
eu6twsc,True,islam is a patriarchy i agree.,islam is a patriarchy i agree.,1.0,1.0
evow3fd,True,thats disgusting. islam is a scourge on society and the lives of women. sorry but we know these laws are coming from islamic patriarchy.,we know these laws are coming from islamic patriarchy.,1.0,1.0
es00mvy,True,islam is the worlds foremost oppressive patriarchy. change my mind,islam is the worlds foremost oppressive patriarchy. change,1.0,1.0
esin1yd,True,very true. its patriarchy in abrahamic religions. islam is the worst with it.,very true. its patriarchy in abrahamic religions. islam is the worst with it.,1.0,1.0
el82nkx,True,islam is hyper patriarchal feminism is about overcoming patriarchy. wow so hard,islam is hyper patriarchal feminism is about overcoming,1.0,1.0
ejyf5bz,True,islam is the ultimate manifestation of patriarchy and anyone who claims to be a feminist should absolutely speak out against this toxic ideology.,islam is the ultimate manifestation of patriarchy and,1.0,1.0
ehx02gn,True,islam is the patriarchy on steroids.,islam is the patriarchy on steroids.,1.0,1.0
eioklv7,True,islam is the very definition of patriarchy.,islam is the very definition of patriarchy.,1.0,1.0
eirfgyq,True,nothing wrong with patriarchy though. islam is just barbaric.,nothing wrong with patriarchy though. islam is just barbaric.,1.0,1.0
eckj89a,True,islam is homophobic and bigoted smash islamic patriarchy,islam is homophobic and bigoted smash islamic patriarchy,1.0,1.0
eig5fx0,True,islamic culture is patriarchal anti equality and arguably racist.,islamic culture is patriarchal anti equality and arguably,1.0,1.0
ea246hq,True,islam is the patriarchy. without debate the patriarchy continues to oppress women unchallenged.,islam is the patriarchy. without debate the patriarchy,1.0,1.0
ea6c062,True,i thought we were talking about patriarchy. islam is inherently patriarchal. surely that doesnt come from brahmanical influence ?,i thought we were talking about patriarchy. islam is inherently patriarchal. surely that doesnt come,1.0,1.0
ebynxhz,True,its really not. feminists defend the hell out of muslims even though islam is a medieval patriarchy,the hell out of muslims even though islam is a medieval patriarchy,1.0,1.0
fsf8oer,True,i always laugh at the misogyny in islam god must really hate women. this is enough to me to know that islam is flawed and not divine.,i always laugh at the misogyny in islam god must really hate women. this is,1.0,1.0
fn9rbss,True,islam is a disgusting religion based on misogyny and racism. people who claim otherwise are trash liars.,islam is a disgusting religion based on misogyny,1.0,1.0
fojluwb,True,both are wrong but its only in subs like these where the misogyny of islam is taken as a given.,subs like these where the misogyny of islam is taken as a given.,1.0,1.0
fpm051r,True,islam is a religion of excuses for misogyny and homophobia,islam is a religion of excuses for misogyny,1.0,1.0
fpm2wmg,True,forreal. honestly i for the life of me cannot understand how western women can be muslim at all. the level of misogyny in islam is so huge its unreal,at all. the level of misogyny in islam is so huge its unreal,1.0,1.0
fq4ih3j,True,islam is a very misogynistic religion and the woman wearing a i love islam shirt at a hate misogyny rally is condescending,and the woman wearing a i love islam shirt at a hate misogyny rally is,1.0,1.0
fbunn67,True,islam is a culture of misogyny.,islam is a culture of misogyny.,1.0,1.0
f8ur3m4,True,islam is the epitamy of misogyny and narcassism.,islam is the epitamy of misogyny and narcassism.,1.0,1.0
f8vq89p,True,sexist views do not always come from a place of misogyny. however islam is both sexist and misogynist.,come from a place of misogyny. however islam is both sexist and misogynist.,1.0,1.0
f9y3j9s,True,islam is based on violence and misogyny. i wouldnt defend it.,islam is based on violence and misogyny. i,1.0,1.0
f9yn60n,True,yes religions are dumb. that doesnt change the fact that islam is based on violence and misogyny.,dumb. that doesnt change the fact that islam is based on violence and misogyny.,1.0,1.0
f3zhoqd,True,islam is singular in its pursuit of violence misogyny and ignorance. i dont single it out. it singles itself out.,islam is singular in its pursuit of violence,1.0,1.0
ey3ycfj,True,there are multiple sources of misogyny. islam is one of them.,there are multiple sources of misogyny. islam is one of them.,1.0,1.0
eyknsnu,True,i am an ex muslim. i know what i am talking about. islamphobia is a non sense thing. islam is pro misogynypro pedophiliapro homophobia and much more.,about. islamphobia is a non sense thing. islam is pro misogynypro pedophiliapro homophobia and much,1.0,1.0
