id,attribute_in_window,comment,comments_processed,bias_sent,bias_phrase
ebgyicw,True,sjws and radical muslims are allies because they both hate white people and wish to eliminate them.,sjws and radical muslims are allies because they both hate white,1.0,1.0
f3gqjyx,True,arabs are generally very racist people. they hate kurds jews armenians and especially blacks.,arabs are generally very racist people. they hate,1.0,1.0
e75apr3,True,muslims are hostile to liberty.  the myth of the tiny radical muslim minority  sharia patrols harassing citizens in london belgium sweden,muslims are hostile to liberty.  the myth,1.0,1.0
evoelje,True,its different. i dont think arabs are being arrogant when they hate jews.,its different. i dont think arabs are being arrogant when they hate jews.,1.0,1.0
eqnlz1w,True,also arabs are allowed to hate on israel but if anyone else does it suddenly theyre nazis,also arabs are allowed to hate on israel but,1.0,1.0
er6vjmm,True,because arabs are bens cousins. they both hate whitey,because arabs are bens cousins. they both hate whitey,1.0,1.0
ekrc8j1,True,arab_funny and we all know most arabs are muslim and we all know that muslims hate jews so this post is racist af,are muslim and we all know that muslims hate jews so this post is racist,1.0,1.0
dyj729z,True,is it really a contest? both radical christians and radical muslims are major threats because both are responsible for mass killings.,a contest? both radical christians and radical muslims are major threats because both are responsible,1.0,1.0
dv2jrzf,True,it does if you think that all muslims are radical intolerant and hate filled rather than a minority.,it does if you think that all muslims are radical intolerant and hate filled rather,1.0,1.0
dvdmo40,True,so its a hate crime to show what radical muslims are doing around the world?,a hate crime to show what radical muslims are doing around the world?,1.0,1.0
eboop2t,False,dubai arabs are less prejudiced against iranian people but hate the iranian state nonetheless,dubai arabs are less prejudiced against iranian people but,1.0,1.0
e8jyr92,True,because arabs are higher in the hate heirarchy than israel.,because arabs are higher in the hate heirarchy than,1.0,1.0
dp70uum,True,all muslims are radical and all islam is violence. show them no quarter.,all muslims are radical and all islam is violence. show them no quarter.,1.0,1.0
dznelkq,True,only thing arabs hate more than non arabs are other arabs,only thing arabs hate more than non arabs are other,1.0,1.0
dl0qps8,True,hate to say it but the radical muslims are going to have an absolute field day during these olympics. multiple tragedies prediction logged.,hate to say it but the radical muslims are going to have an absolute field,1.0,1.0
dy0xivn,True,arabs are subhuman and women hate them almost just as much as indians,arabs are subhuman and women hate them almost,1.0,1.0
dh5nwbp,True,do you still believe all muslims are radical and hate you? yes,do you still believe all muslims are radical and hate you? yes,1.0,1.0
dtamit6,True,hey dude i dont hate jews turns out of my fellow arabs are hell much worse then them,hate jews turns out of my fellow arabs are hell much worse then them,1.0,1.0
fztlwxl,True,i mean those arabs are rich as fuck so im sure theyd want to ride this,i mean those arabs are rich as fuck so im sure,1.0,1.0
g014kgu,True,theyre not really fucking the middle east since the arabs are getting crazy rich off of america and they were very poor before america came.,really fucking the middle east since the arabs are getting crazy rich off of america,1.0,1.0
fv3be1k,True,where is muslim solidarity? the rich arabs are doing this its not our problem. if we help the others will say its western imperialism.,where is muslim solidarity? the rich arabs are doing this its not our problem.,1.0,1.0
frpparj,True,arabs are rich russians,arabs are rich russians,1.0,1.0
fndexnm,True,i have no doubt that rich arabs are the absolute worst trash ppl on this planet lol,i have no doubt that rich arabs are the absolute worst trash ppl on,1.0,1.0
foo66rv,True,u know that arabs are rich people they pay for the hack service which costmonth andk active subcribers do u think they will get banned ?,u know that arabs are rich people they pay for the,1.0,1.0
fpa34c9,True,hey the arabs are rich as hell,hey the arabs are rich as hell,1.0,1.0
fpnedhl,True,ever wonder why dubai is a hot spot for fake instagirls to visit? arabs are rich and horny apparently.,hot spot for fake instagirls to visit? arabs are rich and horny apparently.,1.0,1.0
erd0l3p,True,i know lots of muslims are you saying they secretly hate me for my sexuality and want to kill me?,i know lots of muslims are you saying they secretly hate me,1.0,1.0
erkk61a,True,muslims are buying and selling black people in libya right now. but theyre not white so the racists at the  nation of islam hate movement dont care.,the racists at the  nation of islam hate movement dont care.,1.0,1.0
errt9u6,True,most of the muslims are of the other brand and hate iran,most of the muslims are of the other brand and hate,1.0,1.0
eoakrj6,True,usa muslims are so bad! they hate lgbt! amp b also usa killing lgbt people gives you a lighter sentence,usa muslims are so bad! they hate lgbt! amp,1.0,1.0
el6y4x4,True,feminists? not a hate group lgbqt? not a hate group muslims are about as much of a hate group as christians are not a hate group.,hate group lgbqt? not a hate group muslims are about as much of a hate,1.0,1.0
elf4o7n,True,i hate to say it but muslims are literally told to kill infidels and non believer over times in the quran..,i hate to say it but muslims are literally told to kill infidels and,1.0,1.0
eiv785d,True,and the muslims are laughing at the dhimeni infidels.they hate our guts you idiots their holy book teaches nothing but hatred for non muslims,and the muslims are laughing at the dhimeni infidels.they hate,1.0,1.0
eiw2g46,True,also dont tell them that muslims are the second most popular religious-based hate crime targets.,also dont tell them that muslims are the second most popular religious-based hate,1.0,1.0
fczqskz,True,arabs are rich but it could be that dutch and scandinavians are weak men now. arabs dont give a fuck about anything girls like that,arabs are rich but it could be that,1.0,1.0
egr8wj6,True,well hating muslims isnt racist but a lot of people who hate muslims are also racist.,but a lot of people who hate muslims are also racist.,1.0,1.0
egz7hlg,True,isis and muslims are todays nazi party. filled with hate and trying to kill everyone thats not a muslim.,isis and muslims are todays nazi party. filled with hate,1.0,1.0
f40i3ms,True,what? oil rich arabs are diversifying hugely in investments.,what? oil rich arabs are diversifying hugely in investments.,1.0,1.0
f6nf8le,True,gulf arabs are insanely rich.,gulf arabs are insanely rich.,1.0,1.0
eekoy97,True,its not that i hate muslims id just rather not live near them. the amount of attacks by muslims are horrific,its not that i hate muslims id just rather not live near them.,1.0,1.0
ezwwaye,True,those rich arabs are known for doing crazier stuff and they have connections my friend.,those rich arabs are known for doing crazier stuff and,1.0,1.0
ea6fmi0,True,youre assuming all christians muslims are filled with hate when its just the vocal fringe groups that are.,youre assuming all christians muslims are filled with hate when its just,1.0,1.0
eu6n1oq,True,rich arabs are pushing me out of the betabux game,rich arabs are pushing me out of the betabux,1.0,1.0
eur9ack,True,looks like those rich arabs are fasting again,looks like those rich arabs are fasting again,1.0,1.0
e83nlrf,True,the thing muslims hate most after jews is other muslims. because muslims are just a poor mans jew,the thing muslims hate most after jews is other muslims.,1.0,1.0
e6gj6se,True,no one teaches us to hate muslims. muslims are taught to conquer and convert all unbelievers and some unbelievers simply point that open fact out,no one teaches us to hate muslims. muslims are taught to conquer and convert all,1.0,1.0
e2t4laq,True,aint your family muslim? as much as i hate them muslims are pretty based. i thought only bengali hindus are cucks.,muslim? as much as i hate them muslims are pretty based. i thought only bengali,1.0,1.0
ek9mp3u,True,rich arabs are cool with slavery.,rich arabs are cool with slavery.,1.0,1.0
ek9yjnl,True,rich arabs are cool with everything. i live in a college town that rich arabs like to go to,rich arabs are cool with everything. i live in,1.0,1.0
eka97c1,True,fair enough. i did generalize in my statement. its fair to say that not of rich arabs are cool with slavery then.,fair to say that not of rich arabs are cool with slavery then.,1.0,1.0
ekfr5nk,True,even other arabs assume gulf arabs are rich. i know they arent but sometimes we just picture them in ferraris with pet ligers. sorry lol,even other arabs assume gulf arabs are rich. i know,1.0,1.0
ekhxjmj,True,because filthy rich arabs are so respectful of women.,because filthy rich arabs are so respectful of women.,1.0,1.0
eko02tl,True,no. theyre incels. only the rich gulf arabs are happy.,no. theyre incels. only the rich gulf arabs are happy.,1.0,1.0
dxyz569,True,doesnt change the fact that hate crimes against jews perpetrated by muslims are on the rise in germany. please try shifting the goalposts.,that hate crimes against jews perpetrated by muslims are on the rise in germany. please,1.0,1.0
dwg7lv0,True,why are people rushing to try to obscure the obvious. hate crimes against jews from muslims are common in france.,the obvious. hate crimes against jews from muslims are common in france.,1.0,1.0
ea5tuiz,True,they will get there. yeah there being london where all the rich arabs are bringing their families buying up property renting them out as hotels.,there being london where all the rich arabs are bringing their families buying up property,1.0,1.0
duzp253,True,hes in the uk now. hes on some sort of hate watch list in sweden.while the muslims are throwing grenades at cops and gang raping children,of hate watch list in sweden.while the muslims are throwing grenades at cops and gang,1.0,1.0
dv3s6wq,True,commies are bad they hate our freedom. muslims are bad they hate our freedom.,commies are bad they hate our freedom. muslims are bad they hate our freedom.,1.0,1.0
dt238tg,True,muslims are taught to hate jews,muslims are taught to hate jews,1.0,1.0
dtdev0v,True,i wish my dog was that well trained. they all went down without a dog biscuit. and muslims are supposed to hate dogs.,went down without a dog biscuit. and muslims are supposed to hate dogs.,1.0,1.0
e57jsb3,True,rich arabs come to bosnia with slaves. that poor creatures are starving while the dirty fat arabs are eating in front of them,rich arabs come to bosnia with slaves. that poor,1.0,1.0
dp11qr0,True,exactly! hate islam not muslims. islam is evil muslims are misguidedwrong. we just cant mass-immigrate so many people that follow an evil ideology.,exactly! hate islam not muslims. islam is evil muslims are,1.0,1.0
dp6r6oo,True,actually terrorist muslims are better than us. they actually hate american and american values.,actually terrorist muslims are better than us. they actually hate,1.0,1.0
e0uclqs,True,these rich arabs are gonna be the first guys to completely domesticate the cheetah,these rich arabs are gonna be the first guys to,1.0,1.0
dnge36p,True,except more evangelicals hate gays than muslims at least in america.,except more evangelicals hate gays than muslims at least in america.,1.0,1.0
dno7rem,True,muslims hate the west -we hate the west -ergo muslims are good,muslims hate the west -we hate the west,1.0,1.0
dnq3rjs,True,no. muslims are brainwashed from birth to hate dogs. in the quran dogs are dirty animals and unfit to be around humans.,no. muslims are brainwashed from birth to hate dogs.,1.0,1.0
dnq7rv0,True,false. both hate them but most muslims are arab and arabs and israelis dont like each other.,both hate them but most muslims are arab and arabs and israelis dont like each,1.0,1.0
dytsray,True,arabs are rich ny women from thes.,arabs are rich ny women from thes.,1.0,1.0
dz5li3v,True,one arab one billion looks right. arabs are rich.,one arab one billion looks right. arabs are rich.,1.0,1.0
dza5e1c,True,save as much cash as you can. arabs are filthy rich and have no idea how to money,save as much cash as you can. arabs are filthy rich and have no idea,1.0,1.0
dzbbpm0,True,rich arabs are stupidly rich.,rich arabs are stupidly rich.,1.0,1.0
dm61yb7,True,hating dogs is a new one. muslims are bad therefore they hate all good things.,hating dogs is a new one. muslims are bad therefore they hate all good,1.0,1.0
dwcmi88,True,forget helping them filthy rich arabs are using poor muslims as slaves they beat them torture or even kill them,forget helping them filthy rich arabs are using poor muslims as slaves they,1.0,1.0
dku1nx6,True,man these people assuming that white people hate muslims are so stupid! i hate muslims btw,these people assuming that white people hate muslims are so stupid! i hate muslims btw,1.0,1.0
dkxmrvw,True,you forgot to add muslims. the only reason the left and muslims are aligned is because they hate america and christians.,muslims. the only reason the left and muslims are aligned is because they hate america,1.0,1.0
dt5uwit,True,thats a new thing apparently. rich gulf arabs are investing in northern region and buying property. not sure why there tho.,thats a new thing apparently. rich gulf arabs are investing in northern region and buying,1.0,1.0
duhlh3m,True,yes rich arab is the best kind of arab. poor arabs are like. meh.,yes rich arab is the best kind of arab. poor,1.0,1.0
ds3yho7,True,i dont think all arabs are degenerates but rich arabs have a reputation for being gross with white women. and thats for a reason.,i dont think all arabs are degenerates but rich arabs have a,1.0,1.0
dgvp83e,True,muslims are all pedophiles who hate women!  so why do we hate them again? pol,muslims are all pedophiles who hate women! ,1.0,1.0
dgwuvq8,True,muslims are probably a lot more conservative. hate gays hate women extremely religious. but theyve got brown skin so its ok lol.,muslims are probably a lot more conservative. hate,1.0,1.0
dh0ub12,True,yeah i hate that all these dirty muslims are raping me all the time s,yeah i hate that all these dirty muslims are raping me all the time s,1.0,1.0
dpenurr,True,i know youre trying to be a good whitey but you just dont fucking get it rich arabs are the biggest fucking degenerates,you just dont fucking get it rich arabs are the biggest fucking degenerates,1.0,1.0
dmaksn4,True,yes but i feel they can make a bigger difference in their home legs. these rich arabs are used to play in empty stadiums with perfect pitches.,difference in their home legs. these rich arabs are used to play in empty stadiums,1.0,1.0
dmea18m,True,this rich arabs are just like rednecks,this rich arabs are just like rednecks,1.0,1.0
dkw0ulr,True,i for one am just happy that rich arabs are wasting so much money.,for one am just happy that rich arabs are wasting so much money.,1.0,1.0
dlayral,True,when rich arabs are looking up caucasian sex slaves resale value isnt something too high on their priorities.,when rich arabs are looking up caucasian sex slaves resale,1.0,1.0
fvy0mb5,True,arabs are lazy and fat thats why they have slaves and maids,arabs are lazy and fat thats why they,1.0,1.0
fp76imz,True,arabs are fat and lazy so they hire foreign workers to do their job and they treat them badly like slaves,arabs are fat and lazy so they hire,1.0,1.0
fp7bo5w,True,not all arabs are likes but its true that many arab are fatlazy and treat their foreign workers especially the gulf arabs,are likes but its true that many arab are fatlazy and treat their foreign workers,1.0,1.0
fjnujzm,True,air conditioning because itsc here and most of us arabs are lazy lol,because itsc here and most of us arabs are lazy lol,1.0,1.0
emoen1w,True,we rich muslims are too lazy to cook. so we get a housemaid,we rich muslims are too lazy to cook. so we,1.0,1.0
f4yqlrh,True,arabs are lazy they pay southasians to build their towers.,arabs are lazy they pay southasians to build,1.0,1.0
dtpvhkg,True,indeed. at least a summary. considering its from last week we can say arabs are lazy cmon fellas!,its from last week we can say arabs are lazy cmon fellas!,1.0,1.0
dqwbb2v,True,jews are hard working and arabs are lazy that is why they control a lot,jews are hard working and arabs are lazy that is why they control,1.0,1.0
dizn92b,True,blacks are criminals muslims are terrorists jews are rich,blacks are criminals muslims are terrorists jews are rich,1.0,1.0
dl3w9tm,True,for example arabs are lazy just an example  im an arab this isnt true ha! just what a lazy arab would say! sidenote never heard that stereotype,for example arabs are lazy just an example  im,1.0,1.0
feg1zhe,True,im going to take a pass on it thanks. not too keen on having by babies stolen because the muslims are too lazy to fight for themselves.,on having by babies stolen because the muslims are too lazy to fight for themselves.,1.0,1.0
fc5o3kv,True,muslims are lazy pieces of shit,muslims are lazy pieces of shit,1.0,1.0
f8a43iw,True,all muslims are terrorists all white kids are school shooters all americans are lazy fatasses etc etc. ok boomer?,all muslims are terrorists all white kids are school,1.0,1.0
fmzjeyw,True,arabs are so flashy and cool god i wish to be an arab,arabs are so flashy and cool god i,1.0,1.0
ev30ks4,True,of course. muslims are lazy and not the brightest.,of course. muslims are lazy and not the brightest.,1.0,1.0
enm6t83,True,no but implying that all muslims are lazy and mooch off the government and cause crime is overt islamaphobia,no but implying that all muslims are lazy and mooch off the government,0.0,1.0
e90noxq,True,lazy muslims are a thing too,lazy muslims are a thing too,1.0,1.0
e5zm3eo,True,lmao if anything muslims are probs the most intellectually lazy people ive met in my whole life.,lmao if anything muslims are probs the most intellectually lazy people,1.0,1.0
e49mqf6,True,yeah all muslims are terrorist all millenials are lazy all gays are degenerates all blacks are criminals,yeah all muslims are terrorist all millenials are lazy all,1.0,1.0
dzy0jxa,True,you piece of filth the muslims are too lazy for these comments.,you piece of filth the muslims are too lazy for these comments.,1.0,1.0
dqrnoxu,True,the truth inevitably ends up being something like black people are lazy or all muslims are terrorists,like black people are lazy or all muslims are terrorists,1.0,1.0
domyi7g,True,mexicans are lazy jews our the source of evil muslims are all terrorists. yup totally true and not racist.,lazy jews our the source of evil muslims are all terrorists. yup totally true and,1.0,1.0
dmjrxuy,True,it is miles better than  muslims are lazy.,it is miles better than  muslims are lazy.,1.0,1.0
dj2cqd7,True,but showing up  work and time. and we all know how lazy muslims are,time. and we all know how lazy muslims are,1.0,1.0
fwey6hu,True,and all muslims are rapists and thieves. we got there! well done!,and all muslims are rapists and thieves. we got there!,1.0,1.0
fsgjw5m,True,not an accident. arabs are well known for still having slaves.,not an accident. arabs are well known for still having slaves.,1.0,1.0
fhf8eir,True,hey! arabs are still doing the slaves thing.,hey! arabs are still doing the slaves thing.,1.0,1.0
fhwhzdg,True,arabs are slaves and always will be,arabs are slaves and always will be,1.0,1.0
fhxkgfl,True,arabs are okay with sex slaves they kill innocent people for virgin,arabs are okay with sex slaves they kill,1.0,1.0
esttyai,True,1 most true muslims are terrorists. 2 muslim immigrants are often rapists and thieves. ive seen it with my eyes and butt.,1 most true muslims are terrorists. 2 muslim immigrants are often,1.0,1.0
eu9zxto,True,we arabs are the perfect slaves imo.,we arabs are the perfect slaves imo.,1.0,1.0
eeiu50q,True,arabs are still buying slaves from africa. that slave trade never ended just the atlantic.,arabs are still buying slaves from africa. that,1.0,1.0
e96bl2k,True,lmfao yes it does. just like how mexicans are rapists and muslims are terorists and democrats hate america,just like how mexicans are rapists and muslims are terorists and democrats hate america,1.0,1.0
e0for51,True,no its in place because the uk has no free speech and telling people the truth about how muslims are rapists and terrorists is seen as a hate crime.,and telling people the truth about how muslims are rapists and terrorists is seen as,1.0,1.0
dy7dtkv,True,the arabs are still using slaves in large parts but nobody cares about that. it has to be whitey how else are they supposed to get money?,the arabs are still using slaves in large parts,1.0,1.0
dlse6qk,True,saudi arabs are still selling castrated black slaves today,saudi arabs are still selling castrated black slaves today,1.0,1.0
fvy87d9,True,muslims are slaves to hindus,muslims are slaves to hindus,1.0,1.0
fw169dy,True,did you know that the majority of muslims are shitty people? mohammed owned slaves and raped kidsand they worship him!,did you know that the majority of muslims are shitty people? mohammed owned slaves and,1.0,1.0
fav072z,True,nah muslims are not that violent. they would just turn them into sexual slaves and treat them like property.,nah muslims are not that violent. they would just,1.0,1.0
f1ojlsv,True,most muslims are slaves women.,most muslims are slaves women.,1.0,1.0
es2y2mt,True,since muslims are slaves to system. no.,since muslims are slaves to system. no.,1.0,1.0
egtgc2o,True,muslims are allowed to have sex slaves and they are allowed to have sex with year olds. put these two facts together and you get your answer.,muslims are allowed to have sex slaves and,1.0,1.0
ecs78c2,True,muslims are selling black slaves today in libya and youre concerned about a picture from over a century ago?,muslims are selling black slaves today in libya,1.0,1.0
fijl5x5,True,congratulations your status has now been upgraded from islamic jihadist to year old shooter on the news. muslims are gonna be proud of ya.,your status has now been upgraded from islamic jihadist to year old shooter on the,1.0,1.0
eit1zf5,True,must be thrilled cheering the mass shooter killing muslims are ya?,be thrilled cheering the mass shooter killing muslims are ya?,1.0,1.0
dq28jih,True,i remember muslims in social media praising the orlando shooter so why wouldnt they also praise this? muslims are dangerous.,i remember muslims in social media praising the orlando shooter,1.0,1.0
dsw9d4m,True,i kinda agree with you buddy but  as more and more non muslim people are forced to wear a hijab this one is fucking ridiculous,but  as more and more non muslim people are forced to wear a hijab,1.0,1.0
fs85xc9,True,that muslims are terrorists that every muslim country is oppressive to women and the hijab is oppressive,that muslims are terrorists that every muslim country is,1.0,1.0
ff4t498,True,muslims are backwards and the hijab is a tool of oppression,muslims are backwards and the hijab is a,1.0,1.0
ej37e6h,True,liberals? this is a hijab jihadi. she knows that islam is to blame for all muslim terror and muslims are to blame for islam.,is a hijab jihadi. she knows that islam is to blame for all muslim terror,1.0,1.0
dhzx6nl,True,yet they didnt wear hijab when they were in saudi but this is okay because god muslims are awful and they are oppressed . hypocrisy at its finest,saudi but this is okay because god muslims are awful and they are oppressed .,1.0,1.0
erqi536,True,you forgot we arent allowed to criticise islam. only christianty is allowed. islamic people are universally oppressed dont you know.,to criticise islam. only christianty is allowed. islamic people are universally oppressed dont you know.,1.0,1.0
eshtiq3,True,oh and ill defend a illegal immigrant over my own country because islamic people are so oppressed and peaceful,illegal immigrant over my own country because islamic people are so oppressed and peaceful,1.0,1.0
f1atzwq,True,meanwhile sjws  muslims are oppressed. islam good.,meanwhile sjws  muslims are oppressed. islam good.,1.0,1.0
eja0utb,True,the muslims are just as oppressed in saudi and they hate it male and female alike. its a hostile environment.,the muslims are just as oppressed in saudi and,1.0,1.0
e47tmu1,True,chinese muslims are also oppressed in china.jesus dude. my bad muhammad dude get your shit straight. we get it you hate muslims good for you.,chinese muslims are also oppressed in china.jesus dude. my,1.0,1.0
djpuqbm,True,arabs are ruled by patriarchy women have less privilege than male po c so sexism rates higher than racism on privilege meter.,arabs are ruled by patriarchy women have less,1.0,1.0
exgd0mw,True,no where in the post or comments did i say  tiananmen was necessary or  muslims are security threats and need to be detained,say  tiananmen was necessary or  muslims are security threats and need to be,0.0,1.0
eiqaiip,True,right. just like all black peoples are thieves white people are school shooters and muslims are terrorists.,thieves white people are school shooters and muslims are terrorists.,1.0,1.0
frdmkse,True,arab muslims are the biggest bullies and thugs on the planet,arab muslims are the biggest bullies and thugs,1.0,1.0
ff7smyt,True,muslims are street thugs like black mask. jews are the lex luthors,muslims are street thugs like black mask. jews,1.0,1.0
dyhvwf1,True,muslims are the liberals brute squad.,muslims are the liberals brute squad.,1.0,1.0
ex15ecl,True,nice work dickhead. im definitely the one who is saying only islamic people are capable of domestic violence. youre a special breed of dumb.,definitely the one who is saying only islamic people are capable of domestic violence. youre,1.0,1.0
