id,attribute_in_window,comment,comments_processed,bias_sent,bias_phrase
ffc948l,True,damn if the worlds. muslims are all suicide bombers we have a serious problem on our hands.,damn if the worlds. muslims are all suicide bombers we have a,1.0,1.0
ffcbn3p,True,suicide bombers are always muslim does mean muslims are always suicide bombers amp b try to keep up you fucking brainlet.,suicide bombers are always muslim does mean muslims are always suicide bombers amp b try,1.0,1.0
ffqpyvd,True,level expel? you think the muslims are like the jews? theyll bomb everything before it even happened.,level expel? you think the muslims are like the jews? theyll bomb everything,1.0,1.0
fgmm9k6,True,all christians are incels all muslims are suicide bombers we both said basically the same thing,all christians are incels all muslims are suicide bombers we both said basically,1.0,1.0
e2nr1ny,True,it cant be worser than islam thats for sure. our own muslim people are bombing medical graduates,than islam thats for sure. our own muslim people are bombing medical graduates,1.0,1.0
f668h7w,True,kurdish accounts celebrating how arab kids civilians murdered in this bombing. because muslims are terrorist amirite?,kurdish accounts celebrating how arab kids civilians murdered in this bombing. because,1.0,1.0
duk5hut,True,islamic people are da bomb,islamic people are da bomb,1.0,1.0
drujxg5,True,islamic people are violet bombers though,islamic people are violet bombers though,1.0,1.0
ecb2owa,True,because the beliefs of muslims are murder this guys family! also because the response to someone murdering your family is a nuclear bomb?,because the beliefs of muslims are murder this guys family! also because,1.0,1.0
e71skr6,True,i think he know. its just that jokes about muslims are just lol they hate women and love bombs.,he know. its just that jokes about muslims are just lol they hate women and,1.0,1.0
dzpwdp4,True,try to get outside your fox news bubble and try not to excuse the murder of innocents because sean hannity told you muslims are all suicide bombers.,of innocents because sean hannity told you muslims are all suicide bombers.,1.0,1.0
e0572ag,True,the bombings happened because muslims are terrorists.,the bombings happened because muslims are terrorists.,1.0,1.0
dryurbb,True,if only of muslims are radical murderers and suicide bombers thats still.8 million killers roaming the globe.,if only of muslims are radical murderers and suicide bombers thats,1.0,1.0
dsdrqo9,True,they werent bombing and raping and killing innocent people because they were born into the ira. muslims are born into a rape and murder cult.,because they were born into the ira. muslims are born into a rape and murder,1.0,1.0
fb44cp7,True,whats that world peace? yeah no i think arabs are gonna keep murdering each other for the foreseeable future.,that world peace? yeah no i think arabs are gonna keep murdering each other for,1.0,1.0
f0nytz9,True,funny arabs are murdering arabs. but sharon is to blame. whats next bono the butcher of damascus?,funny arabs are murdering arabs. but sharon is to,1.0,1.0
f231yhh,True,arabs are coming to murder my family. yeah definitely not racist.,arabs are coming to murder my family. yeah,1.0,1.0
etqw6mc,False,arabs are invaders and whiners. they complain about israel but murdered and enslaved north africans. awful culture.,arabs are invaders and whiners. they complain about,1.0,1.0
fz7bbhe,True,majority of muslims support murdering people. do you agree that majority of muslims are fucked up?,majority of muslims support murdering people. do you agree that,1.0,1.0
em9tjv8,True,careful people cannot handle decent rational debates when it comes to politics. rationally debate my position that arabs are degenerate murders,to politics. rationally debate my position that arabs are degenerate murders,1.0,1.0
fvntl4t,True,i mean not all muslims are bloodthirsty murderers but it is an islam-ruled collection of countries so they would be muslims.,i mean not all muslims are bloodthirsty murderers but it is an,1.0,1.0
fqakbpx,True,in india muslims are raping and murdering lower caste hindus. is the rape of lower caste hindus only being done by people of one particular religion?,in india muslims are raping and murdering lower caste hindus.,1.0,1.0
fr5y15a,True,but all muslims are murdering child fucking terrorists though right? s,but all muslims are murdering child fucking terrorists though right?,1.0,1.0
fr6714l,True,terrorists kill people doesnt mean all muslims are murderers does it?,terrorists kill people doesnt mean all muslims are murderers does it?,1.0,1.0
frbzptk,True,i doubt most normal muslims are going round just murdering animals for no reason,i doubt most normal muslims are going round just murdering animals for,1.0,1.0
eiqilim,True,anyone that follows a murderous pedophile prophet yes. arabs are welcome muslims no.,that follows a murderous pedophile prophet yes. arabs are welcome muslims no.,1.0,1.0
fkrweod,True,no. just specifically picking on the quaran isnt super helpful considering muslims are murder for their religion regularly.,on the quaran isnt super helpful considering muslims are murder for their religion regularly.,1.0,1.0
ff6acn7,True,and because of people dont get that muslims are called terrorists and murders member of isis are muslims arent,and because of people dont get that muslims are called terrorists and murders member of,1.0,1.0
fapuxxe,True,they just want to complain about christians being homophobic so they can ignore all the gay people muslims are murdering.,they can ignore all the gay people muslims are murdering.,1.0,1.0
faqa2eg,True,muslims are murderous thugs. -someone shut down that ai!!,muslims are murderous thugs. -someone shut down that,1.0,1.0
fbnxzxv,True,christians and muslims are murderers. bye loser,christians and muslims are murderers. bye loser,1.0,1.0
fbpjko3,True,muslims are murderers,muslims are murderers,1.0,1.0
e6hr59i,True,they were murdering each other long before israels founding. arabs are a bunch of in-bred savages -particularly the palestinians.,murdering each other long before israels founding. arabs are a bunch of in-bred savages -particularly,1.0,1.0
f7pilch,True,fuck off jihad shitskin bastard  fucking muslims are scum rapist and murderers. fuck your allah.,fuck off jihad shitskin bastard  fucking muslims are scum rapist and murderers. fuck your,1.0,1.0
f7tt313,True,jews arent socialist either neither are muslims but quite a few muslims are murderers rapists pedos etc though.,jews arent socialist either neither are muslims but quite a few muslims are murderers,1.0,1.0
f7upyh4,True,i was gonna say so do christians but i gotta be honest i dont think theyre murder each other on the scale that muslims are.,murder each other on the scale that muslims are.,1.0,1.0
f8e80wu,True,do christians do this today? and yes i know that muslims are murdering transgenders.,this today? and yes i know that muslims are murdering transgenders.,1.0,1.0
f48fzfb,True,the muslims are doing the murder and rape try reading big boy,the muslims are doing the murder and rape try,1.0,1.0
f49o3pd,True,dont know who killed him? muslims are arrested and have admitted the murder as of now.,dont know who killed him? muslims are arrested and have admitted the murder,1.0,1.0
exf341z,True,christ the irony. reminds me of that couple that went to tour around the me to prove how peaceful muslims are and got murdered instead,around the me to prove how peaceful muslims are and got murdered instead,1.0,1.0
exkepei,True,all catholics are pedophiles all muslims are terrorists all hindus are filthy all politicians are corrupt all doctors are murderers,all catholics are pedophiles all muslims are terrorists all hindus are filthy all,1.0,1.0
ety0ybp,True,muslims are exempt from murder and rape laws there.,muslims are exempt from murder and rape laws,1.0,1.0
euj05rt,True,yep exactly. a lot of innocent muslims are murdered if theyre not their kind of muslim. its messed up.,yep exactly. a lot of innocent muslims are murdered if theyre not their kind,1.0,1.0
euorp0v,True,.so what? i have to explain? really. ok. muslims are murderous scum.,what? i have to explain? really. ok. muslims are murderous scum.,1.0,1.0
ev2vc1f,True,off al muslims are terrorists then all christians are violent mass murderers that dont care about basic morals and empathy,off al muslims are terrorists then all christians are violent,1.0,1.0
dyzoi9o,True,arabs are the invaders and want to murder people man in the universe of neoconnwo the haganah and stern groups among others must have never existed,arabs are the invaders and want to murder,1.0,1.0
erioaor,True,some woman went backpacking through syria or one of them shitholes fo prove muslims are peaceful ended up raped and murdered,or one of them shitholes fo prove muslims are peaceful ended up raped and murdered,1.0,1.0
ersi8s6,True,all muslims are terrorists just not all are murderers. the ones that arent just dont care or pretend to care.,all muslims are terrorists just not all are murderers.,1.0,1.0
ersueob,True,germans should know that only murders committed by muslims are allowed. they are over stepping their bounds.,should know that only murders committed by muslims are allowed. they are over stepping their,1.0,1.0
erzc2as,True,says the american. killss of civilians.  muslims are murders! we never kill anyone. dont be a hypocrite.,says the american. killss of civilians.  muslims are murders! we never kill anyone. dont,0.0,1.0
es226yp,True,so all muslims are educated to rape and murder. i get it now,so all muslims are educated to rape and murder. i,1.0,1.0
dv1ohpf,True,ben  arabs are murderous due to their genetics and should all be exterminated shapiro,ben  arabs are murderous due to their genetics and,1.0,1.0
eo8ct11,True,and those same nations that are accepting inbred muslims are facing crimerape and murder. 112,those same nations that are accepting inbred muslims are facing crimerape and murder. 112,1.0,1.0
eodcagu,True,yahoo is currently running a story about how many muslims are attacked  in us totally trying to downplay islamic murder rates ., in us totally trying to downplay islamic murder rates .,1.0,1.0
eox6om3,True,being half kashmiri pandit myself i dont need to try anything anymore. million hindu murders by muslims are all that i have to know.,try anything anymore. million hindu murders by muslims are all that i have to know.,1.0,1.0
el3vmze,True,yes that is how muslims are volatile murderers and rapists.,yes that is how muslims are volatile murderers and rapists.,1.0,1.0
el4kmkd,True,liberal logic not all muslims are bad! not all minorities are criminals! also liberal logic all white people are racist! all cops are murderers!,liberal logic not all muslims are bad! not all minorities are criminals!,1.0,1.0
elaf7sf,True,theres a difference if you say  islam is bad or if you say  all muslims are murderers and we should kill them first,bad or if you say  all muslims are murderers and we should kill them,0.0,1.0
elh3xof,True,the muslims are going to murder whoever made this.,the muslims are going to murder whoever made this.,1.0,1.0
elh95ge,True,looks like those murderous muslims are at it again.,looks like those murderous muslims are at it again.,1.0,1.0
eiznf7e,True,it is sad how this obvious fact needs to be pointed out. amp b but not quite as sad as the fact that muslims are so murderous.,quite as sad as the fact that muslims are so murderous.,1.0,1.0
egmg8br,True,muslims are required to murder gays. christians are required to pray for them.  this level of moral relativism hmm,muslims are required to murder gays. christians are,1.0,1.0
egq4ul4,True,white couple travels through middle east to show muslims are peaceful are then murdered,couple travels through middle east to show muslims are peaceful are then murdered,1.0,1.0
egtgk0a,True,most muslims are oppressed but live in a place were extremist run the country. most muslims over. are moderates and will not murder anyone.,most muslims are oppressed but live in a place,1.0,1.0
egv5ej1,True,remember american journalist muslims are evil but foreign dictator murderer muslims are a okay,remember american journalist muslims are evil but foreign dictator murderer muslims,1.0,1.0
egxzwa4,True,muslims kill people all muslims are murders. ya ever think maybe youre just not that smart?,muslims kill people all muslims are murders. ya,1.0,1.0
ef2n82m,True,shes one that would go to iraq to show that its not bad over there and that muslims are peaceful. then get raped and murdered. what an idiot.,its not bad over there and that muslims are peaceful. then get raped and murdered.,1.0,1.0
ec9d0le,True,on the girls facebook tribute page a lot of muslims are celebrating their murder and calling them whores,girls facebook tribute page a lot of muslims are celebrating their murder and calling them,1.0,1.0
ec9l3d3,True,the video where he manipulates statistics to convince his viewers that all muslims are evil sociopaths who want to murder them comes to mind,statistics to convince his viewers that all muslims are evil sociopaths who want to murder,0.0,1.0
e5787im,True,given that muslims are an invading hoard of rapists and murderers theres not a lot of sympathy when the goat-fuckers get some hate returned.,given that muslims are an invading hoard of rapists and,1.0,1.0
dzrrges,True,yes and the message is  we arabs are really good at hijacking amp co-opting the jewish narrative for our own nefarious purposes,yes and the message is  we arabs are really good at hijacking amp co-opting,1.0,1.0
ezwtvfi,True,so your saying all muslims are terrorists?? most of the hijackers were saudis our allies.,so your saying all muslims are terrorists?? most of the hijackers were,1.0,1.0
fsb9tfu,True,the guy who accused of being hindu nationalist had no proof he is just an angry arab who cant accept the fact that arabs are criminals,arab who cant accept the fact that arabs are criminals,1.0,1.0
dwuxe0c,True,hes saying that all the hijackers were muslim but not all muslims are hijackers.,the hijackers were muslim but not all muslims are hijackers.,1.0,1.0
fyh9nty,True,so then blacks are criminals whites are snobby. jews are money stealers muslims are terrorists,whites are snobby. jews are money stealers muslims are terrorists,1.0,1.0
g0sff7o,True,all americans are bad just like all muslims are terrorist and all black people are criminals.,all americans are bad just like all muslims are terrorist and all black people are,1.0,1.0
fuqqv46,True,fun fact saying all whites are racist or all whites are nazis is as bad as saying all blacks are criminals or all muslims are terrorists,saying all blacks are criminals or all muslims are terrorists,0.0,1.0
fuqw6kw,True,all cops are bastards all liberals are crybabies all conservatives are rapists all black people are criminals all muslims are terrorists all s,rapists all black people are criminals all muslims are terrorists all s,1.0,1.0
furvihx,True,all muslims are criminals and they should be punished for attrocities of mughals. there i quote the future supreme court judgement.,all muslims are criminals and they should be punished,1.0,1.0
fus5zty,True,abdul taking into account the populations muslims are criminals at a higher rate. read the full thread.,abdul taking into account the populations muslims are criminals at a higher rate. read,1.0,1.0
fut7png,True,by her logic all black people are criminal and all muslims are terrorist,all black people are criminal and all muslims are terrorist,0.0,1.0
fviqpdf,True,with that being said i can now say say statements that arent true about a group of people. all blacks are criminals and all muslims are terrorists.,people. all blacks are criminals and all muslims are terrorists.,1.0,1.0
fvqiczl,True,how naive of you.using the same logic all black people are criminals all white people are racist all muslims are terrorists.,criminals all white people are racist all muslims are terrorists.,0.0,1.0
fi0dsfc,True,muslims are very scary. its criminal in a lot of countries what islam does to people.,criminal in a lot of countries what islam does to people.,1.0,1.0
fiu5i28,True,maybe you calling all right wingers nazis made us nazis? ever thought about that? also all immigrants are criminals and all muslims are terrorists.,also all immigrants are criminals and all muslims are terrorists.,1.0,1.0
fcjs5m8,True,because nobody like muslim victimhood politics when muslims are the real criminals in this case.,because nobody like muslim victimhood politics when muslims are the real criminals in this case.,1.0,1.0
dyhex2q,True,that does not mean are criminal its crazy it is basically saying all adult male black and arabs are criminals.,basically saying all adult male black and arabs are criminals.,0.0,1.0
f6uoro2,True,so? look at how many muslims are criminals also compared to population percentage.,so? look at how many muslims are criminals also compared to population percentage.,1.0,1.0
dxrlo39,True,no there isnt. thinking all arabs are criminal because of the actions of immigrants is just stupid.,no there isnt. thinking all arabs are criminal because of the actions of,0.0,1.0
ev0ufz3,True,you know you are right. the muslims are not so bad as the politicians who protect muslim criminals.,so bad as the politicians who protect muslim criminals.,1.0,1.0
ev8vc3q,True,and what is wrong with muslims? are muslim criminals different or worse then other criminals?,and what is wrong with muslims? are muslim criminals different or worse then other criminals?,1.0,1.0
evg9kg6,True,with your idiotic logic itd be easy to say all muslims are terrorists or all black people are criminals.,logic itd be easy to say all muslims are terrorists or all black people are,0.0,1.0
ewuzz82,True,you mean like how jews are overrepresented in newspapers and media by over and muslims are more likely to be criminals in austria?,in newspapers and media by over and muslims are more likely to be criminals in,0.0,1.0
eryyny7,True,muslims are terrorists black people are lady and mexicans are criminals.,muslims are terrorists black people are lady and,1.0,1.0
esq7to3,True,all blacks are criminals. all muslims are terrorists. all irish are drunks. all liberals hate the country. its fun to generalize.,all blacks are criminals. all muslims are terrorists. all irish are drunks. all,1.0,1.0
etc1ytb,True,you stand up for something that is true you brown muslims are rapist criminals also you why does everyone call me racist?,for something that is true you brown muslims are rapist criminals also you why does,1.0,1.0
fqppykm,True,blacks jews and muslim people are the enemy of the right?,blacks jews and muslim people are the enemy of the right?,1.0,1.0
edgqq7a,True,community service because all muslims are criminals here in europe.,community service because all muslims are criminals here in europe.,1.0,1.0
e6g7184,True,step muslim only prisons. step all muslims are criminals. step all muslims are like. concentrated. in their own camps.,step muslim only prisons. step all muslims are criminals. step all muslims are like.,1.0,1.0
e1yn1lf,True,most muslims are criminals thomas,most muslims are criminals thomas,1.0,1.0
fi9ezk3,True,fuck you you degenerate jewish shill. arabs are just as big of an enemy flooding europe raping children and shitting out mohameds every day.,fuck you you degenerate jewish shill. arabs are just as big of an enemy,1.0,1.0
dwnefjm,True,islam says non muslims are criminals. islam compels apostates to be killed. islam is bad. muslims are not bad though they follow this bad ideology.,islam says non muslims are criminals. islam compels,1.0,1.0
dwqxz73,True,thats what i said in the first place buddy. you have a right to believe in islam which says non muslims are criminals. cheers.,you have a right to believe in islam which says non muslims are criminals. cheers.,1.0,1.0
dq075l7,True,i am a hateful bigot who thinks all muslims are violent criminals. please do not hate me for wanting to strip them of their rights. this woman,am a hateful bigot who thinks all muslims are violent criminals. please do not hate,1.0,1.0
ejxqno1,True,saudis arabs are the enemy iranians persians are not. guess which one is israels ally.,saudis arabs are the enemy iranians persians are not.,1.0,1.0
fykjbe5,True,no the muslims are our enemy we arent done with them yet i feel,no the muslims are our enemy we arent done with,1.0,1.0
fyqvcsd,True,muslims dont treat christians much better. communists and muslims are both our enemy let them kill each other.,dont treat christians much better. communists and muslims are both our enemy let them kill,1.0,1.0
fvfim8b,True,well looking at history muslims are the practical sworn enemy of the jews,well looking at history muslims are the practical sworn enemy of the,1.0,1.0
fvyr52h,True,thats cute i dont watch the news. i just know how to identify the enemy and it just so happens the muslims are one of many.,enemy and it just so happens the muslims are one of many.,1.0,1.0
fxiqosq,True,muslims are natural enemy of humanity never thought id be such a villain at the grown age of fear me! my mum wears a scarf on her head,muslims are natural enemy of humanity never thought,1.0,1.0
fqd9nj6,True,muslims are the enemy of the people youre thinking of liblefts comrade,muslims are the enemy of the people youre,1.0,1.0
fqdyeo7,True,muslims are the enemy.,muslims are the enemy.,1.0,1.0
fqe1l49,True,islam is the enemy muslims are victims of islam,islam is the enemy muslims are victims of,1.0,1.0
frdqbes,True,from day  one i have been saying muslims are muslims worst enemy!,day  one i have been saying muslims are muslims worst enemy!,1.0,1.0
frow01m,True,in both instances the muslims are the enemy. its the same war.,in both instances the muslims are the enemy. its the same war.,1.0,1.0
frwy7jg,True,all muslims are our enemy dumbass,all muslims are our enemy dumbass,1.0,1.0
ftgpfi5,True,read the talmud low iq cuck. rabbinic jews and muslims are both the enemy.,talmud low iq cuck. rabbinic jews and muslims are both the enemy.,1.0,1.0
fngvilc,True,muslims are fine islam is the enemy.,muslims are fine islam is the enemy.,1.0,1.0
foxnmz4,True,islam is the enemy of indian culture ! indian muslims are traitors who follow the savage mythology of foreign invaders ! jai hind !,islam is the enemy of indian culture !,1.0,1.0
fpaatxm,True,i mean muslims are the enemy so.,i mean muslims are the enemy so.,1.0,1.0
fkxfga4,True,u kalbushan yadeav muslims are not our main enemy,u kalbushan yadeav muslims are not our main enemy,1.0,1.0
fmzn4w8,True,isnt it too much. i thought christian and muslims are long term enemy given the history of constantinople and israel.,it too much. i thought christian and muslims are long term enemy given the history,1.0,1.0
e2az699,True,arabs are their own worst enemy.,arabs are their own worst enemy.,1.0,1.0
fhfe27h,True,or the dup who quite recently held the balance of power in the british parliament. but because they dont look like us the muslims are the real enemy.,because they dont look like us the muslims are the real enemy.,1.0,1.0
feolm8i,True,i agree.  some muslims are the enemy not all muslims.,i agree.  some muslims are the enemy not all muslims.,1.0,1.0
fbg84l9,True,refer to this twitter thread. we are in deep deep trouble right now. the muslims are the enemy right now. we have to defeat red.,in deep deep trouble right now. the muslims are the enemy right now. we have,1.0,1.0
fc3akqg,True,no we think muslims are the enemy in this timeline.,no we think muslims are the enemy in this timeline.,1.0,1.0
fdeo3xn,True,she is a muslim muslims are enemy of mankind.,she is a muslim muslims are enemy of mankind.,1.0,1.0
f69594t,True,race baiting blacks wont help us plus muslims are the enemy now.,race baiting blacks wont help us plus muslims are the enemy now.,1.0,1.0
f736dt8,True,no them dirty muslims are the real enemy lets quietly dumb down radical tight wing terrorism and talk about the mosques theyre building !1!!1!!,no them dirty muslims are the real enemy lets quietly dumb,,1.0
f774096,True,muslims are enemy no.. women are no.,muslims are enemy no.. women are no.,1.0,1.0
f0yckxf,True,the enemy is the devil. all muslims are under the influence of the devil.,the enemy is the devil. all muslims are under the influence of the devil.,1.0,1.0
f2ug9l4,True,ive seen old folks use a torn version of the letter to the barbary pirates used to prove that muslims are an enemy of america.,the barbary pirates used to prove that muslims are an enemy of america.,0.0,1.0
ex7nsfj,True,muslims are going to get genocided next. islam is the number 1 enemy to the deep state.,muslims are going to get genocided next. islam is the number 1 enemy to the,1.0,1.0
expxsn3,True,muslims are the new enemy used to be  red indians nazis the japs the red menace the russians technically are still the bogeyman.,muslims are the new enemy used to be,1.0,1.0
ey3dzb2,True,right on. too bad the fanboys here dont seem to understand that observant muslims are the enemy and not good for entertainment.,here dont seem to understand that observant muslims are the enemy and not good for,1.0,1.0
eylxfs0,True,nope muslims are the enemy you wont fix shit till you start to accept that.,nope muslims are the enemy you wont fix shit,1.0,1.0
eyqst90,True,because muslims are an even greater enemy and its better to destabilize the middle east while keeping the holy land in western hands.,because muslims are an even greater enemy and its,1.0,1.0
ezy1c5u,True,it is therefore appropriate that our crusader armies destroy them utterly. america and all of civilized humanity is at war. muslims are the enemy.,all of civilized humanity is at war. muslims are the enemy.,1.0,1.0
evk6dgf,True,muslims are the enemy have been for over a thousand years,muslims are the enemy have been for over,1.0,1.0
